cig,cig_accordo_quadro,n_lotti_componenti,oggetto_gara,oggetto_lotto,importo_lotto,importo_complessivo_gara,provincia,luogo_istat,data_pubblicazione,tipo_scelta_contraente,cf_amministrazione_appaltante,denominazione_amministrazione_appaltante,denominazione_centro_costo,cod_cpv,descrizione_cpv,DURATA_PREVISTA,ESITO,confidenza
6859204A32,6756876E74,1,ACCOGLIENZA CITTADINI STRANIERI RICHIEDENTI PROTEZIONE INTERNAZIONALE - 01.11.2016 - 31.12.2016,ACCOGLIENZA CITTADINI STRANIERI RICHIEDENTI PROTEZIONE INTERNAZIONALE - 01.11.2016 - 31.12.2016,24880.68,24880.68,,,2016-07-20,CONFRONTO COMPETITIVO IN ADESIONE AD ACCORDO QUADRO/CONVENZIONE,01409210133,COMUNITA' MONTANA VALSASSINA VALVARRONE VAL D'ESINO RIVIERA,SERVIZI ALLA PERSONA,85311000-2,SERVIZI DI ASSISTENZA SOCIALE CON ALLOGGIO,,,certa
6764723A02,,1,ACCOGLIENZA MSNA PRESSO L'ASSOCIAZIONE IL FAVO DI CALTAGIRONE GENNAIO -DICEMBRE2016,ACCOGLIENZA MSNA PRESSO L'ASSOCIAZIONE IL FAVO DI CALTAGIRONE GENNAIO -DICEMBRE2016,84100.0,84100.0,SIRACUSA,089001,2016-07-25,AFFIDAMENTO DIRETTO,CFAVCP-0000FE3,CENTRALE DI COMMITTENZA MODICA-SCICLI,VII SETTORE - SERVIZI SOCIALI- C.U.C.,85311000-2,SERVIZI DI ASSISTENZA SOCIALE CON ALLOGGIO,,AGGIUDICATA,certa
6757702819,,8,AFFIDAMENTO NEL TERRITORIO DELLA PROVINCIA DI CASERTA DEL SERVIZIO DI ACCOGLIENZA E ASSISTENZA CITTADINI STRANIERI RICHIEDENTI ASILO DALLA DATA PRESUNTA DELL'1/102016 AL 31/12/2016,SERVIZIO DI ACCOGLIENZA CITTADINI STRANIERI RICHIEDENTI ASILO AMBITO TERRITORIALE SANITARIO PROVINCIA CASERTA C02-C05,579600.0,4636800.0,,061022,2016-07-20,PROCEDURA APERTA,80002190611,MINISTERO INTERNO PREFETTURA CASERTA,UFFICIO RAGIONERIA,85310000-5,SERVIZI DI ASSISTENZA SOCIALE,,,certa
6755098337,65632136B3,1,SERVIZIO ACCOGLIENZA CITTADINI STRANIERI,SERVIZIO ACCOGLIENZA CITTADINI STRANIERI,356989.44,356989.44,,,2016-07-04,AFFIDAMENTO DIRETTO IN ADESIONE AD ACCORDO QUADRO/CONVENZIONE,80003790443,UFFICIO TERRITORIALE DEL GOVERNO,PREFETTURA DI ASCOLI PICENO,85311300-5,SERVIZI DI ASSISTENZA SOCIALE PER BAMBINI E GIOVANI,,,probabile
6752786F47,,2,"SERVIZIO DI ACCOGLIENZA PER UN MASSIMO DI 225 PRESENZE PRO DIE DI CITTADINI STRANIERI TEMPORANEAMENTE PRESENTI SUL TERRITORIO (UOMINI, DONNE E FAMIGLIE) - PRESSO STRUTTURE NELLA DISPONIBILITÀ DELL'AMMINISTRAZIONE COMUNALE ",Oggetto non pubblicabile a causa della potenziale presenza di dati personali,74400.0,223200.0,MILANO,015146,2016-07-15,PROCEDURA NEGOZIATA SENZA PREVIA PUBBLICAZIONE,01199250158,COMUNE DI MILANO,D.C. POLITICHE SOCIALI E CULTURA DELLA SALUTE - SERVIZIO POLITICHE PER L'IMMIGRAZIONE,85311000-2,SERVIZI DI ASSISTENZA SOCIALE CON ALLOGGIO,,AGGIUDICATA,probabile
6747764EFE,65183318E6,1,CONVENZIONE PER L'ACCOGLIENZA DI CITTADINI STRANIERI RICHIEDENTI PROTEZIONE INTERNAZIONALE,CONVENZIONE PER L'ACCOGLIENZA DI CITTADINI STRANIERI RICHIEDENTI PROTEZIONE INTERNAZIONALE,293913.6,293913.6,,,2016-07-07,AFFIDAMENTO DIRETTO IN ADESIONE AD ACCORDO QUADRO/CONVENZIONE,90035050021,PREFETTURA DI BIELLA - U.T.G.,U.T.G.PREFETTURA DI BIELLA,55130000-0,ALTRI SERVIZI ALBERGHIERI,,AGGIUDICATA,certa
