cig,cig_accordo_quadro,n_lotti_componenti,oggetto_gara,oggetto_lotto,importo_lotto,importo_complessivo_gara,provincia,luogo_istat,data_pubblicazione,tipo_scelta_contraente,cf_amministrazione_appaltante,denominazione_amministrazione_appaltante,denominazione_centro_costo,cod_cpv,descrizione_cpv,DURATA_PREVISTA,ESITO,confidenza
6875029D65,,1,SERVIZI DI ACCOGLIENZA PER RICHIEDENTI E BENEFICIARI DI PROTEZIONE INTERNAZIONALE E PER TITOLARI DI PERMESSO UMANITARIO - SPRAR COMUNE DI IVREA,SERVIZI DI ACCOGLIENZA PER RICHIEDENTI E BENEFICIARI DI PROTEZIONE INTERNAZIONALE E PER TITOLARI DI PERMESSO UMANITARIO - SPRAR COMUNE DI IVREA,1969609.0,1969609.0,,001125,2016-11-25,PROCEDURA APERTA,CFAVCP-00007E5,"ASSOCIAZIONE CONSORTILE FRA I COMUNI DI IVREA, BANCHETTE, CASCINETTE DU2019IVREA, FIORANO CANAVESE, MONTALTO DORA E SAMONE",COMUNE DI IVREA,85311000-2,SERVIZI DI ASSISTENZA SOCIALE CON ALLOGGIO,,,certa
6880454A40,,1,PROGETTO SPRAR DENOMINATO BABEL - POSTI AGGIUNTIVI,PROGETTO SPRAR DENOMINATO BABEL - POSTI AGGIUNTIVI,102480.0,102480.0,,088006,2016-11-23,AFFIDAMENTO DIRETTO,00175500883,COMUNE DI MODICA,"IX SETTORE- SERVIZI SOCIALI, SPORT, PUBBLICA ISTRUZIONE, BIBLIOTECA, MUSEO, PROGETTI EUROPEI",85311300-5,SERVIZI DI ASSISTENZA SOCIALE PER BAMBINI E GIOVANI,,,certa
6875125C9E,,1,PROGETTO SPRAR N. 8 POSTI AGGIUNTIVI CONTRATTO REP. 7966/20014 CATEGORIA DM/DS,PROGETTO SPRAR N. 8 POSTI AGGIUNTIVI CONTRATTO REP. 7966/20014 CATEGORIA DM/DS,102480.0,102480.0,AGRIGENTO,084001,2016-11-18,PROCEDURA NEGOZIATA SENZA PREVIA INDIZIONE DI GARA (SETTORI SPECIALI),00074260845,COMUNE DI AGRIGENTO,UFFICIO SERVIZIO SOCIALE,85311200-4,SERVIZI DI ASSISTENZA SOCIALE PER DISABILI,,AGGIUDICATA,certa
6967959DA8,67645424A6,1,SERVIZIO DI PRIMA ACCOGLIENZA DI CITTADINI STRANIERI RICHIEDENTI PROTEZIONE INTERNAZIONALE E LA GESTIONE DEI SERVIZI CONNESSI'. PERIODO 01/01/2017 -30/04/2017.,SERVIZIO DI 'PRIMA ACCOGLIENZA DI CITTADINI STRANIERI RICHIEDENTI PROTEZIONE INTERNAZIONALE E LA GESTIONE DEI SERVIZI CONNESSI'. PERIODO 01/01/2017 -30/04/2017.,54444.0,54444.0,VARESE,012133,2016-11-07,AFFIDAMENTO DIRETTO IN ADESIONE AD ACCORDO QUADRO/CONVENZIONE,80202230589,MINISTERO INTERNO DIPARTIMENTO DELLA P.S.,UTG - PREFETTURA DI VARESE,85311000-2,SERVIZI DI ASSISTENZA SOCIALE CON ALLOGGIO,,AGGIUDICATA,certa
6858905376,,1,GARA ACCOGLIENZA MIGRANTI INDETTA IL 7 NOVEMBRE 2016,GARA ACCOGLIENZA MIGRANTI INDETTA IL 7 NOVEMBRE 2016,201600.0,201600.0,,061022,2016-11-07,PROCEDURA NEGOZIATA SENZA PREVIA PUBBLICAZIONE,80002190611,MINISTERO INTERNO PREFETTURA CASERTA,UFFICIO RAGIONERIA,85310000-5,SERVIZI DI ASSISTENZA SOCIALE,,,probabile
686726130D,6759114552,1,ACCOGLIENZA INTEGRATA PER RICHIEDENTI ASILO E TITOLARI DI PROTEZIONE INTER. E UMANITARIA,ACCOGLIENZA INTEGRATA PER RICHIEDENTI ASILO E TITOLARI DI PROTEZIONE INTER. E UMANITARIA,1248300.0,1248300.0,TORINO,001272,2016-11-14,CONFRONTO COMPETITIVO IN ADESIONE AD ACCORDO QUADRO/CONVENZIONE,00514490010,COMUNE DI TORINO,07 - DIVISIONE SERVIZI SOCIALI / SOCIO SANITARI / ABITATIVI E LAVORO,85311300-5,SERVIZI DI ASSISTENZA SOCIALE PER BAMBINI E GIOVANI,,AGGIUDICATA,certa
68668629C7,,1,PROCEDURA APERTA PER LA INDIVIDUAZIONE DI UN SOGGETTO PER L'AFFIDAMENTO DELLA GESTIONE ED ORGANIZZAZIONE DEI SERVIZI DI ACCOGLIENZA DI RICHIEDENTI/TITOLARI DI PROTEZIONE INTERNAZIONALE E DEI LORO FAMILIARI BENEFICIARI DI PROTEZIONE UMANITARIA NELL'AMBITO DEL SISTEMA DI PROTEZIONE PER RICHIEDENTI ASILO E RIFUGIATI (SPRAR) PER IL TRIENNIO 2017-2019 IN CONTINUITA' CON IL PROGETTO 'SPRAR SENIGALLIA' AI SENSI DEL DECRETO MINISTERIALE 10 AGOSTO 2016 (GU N. 200 DEL 27.08.2016) - CAPO II - ART. 14. ,PROCEDURA APERTA PER LA INDIVIDUAZIONE DI UN SOGGETTO PER L'AFFIDAMENTO DELLA GESTIONE ED ORGANIZZAZIONE DEI SERVIZI DI ACCOGLIENZA DI RICHIEDENTI/TITOLARI DI PROTEZIONE INTERNAZIONALE E DEI LORO FAMILIARI BENEFICIARI DI PROTEZIONE UMANITARIA NELL'AMBITO DEL SISTEMA DI PROTEZIONE PER RICHIEDENTI ASILO E RIFUGIATI (SPRAR) PER IL TRIENNIO 2017-2019 IN CONTINUITA' CON IL PROGETTO 'SPRAR SENIGALLIA' AI SENSI DEL DECRETO MINISTERIALE 10 AGOSTO 2016 (GU N. 200 DEL 27.08.2016) - CAPO II - ART. 14. ,2002580.42,2002580.42,,,2016-11-19,PROCEDURA APERTA,CFAVCP-0000891,"CONVENZIONE TRA I COMUNI DI SENIGALLIA, ARCEVIA, BARBARA, OSTRA, OSTRA VETERE E SERRA DE' CONTI",CUC-UFFICIO COMUNE ESERCIZIO ASSOCIATO FUNZIONE SOCIALE,85311000-2,SERVIZI DI ASSISTENZA SOCIALE CON ALLOGGIO,,,certa
