cig,cig_accordo_quadro,n_lotti_componenti,oggetto_gara,oggetto_lotto,importo_lotto,importo_complessivo_gara,provincia,luogo_istat,data_pubblicazione,tipo_scelta_contraente,cf_amministrazione_appaltante,denominazione_amministrazione_appaltante,denominazione_centro_costo,cod_cpv,descrizione_cpv,DURATA_PREVISTA,ESITO,confidenza
B4F53CFA4B,,1,SERVIZIO DI SUPERVISIONE PSICOLOGICA EQUIPE MULTIDISCIPLINARE NELL'AMBITO DEL PROGETTO SAI 2025-2026,SERVIZIO DI SUPERVISIONE PSICOLOGICA EQUIPE MULTIDISCIPLINARE NELL'AMBITO DEL PROGETTO SAI 2025-2026,11800.0,11800.0,CREMONA,019116,2024-12-30,AFFIDAMENTO DIRETTO,01695750198,COMUNE DI PIADENA DRIZZONA,COMUNE DI PIADENA DRIZZONA,98350000-1,SERVIZI CONNESSI ALLE INFRASTRUTTURE COLLETTIVE,,AGGIUDICATA,certa
B4308FA13B,,1,SERVIZIO DI ACCOGLIENZA RESIDENZIALE DI UN MINORE STRANIERO NON ACCOMPAGNATO - PERIODO 11.11.2024 - 03.06.2025,SERVIZIO DI ACCOGLIENZA RESIDENZIALE DI UN MINORE STRANIERO NON ACCOMPAGNATO - PERIODO 11.11.2024 - 03.06.2025,24090.0,24090.0,UDINE,030129,2024-12-02,AFFIDAMENTO DIRETTO,00168650307,COMUNE DI UDINE,SERVIZIO SERVIZI PER LA SALUTE ED IL BENESSERE SOCIALE,85311000-2,SERVIZI DI ASSISTENZA SOCIALE CON ALLOGGIO,,AGGIUDICATA,certa
B428581298,,1,"ACCOGLIENZA MSNA PERIODO OTTOBRE 2024 - CASI N. 5, 17 E 33","ACCOGLIENZA MSNA PERIODO OTTOBRE 2024 - CASI N. 5, 17 E 33",15949.5,15949.5,TRIESTE,032006,2024-12-16,AFFIDAMENTO DIRETTO,00111990321,COMUNE DI MUGGIA,SERVIZIO SOCIALE DEI COMUNI AMBITO 1.3,85311300-5,SERVIZI DI ASSISTENZA SOCIALE PER BAMBINI E GIOVANI,,AGGIUDICATA,certa
B4D844B8F7,,1,AFFIDAMENTO SERVIZIO ACCOGLIENZA UCRAINA LIVING HOTEL GENNAIO-GIUGNO 25,SERVIZIO ACCOGLIENZA MIGRANTI,125400.0,125400.0,BOLOGNA,037006,2024-12-17,AFFIDAMENTO DIRETTO,80070330370,PREFETTURA DI BOLOGNA,UFFICIO CONTRATTI E APPALTI,85310000-5,SERVIZI DI ASSISTENZA SOCIALE,,AGGIUDICATA,probabile
B4A88B35C5,9508875BE0,1,SAI ORDINARI CAPS CONTRATTO ORDINATIVO ATTUATIVO PROG-599-PR-3 RELATIVO ALLA PROCEDURA APERTA PER L'AFFIDAMENTO DELLA GESTIONE TRIENNALE DEL SERVIZIO DENOMINATO SAI - SISTEMA DI ACCOGLIENZA E INTEGRAZIONE PER IL TRIENNIO 2023-2025 CIG PADRE 9508875BE0 - CUP J91H22000190001 - CPV 85311000-5 ,SAI ORDINARI CAPS CONTRATTO ORDINATIVO ATTUATIVO PROG-599-PR-3 RELATIVO ALLA PROCEDURA APERTA PER L'AFFIDAMENTO DELLA GESTIONE TRIENNALE DEL SERVIZIO DENOMINATO SAI - SISTEMA DI ACCOGLIENZA E INTEGRAZIONE PER IL TRIENNIO 2023-2025 CIG PADRE 9508875BE0 - CUP J91H22000190001 - CPV 85311000-5 ,687660.0,687660.0,BARI,072006,2024-12-05,AFFIDAMENTO DIRETTO,80015010723,COMUNE DI BARI,RIPARTIZIONE SERVIZI ALLA PERSONA,85311000-2,SERVIZI DI ASSISTENZA SOCIALE CON ALLOGGIO,,AGGIUDICATA,certa
B4EAEDCB78,,2,"GARA EUROPEA A PROCEDURA APERTA PER LAFFIDAMENTO TRAMITE ACCORDO QUADRO QUADRIENNALE EX ART. 59 D.LGS. 36/2023 SUDDIVISO IN DUE LOTTI, CON UN UNICO OPERATORE ECONOMICO PER CIASCUN LOTTO, PER SERVIZI DI ACCOGLIENZA INTEGRATA PER MIGRANTI.CUI ACCORDO QUADRO S00351040423202400038",LOTTO 2: ACCOGLIENZA INTEGRATA PER MIGRANTI - CATEGORIA MINORI (COD. 552)CUP E31424000110001CUI S00351040423202400025,8478579.02,12342849.45,ANCONA,042002,2024-12-20,PROCEDURA APERTA,00351040423,COMUNE DI ANCONA,SERVIZIO SERVIZI SOCIALI - EDUCATIVI - SANITA',85310000-5,SERVIZI DI ASSISTENZA SOCIALE,48.0,AGGIUDICATA,probabile
B4AF20C54B,,1,"PROCEDURA APERTA, DA AGGIUDICARSI CON IL CRITERIO DELL'OFFERTA ECONOMICAMENTE PIÙ VANTAGGIOSA INDIVIDUATA SULLA BASE DELLA MIGLIORE OFFERTA TECNICA, AI SENSI DEGLI ARTT. 71 E 108, COMMI 1 E 5, D. LGS. N. 36/2023, PER L'INDIVIDUAZIONE DEL SOGGETTO ATTUATORE AI FINI DELL'AFFIDAMENTO, IN PROSECUZIONE, DEL PROGETTO SAI PROG.-1656-PR-2 ATTIVO NEL COMUNE DI GUILMI PER N. 10 POSTI - CAT. MINORI STRANIERI NON ACCOMPAGNATI M.S.N.A. PER IL PERIODO DAL 01/03/2025 AL 31/12/2026 - CODICE C.U.P. G21B21000540001.","PROCEDURA APERTA CON IL CRITERIO DELL'OFFERTA ECONOMICAMENTE PIÙ VANTAGGIOSA INDIVIDUATA SULLA BASE DELLA MIGLIORE OFFERTA TECNICA PER L'INDIVIDUAZIONE DEL SOGGETTO ATTUATORE AI FINI DELL'AFFIDAMENTO, IN PROSECUZIONE, DEL PROGETTO SAI PROG.-1656-PR-2 ATTIVO NEL COMUNE DI GUILMI PER N. 10 POSTI - CAT. M.S.N.A. PER IL PERIODO DAL 01/03/2025 AL 31/12/2026 - CODICE C.U.P. G21B21000540001.",547311.38,547311.38,CHIETI,069044,2024-12-10,PROCEDURA APERTA,02101210694,UNIONE COMUNI DEL SINELLO,COMUNE DI GUILMI,85311000-2,SERVIZI DI ASSISTENZA SOCIALE CON ALLOGGIO,,,certa
B4EAEDBAA5,,2,"GARA EUROPEA A PROCEDURA APERTA PER LAFFIDAMENTO TRAMITE ACCORDO QUADRO QUADRIENNALE EX ART. 59 D.LGS. 36/2023 SUDDIVISO IN DUE LOTTI, CON UN UNICO OPERATORE ECONOMICO PER CIASCUN LOTTO, PER SERVIZI DI ACCOGLIENZA INTEGRATA PER MIGRANTI.CUI ACCORDO QUADRO S00351040423202400038",LOTTO 1: ACCOGLIENZA INTEGRATA PER MIGRANTI CATEGORIA ORDINARI (COD. 551) CUP E31424000100001 CUI S00351040423202400026,3864270.43,12342849.45,ANCONA,042002,2024-12-20,PROCEDURA APERTA,00351040423,COMUNE DI ANCONA,SERVIZIO SERVIZI SOCIALI - EDUCATIVI - SANITA',85310000-5,SERVIZI DI ASSISTENZA SOCIALE,48.0,AGGIUDICATA,probabile
B495226F75,,1,AFFIDAMENTO ALLA FONDAZIONE REGINA ELENA PER ACCOGLIENZA MINORE - MSNA,AFFIDAMENTO ALLA FONDAZIONE REGINA ELENA PER ACCOGLIENZA MINORE - MSNA,5400.0,5400.0,PALERMO,082027,2024-12-04,AFFIDAMENTO DIRETTO,00110740826,COMUNE DI CEFALU',UFFICIO SERVIZI SOCIALI,85300000-2,SERVIZI DI ASSISTENZA SOCIALE E SERVIZI AFFINI,,AGGIUDICATA,certa
B4E54F286B,,1,"AFFIDAMENTI DIRETTI - PROSECUZIONE ANNO 2025 DEI SERVIZI DI ACCOGLIENZA PER MINORI, MINORI STRANIERI NON ACCOMPAGNATI (MSNA), MADRI CON FIGLI MINORI E VITTIME DELLA VIOLENZA DI GENERE, GI INSERITI IN STRUTTURE RESIDENZIALI SU DISPOSIZIONE DEL SERVIZIO SOCIALE PROFESSIONALE O DELL'AUTORIT GIUDIZIARIA COMPETENTE ","AFFIDAMENTI DIRETTI - PROSECUZIONE ANNO 2025 DEI SERVIZI DI ACCOGLIENZA PER MINORI, MINORI STRANIERI NON ACCOMPAGNATI (MSNA), MADRI CON FIGLI MINORI E VITTIME DELLA VIOLENZA DI GENERE, GI INSERITI IN STRUTTURE RESIDENZIALI SU DISPOSIZIONE DEL SERVIZIO SOCIALE PROFESSIONALE O DELL'AUTORIT GIUDIZIARIA COMPETENTE ",18100.0,18100.0,ANCONA,042018,2024-12-19,AFFIDAMENTO DIRETTO,00343140422,COMUNE DI FALCONARA MARITTIMA,SETTORE POLITICHE SOCIALI - UOC SERVIZI SOCIALI,85300000-2,SERVIZI DI ASSISTENZA SOCIALE E SERVIZI AFFINI,,AGGIUDICATA,certa
B4BD7E95B9,,1,AFFIDAMENTO DIRETTO MEDIANTE PIATTAFORMA APPALTI E CONTRATTI DEL COMUNE DI ALGHERO DEI SERVIZI DI AGENZIA E TITOLI DI VIAGGIO DEL PERSONALE DIPENDENTE RELATIVI AL SERVIZO DI ACCOGLIENZA E INTEGRAZIONE DEL PROGETTO SAI JUNTS 2025-2026 DITTA SHARDANA TOURS S.R.L. DI ALGHERO (SS) IMPEGNO DI SPESA PERIODO 01.01.2025-31.12.2026.,AFFIDAMENTO DIRETTO MEDIANTE PIATTAFORMA APPALTI E CONTRATTI DEL COMUNE DI ALGHERO DEI SERVIZI DI AGENZIA E TITOLI DI VIAGGIO DEL PERSONALE DIPENDENTE RELATIVI AL SERVIZO DI ACCOGLIENZA E INTEGRAZIONE DEL PROGETTO SAI JUNTS 2025-2026 DITTA SHARDANA TOURS S.R.L. DI ALGHERO (SS) IMPEGNO DI SPESA PERIODO 01.01.2025-31.12.2026.,5000.0,5000.0,SASSARI,090003,2024-12-12,AFFIDAMENTO DIRETTO,00249350901,COMUNE DI ALGHERO,UFFICIO SERVIZI SOCIALI,63510000-7,SERVIZI DI AGENZIE DI VIAGGI E SERVIZI AFFINI,,AGGIUDICATA,certa
B4E24DC9E2,,1,SERVIZIO DI ACCOGLIENZA RESIDENZIALE DI MINORI STRANIERI NON ACCOMPAGNATI AFFIDATI AL COMUNE DI UDINE. PERIODO 01.01.2025 - 31.12.2025,SERVIZIO DI ACCOGLIENZA RESIDENZIALE DI MINORI STRANIERI NON ACCOMPAGNATI AFFIDATI AL COMUNE DI UDINE. PERIODO 01.01.2025 - 31.12.2025,138700.0,138700.0,UDINE,030129,2024-12-18,AFFIDAMENTO DIRETTO,00168650307,COMUNE DI UDINE,SERVIZIO SERVIZI PER LA SALUTE ED IL BENESSERE SOCIALE,85311000-2,SERVIZI DI ASSISTENZA SOCIALE CON ALLOGGIO,,AGGIUDICATA,certa
B492B8814A,,1,AFFIDAMENTO DIRETTO EX ART. 50 CO. 1 LETT. B) DEL D.LGS. 36 2023 PER SERVIZIO DI ACCOGLIENZA RESIDENZIALE DI MSNA IN STRUTTURA. COMUNITÀ DON BOSCO - ASSOCIAZIONE MIGRANTES DI DON ANGELO CHIASSERINI ETS,AFFIDAMENTO DIRETTO EX ART. 50 CO. 1 LETT. B) DEL D.LGS. 36 2023 PER SERVIZIO DI ACCOGLIENZA RESIDENZIALE DI MSNA IN STRUTTURA. COMUNITÀ DON BOSCO - ASSOCIAZIONE MIGRANTES DI DON ANGELO CHIASSERINI ETS,8800.0,8800.0,AREZZO,051002,2024-12-03,AFFIDAMENTO DIRETTO,01975410976,SOCIETA' DELLA SALUTE AREA PRATESE,U.O. MINORI SDS PRATO,85311000-2,SERVIZI DI ASSISTENZA SOCIALE CON ALLOGGIO,,AGGIUDICATA,certa
B492B8814A,,1,AFFIDAMENTO DIRETTO EX ART. 50 CO. 1 LETT. B) DEL D.LGS. 36 2023 PER SERVIZIO DI ACCOGLIENZA RESIDENZIALE DI MSNA IN STRUTTURA. COMUNITÀ DON BOSCO - ASSOCIAZIONE MIGRANTES DI DON ANGELO CHIASSERINI ETS,AFFIDAMENTO DIRETTO EX ART. 50 CO. 1 LETT. B) DEL D.LGS. 36 2023 PER SERVIZIO DI ACCOGLIENZA RESIDENZIALE DI MSNA IN STRUTTURA. COMUNITÀ DON BOSCO - ASSOCIAZIONE MIGRANTES DI DON ANGELO CHIASSERINI ETS,8800.0,8800.0,AREZZO,051002,2024-12-03,AFFIDAMENTO DIRETTO,01975410976,SOCIETA' DELLA SALUTE AREA PRATESE,U.O. MINORI SDS PRATO,85310000-5,SERVIZI DI ASSISTENZA SOCIALE,,AGGIUDICATA,certa
B47A93B832,,1,SERVIZIO DI REVISIONE PROGETTO SAI 2024-2026,SERVIZIO DI REVISIONE PROGETTO SAI 2024-2026,11200.0,11200.0,BRESCIA,017133,2024-12-31,AFFIDAMENTO DIRETTO,00400530176,COMUNE DI PALAZZOLO SULL OGLIO,UFFICIO SERVIZI SOCIALI,79212500-8,SERVIZI DI REVISIONE DEI CONTI,,AGGIUDICATA,certa
B4EDAA8FE6,,1,PROSECUZIONE ACCOGLIENZA MSNA IN COMUNITA' GILARDI PERIODO GENNAIO-GIUGNO 2025,PROSECUZIONE ACCOGLIENZA MSNA IN COMUNITA' GILARDI PERIODO GENNAIO-GIUGNO 2025,21720.0,21720.0,SAVONA,009065,2024-12-20,AFFIDAMENTO DIRETTO,00318100096,COMUNE DI VARAZZE,PUBBLICA ISTRUZIONE E SERVIZI ALLA PERSONA,85311000-2,SERVIZI DI ASSISTENZA SOCIALE CON ALLOGGIO,,AGGIUDICATA,certa
B4DBFA31CF,,1,CUC COMUNITA' MONTANA VALLO DI DIANO - CENTRO DI COSTO: COMUNE DI SAN PIETRO AL TANAGRO - BANDO DI GARA MEDIANTE PROCEDURA APERTA AI SENSI DELL'ART. 71 DEL D.LGS. 36/2023 PER L'INDIVIDUAZIONE DEL SOGGETTO ATTUATORE DEL PROGETTO SAI PROG – 836 PR 2 ORDINARI IN PROSECUZIONE ANNO 2025. - CUP: G51H23000060001,CUC COMUNITA' MONTANA VALLO DI DIANO - CENTRO DI COSTO: COMUNE DI SAN PIETRO AL TANAGRO - BANDO DI GARA MEDIANTE PROCEDURA APERTA AI SENSI DELL'ART. 71 DEL D.LGS. 36/2023 PER L'INDIVIDUAZIONE DEL SOGGETTO ATTUATORE DEL PROGETTO SAI PROG – 836 PR 2 ORDINARI IN PROSECUZIONE ANNO 2025. - CUP: G51H23000060001,291841.99,291841.99,SALERNO,065125,2024-12-18,PROCEDURA APERTA,00533680658,COMUNE DI SAN PIETRO AL TANAGRO,SUAP - MANUTENZIONE,85311000-2,SERVIZI DI ASSISTENZA SOCIALE CON ALLOGGIO,,AGGIUDICATA,certa
B4E29F2C53,,1,SERVIZIO ACCOGLIENZA RESIDENZIALE DI UN MINORE STRANIERO NON ACCOMPAGNATO. PERIODO 01.01.2025 -08.03.2025,SERVIZIO ACCOGLIENZA RESIDENZIALE DI UN MINORE STRANIERO NON ACCOMPAGNATO. PERIODO 01.01.2025 -08.03.2025,6365.0,6365.0,UDINE,030129,2024-12-18,AFFIDAMENTO DIRETTO,00168650307,COMUNE DI UDINE,SERVIZIO SERVIZI PER LA SALUTE ED IL BENESSERE SOCIALE,85310000-5,SERVIZI DI ASSISTENZA SOCIALE,,AGGIUDICATA,certa
B49DE71577,,1,SERVIZIO REVISORE CONTABILE PROGETTO SAI 2024_2026,REVISORE CONTABILE PROGETTO SAI 2024 2026,5409.0,5409.0,VENEZIA,027033,2024-12-04,PROCEDURA NEGOZIATA SENZA PREVIA PUBBLICAZIONE,00625230271,COMUNE DI SAN DONA DI PIAVE,SERVIZI ALLA PERSONA,79200000-6,"SERVIZI DI CONTABILITÀ, REVISIONE DEI CONTI E SERVIZI FISCALI",,,certa
B4D8721017,,1,INSERIMENTO DI MINORE MSNA 6938 IN COMUNITA' ALLOGGIO,INSERIMENTO DI MINORE MSNA 6938 IN COMUNITA' ALLOGGIO,35820.0,35820.0,CAMPOBASSO,070066,2024-12-17,AFFIDAMENTO DIRETTO,00606620409,COMUNE DI FORLI ,SERVIZIO POLITICHE DI WELFARE,85311300-5,SERVIZI DI ASSISTENZA SOCIALE PER BAMBINI E GIOVANI,,AGGIUDICATA,certa
B486FF1374,,1,P24-293 TRAPANI - SERVIZIO DI PROGETTAZIONE ESECUTIVA PER LA REALIZZAZIONE DI UNA STRUTTURA PER IL TRATTENIMENTO DI RICHIEDENTI ASILO PRESSO EX DEPOSITO MUNIZIONI OFF BASE CONTRADA PORCOSPINO,P24-293 TRAPANI - SERVIZIO DI PROGETTAZIONE ESECUTIVA PER LA REALIZZAZIONE DI UNA STRUTTURA PER IL TRATTENIMENTO DI RICHIEDENTI ASILO PRESSO EX DEPOSITO MUNIZIONI OFF BASE CONTRADA PORCOSPINO,134000.0,134000.0,TRAPANI,081021,2024-12-02,AFFIDAMENTO DIRETTO,80005700721,3 REPARTO GENIO A.M.BARI,3 REPARTO GENIO AM,71300000-1,SERVIZI DI INGEGNERIA,,AGGIUDICATA,certa
B4E298B755,,1,SERVIZIO DI ACCOGLIENZA IN FAVORE DI CITTADINI STRANIERI - CAS FINO A 50 POSTI UBICATI NELLA PROVINCIA DI ORISTANO FINO AL 30/06/2025.,SERVIZIO DI ACCOGLIENZA IN FAVORE DI CITTADINI STRANIERI RICHIEDENTI PROTEZIONE INTERNAZIONALE E GESTIONE DEI SERVIZI CONNESSI PRESSO STRUTTURE RICETTIVE TEMPORANEE (CENTRI COLLETTIVI) FINO A 50 POSTI UBICATI NELLA PROVINCIA DI ORISTANO FINO AL 30/06/2025.,700000.0,700000.0,ORISTANO,095038,2024-12-18,PROCEDURA NEGOZIATA SENZA PREVIA PUBBLICAZIONE,80007570957,UFFICIO TERRITORIALE DEL GOVERNO - PREFETTURA,PREFETTURA ORISTANO,85320000-8,SERVIZI SOCIALI,,AGGIUDICATA,certa
B4EA5BC3C0,,1,SERVIZIO DI PULIZIA DEI LOCALI ADIBITI AD UFFICI E A SALONE DI RAPPRESENTANZA DELLA PREFETTURA UTG DI SALERNO E DELLA COMMISSIONE TERRITORIALE PER IL RICONOSCIMENTO DELLA PROTEZIONE INTERNAZIONALE DI SALERNO - ANNO 2025,SERVIZIO DI PULIZIA LOCALI PREFETTURA UTG DI SALERNO,39869.0,39869.0,SALERNO,065116,2024-12-20,PROCEDURA RISTRETTA,80025150659,PREFETTURA,MINISTERO DELL'INTERNO,90911200-8,SERVIZI DI PULIZIA DI EDIFICI,,,certa
B428627B92,,1,ACCOGLIENZA MSNA PERIODO OTTOBRE 2024 - CASO N. 16,ACCOGLIENZA MSNA PERIODO OTTOBRE 2024 - CASO N. 16,5890.0,5890.0,TRIESTE,032006,2024-12-17,AFFIDAMENTO DIRETTO,00111990321,COMUNE DI MUGGIA,SERVIZIO SOCIALE DEI COMUNI AMBITO 1.3,85311300-5,SERVIZI DI ASSISTENZA SOCIALE PER BAMBINI E GIOVANI,,AGGIUDICATA,certa
B2C4C3D461,,1,ACCOGLIENZA MSNA PERIODO LUGLIO 2024 - CASO N. 16,ACCOGLIENZA MSNA PERIODO LUGLIO 2024 - CASO N. 16,5890.0,5890.0,TRIESTE,032006,2024-12-16,AFFIDAMENTO DIRETTO,00111990321,COMUNE DI MUGGIA,SERVIZIO SOCIALE DEI COMUNI AMBITO 1.3,85311300-5,SERVIZI DI ASSISTENZA SOCIALE PER BAMBINI E GIOVANI,,AGGIUDICATA,certa
B489041DB6,,1,AFFIDAMENTO DEL SERVIZIO DI PREVENZIONE DEL DISAGIO MINORILE ATTRAVERSO L'OPERATIVITÀ DI STRADA E ATTIVITÀ POMERIDIANE SOCIO-EDUCATIVE PER MINORI STRANIERI DELLA SCUOLA PRIMARIA.,L'AFFIDAMENTO DEL SERVIZIO DI PREVENZIONE DEL DISAGIO MINORILE ATTRAVERSO L'OPERATIVITÀ DI STRADA E ATTIVITÀ POMERIDIANE SOCIO-EDUCATIVE PER MINORI STRANIERI DELLA SCUOLA PRIMARIA.,5979.9,5979.9,VENEZIA,027043,2024-12-02,AFFIDAMENTO DIRETTO,82001670270,COMUNE DI VIGONOVO,AREA SERVIZI ALLA PERSONA,98000000-3,"ALTRI SERVIZI DI COMUNITÀ, SOCIALI E PERSONALI",,AGGIUDICATA,probabile
B4E597D828,A010C25876,1,RINNOVO CONTRATTO DI APPALTO PER IL SERVIZIO DI ACCOGLIENZA E ASSISTENZA DI CITTADINI STRANIERI RICHIEDENTI PROTEZIONE INTERNAZIONALE PRESSO CAS PROVINCIA DI PRATO DI CUI ALL'ART. 11 DEL D.LGS. 142/2015. LOTTO 1 SING. UNITA' ABITATIVE,RINNOVO CONVENZIONE ACCOGLIENZA RICHIEDENTI PROT. INTERNAZIONALE CROCE ROSSA ITALIANA LOTTO 1 SINGOLE UNITA ABITATIVE,166305.68,166305.68,PRATO,100005,2024-12-18,AFFIDAMENTO DIRETTO,92037720486,PREFETTURA DI PRATO,AREA ECONOMICO FINANZIARIA,85311000-2,SERVIZI DI ASSISTENZA SOCIALE CON ALLOGGIO,,AGGIUDICATA,certa
B4B7C180CA,,1,AFFIDAMENTO DEI SERVIZI DI PRIMA ACCOGLIENZA IN OCCASIONE DEL CORRIDOIO UMANITARIO DEL 7 MAGGIO 2024 PRESSO L'AREOPORTO DI FIUMICINO TERMINAL T5 E FORNITURA DEI KIT DI PRIMA ACCOGLIENZA PER 122 MIGRANTI PROVENIENTI DALLA LIBIA RICHIEDENTI PROTEZIONE INTERNAZIONALE AI SENSI E PER GLI EFFETTI DELL ART 48 DLGS 2023 PER GLI AFFIDAMENTI DI FORNITURE E SERVIZI SOTTO LE SOGLIE DI RILEVANZA,AFFIDAMENTO DEI SERVIZI DI PRIMA ACCOGLIENZA IN OCCASIONE DEL CORRIDOIO UMANITARIO DEL 7 MAGGIO 2024 PRESSO L'AREOPORTO DI FIUMICINO TERMINAL T5 E FORNITURA DEI KIT DI PRIMA ACCOGLIENZA PER 122 MIGRANTI PROVENIENTI DALLA LIBIA RICHIEDENTI PROTEZIONE INTERNAZIONALE AI SENSI E PER GLI EFFETTI DELL ART 48 DLGS 2023 PER GLI AFFIDAMENTI DI FORNITURE E SERVIZI SOTTO LE SOGLIE DI RILEVANZA,13473.0,13473.0,ROMA,058120,2024-12-12,AFFIDAMENTO DIRETTO,80197350582,PREFETTURA DI ROMA,PREFETTURA DI ROMA SERVIZI ISTITUZIONALI E GENERALI DELLE AMMINISTRAZIONI PUBBLICHE - AMMINISTRAZIONE GENERALE E SUPPORTO ALLA RAPPRESENTANZA GENERALE DI GOVERNO E DELLO STATO,85320000-8,SERVIZI SOCIALI,,AGGIUDICATA,certa
B4D96E52B3,,1,SERVIZIO DI PREPARAZIONE E FORNITURA PASTI PER IL CENTRO DI PRIMA ACCOGLIENZA (CPA) PER RICHIEDENTI ASILO DI ISOLA DI CAPO RIZZUTO- LOC. S. ANNA,SERVIZIO DI PREPARAZIONE E FORNITURA PASTI PER IL CENTRO DI PRIMA ACCOGLIENZA (CPA) PER RICHIEDENTI ASILO,20324470.8,20324470.8,CROTONE,101013,2024-12-17,ND P1_20,91011070793,PREFETTURA DI CROTONE,PREFETTURA UTG DI CROTONE,55300000-3,SERVIZI DI RISTORAZIONE E DI DISTRIBUZIONE PASTI,,AGGIUDICATA,certa
B4B4B9691F,,1,COLLOCAMENTO IN EMERGENZA MSNA H.F. PRESSO LA STRUTTURA ARGONAUTA DEL CONSORZIO GRUPPO CEIS COOPERATIVA SOCIALE. PERIODO 24.10.2024 02.08.2025,COLLOCAMENTO IN EMERGENZA MSNA H.F. PRESSO LA STRUTTURA ARGONAUTA DEL CONSORZIO GRUPPO CEIS COOPERATIVA SOCIALE. PERIODO 24/10/2024 – 02/08/2025,28155.67,28155.67,MODENA,036021,2024-12-10,AFFIDAMENTO DIRETTO,91019940369,UNIONE COMUNI MODENESI AREA NORD,SERVIZI SOCIALI,85320000-8,SERVIZI SOCIALI,,AGGIUDICATA,certa
B4B21F91FF,,1,PROCEDURA NEGOZIATA E RICHIESTA D'OFFERTA PER L'AFFIDAMENTO DEL PROGETTO INTERVENTI STRAORDINARI DI ACCOGLIENZA INTEGRATA IN FAVORE DI RICHIEDENTI E TITOLARI DI PROTEZIONE INTERNAZIONALE NELL'AMBITO DEL PROGETTO OTTO PER MILLE ANNUALITÀ 2017 CON IL CRITERIO DELL'OFFERTA ECONOMICAMENTE PIÙ VANTAGGIOSA SULLA BASE DEL MIGLIOR RAPPORTO QUALITÀ PREZZO.,INTERVENTI STRAORDINARI DI ACCOGLIENZA INTEGRATA IN FAVORE DI RICHIEDENTI E TITOLARI DI PROTEZIONE INTERNAZIONALE,171060.2,171060.2,NAPOLI,063049,2024-12-09,PROCEDURA NEGOZIATA SENZA PREVIA PUBBLICAZIONE,80014890638,COMUNE DI NAPOLI,SERVIZIO POLITICHE DI INTEGRAZIONE E NUOVE CITTADINANZE,85311000-2,SERVIZI DI ASSISTENZA SOCIALE CON ALLOGGIO,,,certa
B4AB22BE5C,,1,"PROCEDURA NEGOZIATA SENZA BANDO CON PROCEDURA TELEMATICA SULLA PIATTAFORMA APPALTI E CONTRATTI, PER L'AFFIDAMENTO DEL SERVIZIO RELATIVO ALL ACCOGLIENZA NELLAMBITO DELLA RETE SAI PER LA TIPOLOGIA ORDINARIA 2024/2026","PROCEDURA NEGOZIATA SENZA BANDO CON PROCEDURA TELEMATICA SULLA PIATTAFORMA APPALTI E CONTRATTI, PER L'AFFIDAMENTO DEL SERVIZIO RELATIVO ALL ACCOGLIENZA NELLAMBITO DELLA RETE SAI PER LA TIPOLOGIA ORDINARIA 2024/2026",449732.14,449732.14,ISERNIA,094037,2024-12-06,PROCEDURA NEGOZIATA SENZA PREVIA PUBBLICAZIONE,00056650948,COMUNE DI POGGIO SANNITA,UFFICIO TECNICO,85311000-2,SERVIZI DI ASSISTENZA SOCIALE CON ALLOGGIO,,AGGIUDICATA,certa
B48AD31EFC,,1,AFFIDAMENTO DEL SERVIZIO DI ACCOGLIENZA IN FAVORE DI CITTADINI STRANIERI RICHIEDENTI PROTEZIONE INTERNAZIONALE E GESTIONE DEI SERVIZI CONNESSI PRESSO STRUTTURE RICETTIVE TEMPORANEE (CENTRI COLLETTIVI) DA 51 A 100 POSTI UBICATI NELLA PROVINCIA DI ORISTANO FINO AL 31/12/2024.,FORNITURA DI BENI E SERVIZI PER LA GESTIONE E IL FUNZIONAMENTO DEL CAS DA 51 A 100 POSTI,700000.0,700000.0,ORISTANO,095038,2024-12-02,ALTRA PROCEDURA A FASE UNICA,80007570957,UFFICIO TERRITORIALE DEL GOVERNO - PREFETTURA,PREFETTURA ORISTANO,85320000-8,SERVIZI SOCIALI,,AGGIUDICATA,certa
B4F963557E,,1,"AFFIDAMENTO DEI SERVIZI DI GESTIONE DI UN CENTRO COLLETTIVO DI ACCOGLIENZA CON CAPACITÀ RICETTIVA MASSIMA FINO A 50 POSTI (ART.1, COMMA 2, LETT. B) DELLO SCHEMA DI CAPITOLATO D'APPALTO APPROVATO CON DECRETO DEL MINISTRO DELL'INTERNO IN DATA 4 MARZO 2024.)",SERVIZIO ACCOGLIENZA RICHIEDENTI ASILO CENTRO COLLETTIVO,121510.7,121510.7,FORLÌ-CESENA,040050,2024-12-24,AFFIDAMENTO DIRETTO,80004780401,MINISTERO INTERNO-PREFETTURA,PREFETTURA DI FORLI'-CESENA,85311000-2,SERVIZI DI ASSISTENZA SOCIALE CON ALLOGGIO,,AGGIUDICATA,certa
B49156A0DC,,1,INSERIMENTO DI MINORE MSNA CODICE 7077 IN COMUNITA' EDUCATIVA RESIDENZIALE,INSERIMENTO DI MINORE MSNA CODICE 7077 IN COMUNITA' EDUCATIVA RESIDENZIALE,33200.0,33200.0,FERMO,109005,2024-12-03,AFFIDAMENTO DIRETTO,00606620409,COMUNE DI FORLI ,SERVIZIO POLITICHE DI WELFARE,85311300-5,SERVIZI DI ASSISTENZA SOCIALE PER BAMBINI E GIOVANI,,AGGIUDICATA,certa
B4DE02A975,,2,L'ATTIVITÀ OGGETTO DEL SERVIZIO SI RIFERISCE ALLA PRONTA ACCOGLIENZA DI MINORI,"CENTRI DI PRONTA ACCOGLIENZA E PRESA IN CARICO, SU RICHIESTA DELLA STAZIONE APPALTANTE, DI MINORI, INCLUSI MINORI STRANIERI NON ACCOMPAGNATI DA ADULTI DI RIFERIMENTO (ANCHE TITOLARI O RICHIEDENTI PROTEZIONE INTERNAZIONALE) PER N. 90 POSTI, IN STRUTTURE AUTORIZZATE AI SENSI DELLA L. R. LAZIO N. 41/2003 COS&#236; COME INTEGRATA DALLA L.R. 2004, N. 1305 E SMI, MESSE A DISPOSIZIONE DAGLI OPERATORI ECONOMICI NEL TERRITORIO DELLA CITT&#224; METROPOLITANA DI ROMA CAPITALE, SERVIZIO AGGIUNTIVO INFERMIERISTICO PROFESSIONALE A CHIAMATA E SERVIZIO DI TRASFERIMENTO PRESSO STRUTTURE DI SECONDA ACCOGLIENZA. NEL CASO DI STRUTTURE AL DI FUORI DEL TERRITORIO DI ROMA CAPITALE, MA COMUNQUE ALL&#8217;INTERNO DELLA CITT&#224; METROPOLITANA DI ROMA CAPITALE &#232; NECESSARIO PRESENTARE NULLA OSTA DELL&#8217;ENTE LOCALE TERRITORIALMENTE COMPETENTE.",19829192.76,25711342.8,ROMA,058091,2024-12-19,PROCEDURA APERTA,02438750586,ROMA CAPITALE,DIPARTIMENTO POLITICHE SOCIALI E SALUTE,85311300-5,SERVIZI DI ASSISTENZA SOCIALE PER BAMBINI E GIOVANI,1461.0,,certa
B3534F1CE2,,1,ACCOGLIENZA MSNA PERIODO SETTEMBRE 2024 - CASO N. 16,ACCOGLIENZA MSNA PERIODO SETTEMBRE 2024 - CASO 16,5700.0,5700.0,TRIESTE,032006,2024-12-16,AFFIDAMENTO DIRETTO,00111990321,COMUNE DI MUGGIA,SERVIZIO SOCIALE DEI COMUNI AMBITO 1.3,85311300-5,SERVIZI DI ASSISTENZA SOCIALE PER BAMBINI E GIOVANI,,AGGIUDICATA,certa
B4A33ECFE0,,1,"AFFIDAMENTO DIRETTO EX ART. 50, C.1 LETT. B) D.LGS. 36/2023 - INSIEME PER LA VITA",SERVIZIO ACCOGLIENZA MIGRANTI,139449.0,139449.0,CASERTA,061022,2024-12-06,AFFIDAMENTO DIRETTO,80002190611,MINISTERO INTERNO PREFETTURA CASERTA,UFFICIO CONTRATTI,85311000-2,SERVIZI DI ASSISTENZA SOCIALE CON ALLOGGIO,,AGGIUDICATA,probabile
B42857CE74,,1,"ACCOGLIENZA MSNA PERIODO OTTOBRE 2024 - CASI N. 40, 47, 50, 51, 52 E 53","ACCOGLIENZA MSNA PERIODO OTTOBRE 2024 - CASI N. 40, 47, 50, 51, 52 E 53",6164.46,6164.46,TRIESTE,032006,2024-12-16,AFFIDAMENTO DIRETTO,00111990321,COMUNE DI MUGGIA,SERVIZIO SOCIALE DEI COMUNI AMBITO 1.3,85311300-5,SERVIZI DI ASSISTENZA SOCIALE PER BAMBINI E GIOVANI,,AGGIUDICATA,certa
B4E02DCB1D,,1,SERVIZIO DI INTERPRETARIATO IN CONSECUTIVA E DI TRADUZIONE A SUPPORTO DELLA COMMISSIONE TERRITORIALE PER IL RICONOSCIMENTO DELLA PROTEZIONE INTERNAZIONALE DI PALERMO 1 FEBBRAIO- 31 DICEMBRE 2025,SERVIZIO DI INTERPRETARIATO IN CONSECUTIVA E TRADUZIONE A SUPPORTO DELLA COMMISSIONE TERRITORIALE DI PALERMO,137500.0,137500.0,PALERMO,082053,2024-12-17,PROCEDURA NEGOZIATA SENZA PREVIA PUBBLICAZIONE,80015880828,PREFETTURA DI PALERMO,PREFETTURA DI PALERMO UFFICIO TERRITORIALE DEL GOVERNO,79530000-8,SERVIZI DI TRADUZIONE,,,certa
B4E02DCB1D,,1,SERVIZIO DI INTERPRETARIATO IN CONSECUTIVA E DI TRADUZIONE A SUPPORTO DELLA COMMISSIONE TERRITORIALE PER IL RICONOSCIMENTO DELLA PROTEZIONE INTERNAZIONALE DI PALERMO 1 FEBBRAIO- 31 DICEMBRE 2025,SERVIZIO DI INTERPRETARIATO IN CONSECUTIVA E TRADUZIONE A SUPPORTO DELLA COMMISSIONE TERRITORIALE DI PALERMO,137500.0,137500.0,PALERMO,082053,2024-12-17,PROCEDURA NEGOZIATA SENZA PREVIA PUBBLICAZIONE,80015880828,PREFETTURA DI PALERMO,PREFETTURA DI PALERMO UFFICIO TERRITORIALE DEL GOVERNO,79540000-1,SERVIZI DI INTERPRETARIATO,,,certa
B4F857C8B2,,1,AFFIDAMENTO ACCOGLIENZA 41 RICHIEDENTI ASILO DAL 01-01-2025 AL 30-04-2025 CASA VINCENZIANA,SERVIZI ACCOGLIENZA RICHIEDENTI ASILO,39000.0,39000.0,TERNI,055032,2024-12-24,AFFIDAMENTO DIRETTO,80006230553,UFFICIO TERRITORIALE DEL GOVERNO DI TERNI,SERVIZIO CONTABILITA' E GESTIONE FINANZIARIA,85311000-2,SERVIZI DI ASSISTENZA SOCIALE CON ALLOGGIO,,AGGIUDICATA,certa
B49F331511,,1,"SERVIZIO DI ACCOGLIENZA RICHIEDENTI ASILO PRESSO SINGOLE UNITÀ ABITATIVE, PRESSO GLI APPARTAMENTI SITI IN BUGGIANO VIA STIGNANO NN.1 E 3, PONTE BUGGIANESE VIA MEAZZI N.40, DI CHIESINA UZZANESE VIA DELLA CAPANNA N. 11 E LARCIANO VIA GRAMSCI N. 258.","SERVIZIO DI ACCOGLIENZA RICHIEDENTI ASILO PRESSO SINGOLE UNITÀ ABITATIVE, PRESSO GLI APPARTAMENTI SITI IN: BUGGIANO VIA STIGNANO NN.1 E 3, PONTE BUGGIANESE VIA MEAZZI N.40, DI CHIESINA UZZANESE VIA DELLA CAPANNA N. 11 E LARCIANO VIA GRAMSCI N. 258.",868061.25,868061.25,PISTOIA,047003,2024-12-04,PROCEDURA NEGOZIATA SENZA PREVIA PUBBLICAZIONE,80009790470,PREFETTURA DI PISTOIA,PREFETTURA DI PISTOIA,85311000-2,SERVIZI DI ASSISTENZA SOCIALE CON ALLOGGIO,,AGGIUDICATA,certa
B504754FB5,,1,OSPITALITA' MSNA DI GENERE MASCHILE PRESSO ASS. AQUARIUS - DAL 01.07.2024 AL 30.09.2024,OSPITALITÀ MSNA DI GENERE MASCHILE,113500.0,113500.0,SIRACUSA,089016,2024-12-30,PROCEDURA NEGOZIATA SENZA PREVIA PUBBLICAZIONE,00056590896,COMUNE DI ROSOLINI,IX SETTORE SERVIZI SOCIALI,85311000-2,SERVIZI DI ASSISTENZA SOCIALE CON ALLOGGIO,,AGGIUDICATA,certa
B48D1DE30C,,1,PROGETTO SAI (SISTEMA ACCOGLIENZA INTEGRAZIONE PER TITOLARI DI PROTEZIONE INTERNAZIONALE E PER MINORI STRANIERI NON ACCOMPAGNATI). AFFIDAMENTO INCARICO REVISORE CONTABILE - PERIODO: NOVEMBRE 2024 - DICEMBRE 2026 - CUP G69I24001090001,PROGETTO SAI (SISTEMA ACCOGLIENZA INTEGRAZIONE PER TITOLARI DI PROTEZIONE INTERNAZIONALE E PER MINORI STRANIERI NON ACCOMPAGNATI). AFFIDAMENTO INCARICO REVISORE CONTABILE - PERIODO - NOVEMBRE 2024 - DICEMBRE 2026 - CUP G69I24001090001,14515.29,14515.29,TORINO,001086,2024-12-03,AFFIDAMENTO DIRETTO,07233850010,CONSORZIO INTERCOMUNALE DEI SERVIZI SOCIO ASSISTENZIALI,AREA AMMINISTRAZIONE E GOVERNO DELLA RETE DEI SERVIZI,79200000-6,"SERVIZI DI CONTABILITÀ, REVISIONE DEI CONTI E SERVIZI FISCALI",,AGGIUDICATA,certa
B42E4E38F5,,1,ACCOGLIENZA MSNA PERIODO OTTOBRE 2024 - CASI N. 19 E 22,ACCOGLIENZA MSNA PERIODO OTTOBRE 2024 - CASI N. 19 E 22,5180.0,5180.0,UDINE,030129,2024-12-16,AFFIDAMENTO DIRETTO,00111990321,COMUNE DI MUGGIA,SERVIZIO SOCIALE DEI COMUNI AMBITO 1.3,85311300-5,SERVIZI DI ASSISTENZA SOCIALE PER BAMBINI E GIOVANI,,AGGIUDICATA,certa
