cig,cig_accordo_quadro,n_lotti_componenti,oggetto_gara,oggetto_lotto,importo_lotto,importo_complessivo_gara,provincia,luogo_istat,data_pubblicazione,tipo_scelta_contraente,cf_amministrazione_appaltante,denominazione_amministrazione_appaltante,denominazione_centro_costo,cod_cpv,descrizione_cpv,DURATA_PREVISTA,ESITO,confidenza
B75BFF997E,,1,"SERVIZI DI ACCOGLIENZA, INTEGRAZIONE E TUTELA RIVOLTI A STRANIERI RICHIEDENTI PROTEZIONE INTERNAZIONALE NELL'AMBITO DEL PROGETTO SAI ","SERVIZI DI ACCOGLIENZA, INTEGRAZIONE E TUTELA RIVOLTI A STRANIERI RICHIEDENTI PROTEZIONE INTERNAZIONALE NELL'AMBITO DEL PROGETTO SAI",657020.0,657020.0,COSENZA,078093,2025-06-20,PROCEDURA NEGOZIATA SENZA PREVIA PUBBLICAZIONE,00352000780,COMUNE DI PARENTI,UFFICIO TECNICO,85300000-2,SERVIZI DI ASSISTENZA SOCIALE E SERVIZI AFFINI,,,certa
B6BBE0CE78,,1,SERVIZIO DI ACCOGLIENZA RESIDENZIALE DI DUE MINORI STRANIERI NON ACCOMPAGNATI. PERIODO 05 MAGGIO 2025 -31 MAGGIO 2025,SERVIZIO DI ACCOGLIENZA RESIDENZIALE DI DUE MINORI STRANIERI NON ACCOMPAGNATI. PERIODO 05 MAGGIO 2025 -31 MAGGIO 2025,5589.0,5589.0,UDINE,030129,2025-06-05,AFFIDAMENTO DIRETTO,00168650307,COMUNE DI UDINE,SERVIZIO SERVIZI PER LA SALUTE ED IL BENESSERE SOCIALE,85311000-2,SERVIZI DI ASSISTENZA SOCIALE CON ALLOGGIO,,AGGIUDICATA,certa
B75C654823,,1,PROSECUZIONE OSPITALITÀ MINORE STRANIERO NON ACCOMPAGNATO IN COMUNITÀ ANCORA CASA II SEMESTRE 2025,PROSECUZIONE OSPITALITÀ MINORE STRANIERO NON ACCOMPAGNATO IN COMUNITÀ ANCORA CASA II SEMESTRE 2025,12266.67,12266.67,SAVONA,009065,2025-06-23,AFFIDAMENTO DIRETTO,00318100096,COMUNE DI VARAZZE,PUBBLICA ISTRUZIONE E SERVIZI ALLA PERSONA,85311000-2,SERVIZI DI ASSISTENZA SOCIALE CON ALLOGGIO,,AGGIUDICATA,certa
B74B6563A6,,1,AFFIDAMENTO ACCOGLIENZA 150 RICHIEDENTI ASILO DAL 01-07-2025 AL 31-07-2025 LABORATORIO IDEA,SERVIZI ACCOGLIENZA RICHIEDENTI ASILO,114157.5,114157.5,TERNI,055032,2025-06-18,AFFIDAMENTO DIRETTO,80006230553,UFFICIO TERRITORIALE DEL GOVERNO DI TERNI,SERVIZIO CONTABILITA' E GESTIONE FINANZIARIA,85311000-2,SERVIZI DI ASSISTENZA SOCIALE CON ALLOGGIO,,AGGIUDICATA,certa
B723D4CD25,B27F328905,1,"GARA APERTA, AI SENSI DELL'ART. 71 DEL D.LGS. N. 36/2023, FINALIZZATA ALLA SELEZIONE DI PIÙ OPERATORI ECONOMICI, CON CUI CONCLUDERE UN ACCORDO QUADRO, AI SENSI DELL'ART. 59, CO. 4 LETT. A) DEL D.LGS. N. 36/2023, SENZA RIAPERTURA DEL CONFRONTO COMPETITIVO, PER L'AFFIDAMENTO DEL SERVIZIO DI ACCOGLIENZA E ASSISTENZA DI CITTADINI STRANIERI RICHIEDENTI PROTEZIONE INTERNAZIONALE PRESSO I CENTRI DI CUI ALL'ART. 11 DEL D.LGS. 142/2015 NEL TERRITORIO DELLA CITTÀ METROPOLITANA DI NAPOLI. LOTTO 4.",CONVENZIONE PER L'AFFIDAMENTO DEL SERVIZIO DI GESTIONE DI CENTRI COLLETTIVI DI ACCOGLIENZA CON CAPIENZA DA 101 A 300 POSTI CIG B27F328905 ,8769055.42,8769055.42,NAPOLI,063049,2025-06-04,AFFIDAMENTO DIRETTO,80049360631,UFFICIO TERRITORIALE DEL GOVERNO,SERVIZIO ATTIVITA' CONTRATTUALI,85311000-2,SERVIZI DI ASSISTENZA SOCIALE CON ALLOGGIO,,AGGIUDICATA,certa
B776963991,B4EAEDBAA5,1,AFFIDAMENTO SERVIZIO MIGRANTI LOTO N. 1 - III CONTRATTO ATTUATIVO,AFFIDAMENTO SERVIZIO MIGRANTI LOTO N. 1 - III CONTRATTO ATTUATIVO,402528.17,402528.17,ANCONA,042002,2025-06-30,AFFIDAMENTO DIRETTO,00351040423,COMUNE DI ANCONA,SETTORE POLITICHE SOCIALI E SERVIZI SCOLASTICI,85300000-2,SERVIZI DI ASSISTENZA SOCIALE E SERVIZI AFFINI,,AGGIUDICATA,probabile
B778B9C760,972421975F,1,"AFFIDAMENTO EX ART. 54, COMMA 3, D.LGS. 50/2016 AVVALENDOSI DELLA OPZIONE DI PROROGA TECNICA AI SENSI DELLART. 106 DEL DLGS N. 50/2026, PER IL PERIODO DAL 01 LUGLIO 2025 AL 31 AGOSTO 2025 DEL SERVIZIO CENTRO PER L'INTERAZIONE DELLE DIVERSITA' CULTURALI - CIG 972421975F - NELLE MORE DELLA CONCLUSIONE DEL PERCORSO DI CO-PROGETTAZIONE AVVIATO CON DETERMINAZIONE DIRIGENZIALE N. 3785/2025. 530109IMPEGNO DI SPESA COMPLESSIVO PARI A EURO 36.606,20 IVA ESENTE (EX ART. 8 LEGGE 266/91) A VALERE SUL PROGETTO SAI CATEGORIA ORDINARI CUP B31H22000190001","AFFIDAMENTO EX ART. 54, COMMA 3, D.LGS. 50/2016 AVVALENDOSI DELLA OPZIONE DI PROROGA TECNICA AI SENSI DELLART. 106 DEL DLGS N. 50/2026, PER IL PERIODO DAL 01 LUGLIO 2025 AL 31 AGOSTO 2025 DEL SERVIZIO CENTRO PER L'INTERAZIONE DELLE DIVERSITA' CULTURALI - CIG 972421975F - NELLE MORE DELLA CONCLUSIONE DEL PERCORSO DI CO-PROGETTAZIONE AVVIATO CON DETERMINAZIONE DIRIGENZIALE N. 3785/2025. 530109IMPEGNO DI SPESA COMPLESSIVO PARI A EURO 36.606,20 IVA ESENTE (EX ART. 8 LEGGE 266/91) A VALERE SUL PROGETTO SAI CATEGORIA ORDINARI CUP B31H22000190001",36606.2,36606.2,GENOVA,010025,2025-06-30,AFFIDAMENTO DIRETTO,00856930102,COMUNE DI GENOVA,DIREZIONE POLITICHE SOCIALI COMUNE DI GENOVA,85300000-2,SERVIZI DI ASSISTENZA SOCIALE E SERVIZI AFFINI,,AGGIUDICATA,certa
B73B2C9380,,1,SERVIZIO DI ACCOGLIENZA PER 10 POSTI IN EMERGENZA PER MSNA DAL 16/06/2025 AL 30/09/2025 - GARA UTDA,SERVIZIO DI ACCOGLIENZA PER 10 POSTI IN EMERGENZA PER MSNA DAL 16/06/2025 AL 30/09/2025 - GARA UTDA,90950.0,90950.0,MODENA,036005,2025-06-12,AFFIDAMENTO DIRETTO,03069890360,UNIONE DELLE TERRE D ARGINE,ASSISTENZA SOCIALE,85311300,,,AGGIUDICATA,certa
B71F76910A,,1,"PROCEDURA NEGOZIATA PER LA CONCLUSIONE DI UN ACCORDO QUADRO PER L'AFFIDAMENTO DEL SERVIZIO DI ACCOGLIENZA DI N. 50 CITTADINI RICHIEDENTI PROTEZIONE INTERNAZIONELE, IN CENTRI COSTITUITI DA UNITA' ABITATIVE CON CAPACITA' RECETTIVA FINO A 50 POSTI PER IL PERIODO DI 6 MESI, EVENTUALMENTE RINNOVABILI PER IL MEDESIMO PERIODO",AFFIDAMENTO DEL SERVIZIO DI ACCOGLIENZA MIGRANTI,715585.0,715585.0,LODI,098031,2025-06-03,PROCEDURA NEGOZIATA SENZA PREVIA PUBBLICAZIONE,92526810152,PREFETTURA DI LODI,PREFETTO DI LODI,85311000-2,SERVIZI DI ASSISTENZA SOCIALE CON ALLOGGIO,,,certa
B76A111A52,,1,"GESTIONE DEL SERVIZIO ACCOGLIENZA E L'INTEGRAZIONE DI MINORI STRANIERI NON ACCOMPAGNATI - PROCEDURA NEGOZIATA SENZA PUBBLICAZIONE DI UN BANDO PER RIPETIZIONE DI SERVIZI ANALOGHI, PER MESI 36 - CUI S00378210462202200039"," GESTIONE DEL SERVIZIO ACCOGLIENZA E L'INTEGRAZIONE DI MINORI STRANIERI NON ACCOMPAGNATI - PROCEDURA NEGOZIATA SENZA PUBBLICAZIONE DI UN BANDO PER RIPETIZIONE DI SERVIZI ANALOGHI, PER MESI 36 - CUI S00378210462202200039",1697031.0,1697031.0,LUCCA,046017,2025-06-25,PROCEDURA NEGOZIATA SENZA PREVIA PUBBLICAZIONE,00378210462,COMUNE DI LUCCA,STAZIONE UNICA APPALTANTE,85311300-5,SERVIZI DI ASSISTENZA SOCIALE PER BAMBINI E GIOVANI,,,certa
B728909D74,,1,CONFERIMENTO INCARICO REVISORE CONTABILE PROGETTO 1458 MSNA - SAN SEVERINO LUCANO PERIODO 2025/2027,INCARICO REVISORE CONTABILE PROGETTO MSNA 1458,12250.0,12250.0,POTENZA,076078,2025-06-06,AFFIDAMENTO DIRETTO,82001390762,COMUNE DI SAN SEVERINO LUCANO,SAN SEVERINO LUCANO,79200000-6,"SERVIZI DI CONTABILITÀ, REVISIONE DEI CONTI E SERVIZI FISCALI",,AGGIUDICATA,certa
B757547586,,1,GARA EUROPEA A PROCEDURA TELEMATICA APERTA PER L&#8217; AFFIDAMENTO IN PROSECUZIONE NEL TRIENNIO 2025/2027 (SINO AL 31/12/2027) DEL PROGETTO SAI PROG - 1432 &#8211; PR &#8211; 2 CATEGORIA MSNA &#8211; PER IL COMUNE DI MONTEDORO. CUP: H74D24002380001,GARA EUROPEA A PROCEDURA TELEMATICA APERTA PER L&#8217; AFFIDAMENTO IN PROSECUZIONE NEL TRIENNIO 2025/2027 (SINO AL 31/12/2027) DEL PROGETTO SAI PROG - 1432 &#8211; PR &#8211; 2 CATEGORIA MSNA &#8211; PER IL COMUNE DI MONTEDORO. CUP: H74D24002380001,950000.0,950000.0,CALTANISSETTA,085011,2025-06-20,PROCEDURA APERTA,80002970855,COMUNE DI MONTEDORO,UFFICIO TECNICO,85310000-5,SERVIZI DI ASSISTENZA SOCIALE,30.0,AGGIUDICATA,certa
B76E7BBAA9,,1,SERVIZIO DI PRIMA ACCOGLIENZA IN FAVORE DI MINORI STRANIERI NON ACCOMPAGNATI PRESSO LA STRUTTURA RICETTIVA TEMPORANEA UBICATA NEL TERRITORIO DELLA PROVINCIA DI PESARO E URBINO - URBANIA LOC. BATTAGLIA. PERIODO DAL 1°LUGLIO 2025 AL 30 SETTEMBRE 2025,SERVIZIO DI PRIMA ACCOGLIENZA IN FAVORE DI MINORI STRANIERI NON ACCOMPAGNATI 1/07/25 - 30/09/25,126408.0,126408.0,PADOVA,028095,2025-06-27,AFFIDAMENTO DIRETTO,80006690418,PREFETTURA UTG PESARO E URBINO,PREFETTURA UTG PESARO E URBINO,85311000-2,SERVIZI DI ASSISTENZA SOCIALE CON ALLOGGIO,,AGGIUDICATA,certa
B7768E0D75,B4EAEDCB78,1,SECONDO CONTRATTO APPLICATIVO LOTTO 2 PROGETTO SAIA MIGRANTI,SECONDO CONTRATTO APPLICATIVO LOTTO 2 PROGETTO SAIA MIGRANTI,697838.4,697838.4,ANCONA,042002,2025-06-30,AFFIDAMENTO DIRETTO,00351040423,COMUNE DI ANCONA,SETTORE POLITICHE SOCIALI E SERVIZI SCOLASTICI,85300000-2,SERVIZI DI ASSISTENZA SOCIALE E SERVIZI AFFINI,,AGGIUDICATA,probabile
B729B42724,,1,AFFIDAMENTO SERVIZIO GESTIONE ACCOGLIENZA MIGRANTI PRESSO LE STRUTTURE DELLA MISERICORDIA DI CERTALDO - 51 POSTI - PERIODO 1.6.2025 - 30.6.2025,ACCOGLIENZA MIGRANTI,45733.0,45733.0,FIRENZE,048017,2025-06-06,AFFIDAMENTO DIRETTO,80020830487,PREFETTURA DI FIRENZE,PREFETTURA FIRENZE,85311000-2,SERVIZI DI ASSISTENZA SOCIALE CON ALLOGGIO,,AGGIUDICATA,probabile
B74D33BBD6,B600A1FD88,1,"DETERMINA DI AFFIDAMENTO DIRETTO APPLICATIVO DELL'ACCORDO QUADRO CIG MASTER: B600A1FD88 PER I SERVIZI DI SUPPORTO E CONSULENZA TECNICA, LEGALE E AMMINISTRATIVA SULLO SVOLGIMENTO O SULLA PROGETTAZIONE DELLE PROCEDURE DI APPALTO PER LAFFIDAMENTO DI PROGETTO SAI/SIPROIMI N. PROG- 1432 PR-2. CAT. MSNA PER GLI ANNI 2025/ 2027. CUP: H74D24002380001","DETERMINA DI AFFIDAMENTO DIRETTO APPLICATIVO DELL'ACCORDO QUADRO CIG MASTER: B600A1FD88 PER I SERVIZI DI SUPPORTO E CONSULENZA TECNICA, LEGALE E AMMINISTRATIVA SULLO SVOLGIMENTO O SULLA PROGETTAZIONE DELLE PROCEDURE DI APPALTO PER LAFFIDAMENTO DI PROGETTO SAI/SIPROIMI N. PROG- 1432 PR-2. CAT. MSNA PER GLI ANNI 2025/ 2027. CUP: H74D24002380001",7600.0,7600.0,CALTANISSETTA,085011,2025-06-17,AFFIDAMENTO DIRETTO,80002970855,COMUNE DI MONTEDORO,UFFICIO TECNICO,79900000-3,SERVIZI COMMERCIALI VARI ED ALTRI SERVIZI,,AGGIUDICATA,certa
B7182ABA52,,1,TERZA PROROGA AFFIDAMENTO SERVIZIO SAI PROGETTO 2004 - DAL 01.06.2025 AL 30.06.2025,TERZA PROROGA AFFIDAMENTO SERVIZIO SAI PROGETTO 2004 - DAL 01.06.2025 AL 30.06.2025,24418.76,24418.76,L'AQUILA,066066,2025-06-03,AFFIDAMENTO DIRETTO,83000650669,COMUNE DI PACENTRO,UFFICIO AMMINISTRATIVO,85311000-2,SERVIZI DI ASSISTENZA SOCIALE CON ALLOGGIO,,AGGIUDICATA,certa
B64AA66976,,1,SERVIZIO DI ACCOGLIENZA RESIDENZIALE DI MINORI STRANIERI NON ACCOMPAGNATI. PERIODO 01/04/2025 - 13/02/2026,SERVIZIO DI ACCOGLIENZA RESIDENZIALE DI MINORI STRANIERI NON ACCOMPAGNATI. PERIODO 01/04/2025 - 13/02/2026,73245.0,73245.0,UDINE,030129,2025-06-05,AFFIDAMENTO DIRETTO,00168650307,COMUNE DI UDINE,SERVIZIO SERVIZI PER LA SALUTE ED IL BENESSERE SOCIALE,85311000-2,SERVIZI DI ASSISTENZA SOCIALE CON ALLOGGIO,,AGGIUDICATA,certa
B7387C9768,B27F327832,1,"GARA APERTA, AI SENSI DELL'ART. 71 DEL D.LGS. N. 36/2023, FINALIZZATA ALLA SELEZIONE DI PIÙ OPERATORI ECONOMICI, CON CUI CONCLUDERE UN ACCORDO QUADRO PER L'AFFIDAMENTO DEL SERVIZIO DI ACCOGLIENZA E ASSISTENZA DI CITTADINI STRANIERI RICHIEDENTI PROTEZIONE INTERNAZIONALE PRESSO I CENTRI DI CUI ALL'ART. 11 DEL D.LGS. 142/2015 NEL TERRITORIO DELLA CITTÀ METROPOLITANA DI NAPOLI ","GARA APERTA, AI SENSI DELL'ART. 71 DEL D.LGS. N. 36/2023, FINALIZZATA ALLA SELEZIONE DI PIÙ OPERATORI ECONOMICI, CON CUI CONCLUDERE UN ACCORDO QUADRO PER L'AFFIDAMENTO DEL SERVIZIO DI ACCOGLIENZA E ASSISTENZA DI CITTADINI STRANIERI RICHIEDENTI PROTEZIONE INTERNAZIONALE PRESSO I CENTRI DI CUI ALL'ART. 11 DEL D.LGS. 142/2015 NEL TERRITORIO DELLA CITTÀ METROPOLITANA DI NAPOLI ",3987208.23,3987208.23,NAPOLI,063049,2025-06-11,AFFIDAMENTO DIRETTO,80049360631,UFFICIO TERRITORIALE DEL GOVERNO,SERVIZIO ATTIVITA' CONTRATTUALI,85311000-2,SERVIZI DI ASSISTENZA SOCIALE CON ALLOGGIO,,AGGIUDICATA,certa
B737C062A8,,1,MSNA 008,MSNA 008,21021.0,21021.0,FERMO,109006,2025-06-11,AFFIDAMENTO DIRETTO,00334990447,COMUNE DI FERMO,SERVIZI SOCIALI,85311000-2,SERVIZI DI ASSISTENZA SOCIALE CON ALLOGGIO,,AGGIUDICATA,certa
B7295D5CE5,,1,"AFFIDAMENTO SERVIZIO GESTIONE ACCOGLIENZA MIGRANTI PRESSO LE STRUTTURE DI VALORI SOLIDALI S.R.L. IMPRESA SOCIALE CENTRI DI ACCOGLIENZA SINGOLI CON CAPACITÀ FINO A N. 50 UNITÀ COMPLESSIVE STRUTTURE SITE NEI COMUNI DI FIRENZE, VIA ARETINA N.115, POSTI 4, FIRENZE, VIA FANFANI N.26, POSTI 8, SCANDICCI, VIA PISANA N.581, POSTI 20, LASTRA A SIGNA, VIA CALCINAIA N.20, POSTI 34, LASTRA A SIGNA, VIA DEL CARDIO N.214, POSTI 40, 106 POSTI COMPLESSIVI, PERIODO DAL 1.6.2025 AL 30.6.2025",ACCOGLIENZA MIGRANTI,84969.0,84969.0,FIRENZE,048017,2025-06-06,AFFIDAMENTO DIRETTO,80020830487,PREFETTURA DI FIRENZE,PREFETTURA FIRENZE,85311000-2,SERVIZI DI ASSISTENZA SOCIALE CON ALLOGGIO,,AGGIUDICATA,probabile
B3345E99A2,,1,SERVIZIO DI ACCOGLIENZA RESIDENZIALE DI MINORI STRANIERI NON ACCOMPAGNATI AFFIDATI AL COMUNE DI UDINE PER IL PERIODO 01/10/2024_31/01/2025 . ,SERVIZIO DI ACCOGLIENZA RESIDENZIALE DI MINORI STRANIERI NON ACCOMPAGNATI AFFIDATI AL COMUNE DI UDINE PER IL PERIODO 01/10/2024_31/01/2025 . ,110700.0,110700.0,UDINE,030129,2025-06-06,AFFIDAMENTO DIRETTO,00168650307,COMUNE DI UDINE,SERVIZIO SERVIZI PER LA SALUTE ED IL BENESSERE SOCIALE,85311000-2,SERVIZI DI ASSISTENZA SOCIALE CON ALLOGGIO,,AGGIUDICATA,certa
B73B09955F,,1,LAVORI DI REALIZZAZIONE DI IMPIANTI PUBBLICI PER LA PRODUZIONE DI ENERGIA DA FONTI RINNOVABILI SUL TETTO DEL CENTRO SPRAR,LAVORI DI REALIZZAZIONE DI IMPIANTI PUBBLICI PER LA PRODUZIONE DI ENERGIA DA FONTI RINNOVABILI SUL TETTO DEL CENTRO SPRAR,40896.43,40896.43,MATERA,077010,2025-06-11,PROCEDURA NEGOZIATA SENZA PREVIA PUBBLICAZIONE,83000410775,COMUNE DI GORGOGLIONE,AREA TECNICA,09331200-0,MODULI FOTOVOLTAICI SOLARI,,AGGIUDICATA,certa
B74D0BBBB1,,1,SERVIZIO ACCOGLIENZA A FAVORE MINORI STRANIERI NON ACCOMPAGNATI PRESSO STRUTTURE RICETTIVE TEMPORANEE UBICATE NELLA PROVINCIA DI SAVONA,SERVIZIO GESTIONE CENTRI DI ACCOGLIENZA A FAVORE DI MINORI STRANIERI NON ACCOMPAGNATI PRESSO STRUTTURE RICETTIVE UBICATE NEL TERRITORIO DELLA PROVINCIA DI SAVONA - AVVISO MANIFESTAZIONE D'INTERESSE E SUCCESSIVA RDO 5400268,60.0,60.0,SAVONA,009056,2025-06-18,ALTRA PROCEDURA A PIU' FASI,80005640091,UFFICIO TERRITORIALE DEL GOVERNO,PREFETTURA UTG SAVONA,85311000-2,SERVIZI DI ASSISTENZA SOCIALE CON ALLOGGIO,,,certa
B732D28D54,,1,SERVIZIO DI OSPITALITA' MIGRANTI PRESSO OSTELLO DI VERBANIA - PERIODO PRESUNTO 1/6/2025-30/9/2025,OSPITALITA' MIGRANTI PRESSO OSTELLO DI VERBANIA - PERIODO FINO AL 30.9.2025 1.5-31.7.25,0.0,0.0,VERBANO-CUSIO-OSSOLA,103072,2025-06-12,AFFIDAMENTO DIRETTO,93014250034,PREFETTURA DEL VERBANO - CUSIO - OSSOLA -,SERVIZIO CONTRATTI,85311000-2,SERVIZI DI ASSISTENZA SOCIALE CON ALLOGGIO,,AGGIUDICATA,probabile
B5FED491BA,,1,SERVIZIO DI ACCOGLIENZA RESIDENZIALE DI UN MINORE STRANIERO NON ACCOMPAGNATO. PERIODO 15.03.2025 -22.11.2025,SERVIZIO DI ACCOGLIENZA RESIDENZIALE DI UN MINORE STRANIERO NON ACCOMPAGNATO. PERIODO 15.03.2025 -22.11.2025,44275.0,44275.0,UDINE,030129,2025-06-05,AFFIDAMENTO DIRETTO,00168650307,COMUNE DI UDINE,SERVIZIO SERVIZI PER LA SALUTE ED IL BENESSERE SOCIALE,85311000-2,SERVIZI DI ASSISTENZA SOCIALE CON ALLOGGIO,,AGGIUDICATA,certa
B72917E813,,1,"AFFIDAMENTO SERVIZIO GESTIONE ACCOGLIENZA MIGRANTI COOP. SOCIALE LA PIETRA D'ANGOLO CENTRI DI ACCOGLIENZA SINGOLI CON CAPACITÀ FINO A N. 50 UNITÀ COMPLESSIVE STRUTTURE SITE NEI COMUNI DI - EMPOLI, VIA PENTHATHLON N.51, POSTI 6 - FUCECCHIO, VIA NELLI N.11, POSTI 5 11 POSTI COMPLESSIVI PERIODO DAL 1.6.2025 AL 30.11.2025",ACCOGLIENZA MIGRANTI,53908.0,53908.0,FIRENZE,048017,2025-06-06,AFFIDAMENTO DIRETTO,80020830487,PREFETTURA DI FIRENZE,PREFETTURA FIRENZE,85311000-2,SERVIZI DI ASSISTENZA SOCIALE CON ALLOGGIO,,AGGIUDICATA,probabile
B7674BE67C,,1,AFFIDAMENTO SERVIZI DI GESTIONE DI CENTRI COLLETTIVI DI ACCOGLIENZA CON CAPIENZA SINO A 50 POSTI,ACCOGLIENZA MIGRANTI,119152.32,119152.32,BRESCIA,017029,2025-06-26,AFFIDAMENTO DIRETTO,80046740173,PREFETTURA DI BRESCIA,PREFETTURA UFFICIO TERRITORIALE DEL GOVERNO DI BRESCIA,85311000-2,SERVIZI DI ASSISTENZA SOCIALE CON ALLOGGIO,,AGGIUDICATA,probabile
B76F25D0F0,,1,RETTA PERMANENZA MINORE STRANIERO NON ACCOMPAGNATO PRESSO COMUNITÀ EDUCATIVA,RETTA PERMANENZA MINORE STRANIERO NON ACCOMPAGNATO COMUNITÀ EDUCATIVA,19000.0,19000.0,ASCOLI PICENO,044023,2025-06-27,AFFIDAMENTO DIRETTO,82000670446,COMUNE DI GROTTAMMARE,AREA AMMINISTRATIVA SOCIO ASSISTENZIALE,85320000-8,SERVIZI SOCIALI,,AGGIUDICATA,certa
B738C066C7,B27F327832,1,"GARA APERTA, AI SENSI DELL'ART. 71 DEL D.LGS. N. 36/2023, FINALIZZATA ALLA SELEZIONE DI PIÙ OPERATORI ECONOMICI, CON CUI CONCLUDERE UN ACCORDO QUADRO PER L'AFFIDAMENTO DEL SERVIZIO DI ACCOGLIENZA E ASSISTENZA DI CITTADINI STRANIERI RICHIEDENTI PROTEZIONE INTERNAZIONALE PRESSO I CENTRI DI CUI ALL'ART. 11 DEL D.LGS. 142/2015 NEL TERRITORIO DELLA CITTÀ METROPOLITANA DI NAPOLI ","GARA APERTA, AI SENSI DELL'ART. 71 DEL D.LGS. N. 36/2023, FINALIZZATA ALLA SELEZIONE DI PIÙ OPERATORI ECONOMICI, CON CUI CONCLUDERE UN ACCORDO QUADRO PER L'AFFIDAMENTO DEL SERVIZIO DI ACCOGLIENZA E ASSISTENZA DI CITTADINI STRANIERI RICHIEDENTI PROTEZIONE INTERNAZIONALE PRESSO I CENTRI DI CUI ALL'ART. 11 DEL D.LGS. 142/2015 NEL TERRITORIO DELLA CITTÀ METROPOLITANA DI NAPOLI ",3076479.17,3076479.17,NAPOLI,063049,2025-06-11,AFFIDAMENTO DIRETTO,80049360631,UFFICIO TERRITORIALE DEL GOVERNO,SERVIZIO ATTIVITA' CONTRATTUALI,85311000-2,SERVIZI DI ASSISTENZA SOCIALE CON ALLOGGIO,,AGGIUDICATA,certa
B766945EC9,,1,AFFIDAMENTO MINORE STRANIERO NON ACCOMPAGNATO,INSERIMENTO MINORE STRANIERO NON ACCOMPAGNATO IN COMUNITÀ,11000.0,11000.0,ANCONA,042013,2025-06-25,AFFIDAMENTO DIRETTO,00345420426,OMUNE DI CERRETO D'ESI,UFFICIO SERVIZI SOCIALI,85320000-8,SERVIZI SOCIALI,,AGGIUDICATA,certa
B70130BAA4,,1,SERVIZIO TRASPORTO MIGRANTI CON AUTISTA DA BRESSO AI CENTRI DI ACCOGLIENZA STRAORDINARIA DELLA PROVINCIA DI CREMONA,SERVIZIO TRASPORTO MIGRANTI CON AUTISTA DA BRESSO AI CENTRI DI ACCOGLIENZA DELLA PROVINCIA DI CREMONA,39000.0,39000.0,CREMONA,019036,2025-06-06,AFFIDAMENTO DIRETTO,80007700190,PREFETTURA DI CREMONA,SERVIZIO CONTABILITA' E GESTIONE FINANZIARIA,60170000-0,NOLEGGIO DI VEICOLI PER TRASPORTO PASSEGGERI CON AUTISTA,,AGGIUDICATA,certa
B64AF7CBE7,,1,SERVIZIO DI PRONTA ACCOGLIENZA DI MINORI STRANIERI NON ACCOMPAGNATI. PERIODO 01/04/2025 -28/02/2026,SERVIZIO DI PRONTA ACCOGLIENZA DI MINORI STRANIERI NON ACCOMPAGNATI. PERIODO 01/04/2025 -28/02/2026,136272.0,136272.0,UDINE,030129,2025-06-05,AFFIDAMENTO DIRETTO,00168650307,COMUNE DI UDINE,SERVIZIO SERVIZI PER LA SALUTE ED IL BENESSERE SOCIALE,85311000-2,SERVIZI DI ASSISTENZA SOCIALE CON ALLOGGIO,,AGGIUDICATA,certa
B729A71AAA,,1,"AFFIDAMENTO SERVIZIO GESTIONE ACCOGLIENZA MIGRANTI PRESSO LE STRUTTURE DI VALORI SOLIDALI S.R.L. IMPRESA SOCIALE CENTRO SINGOLO CON CAPACITÀ RICETTIVA FINO A 50 UNITÀ COMPLESSIVE CAMPI BISENZIO, LOC. SAN DONNINO, VIA TRENTO N.147 15 POSTI - PERIODO 1.6.2025 AL 30.11.2025",ACCOGLIENZA MIGRANTI,73511.1,73511.1,FIRENZE,048017,2025-06-06,AFFIDAMENTO DIRETTO,80020830487,PREFETTURA DI FIRENZE,PREFETTURA FIRENZE,85311000-2,SERVIZI DI ASSISTENZA SOCIALE CON ALLOGGIO,,AGGIUDICATA,probabile
B2E6B847FF,,1,SERVIZIO DI ACCOGLIENZA RESIDENZIALE PER DUE MINORI STRANIERI NON ACCOMPAGNATI. PERIODO 30 AGOSTO 2024 - 30 SETTEMBRE 2024 ,SERVIZIO DI ACCOGLIENZA RESIDENZIALE PER DUE MINORI STRANIERI NON ACCOMPAGNATI. PERIODO 30 AGOSTO 2024 - 30 SETTEMBRE 2024 ,7489.28,7489.28,UDINE,030129,2025-06-09,AFFIDAMENTO DIRETTO,00168650307,COMUNE DI UDINE,SERVIZIO SERVIZI PER LA SALUTE ED IL BENESSERE SOCIALE,85311000-2,SERVIZI DI ASSISTENZA SOCIALE CON ALLOGGIO,,AGGIUDICATA,certa
B76EB7C3B6,,1,SERVIZIO ACCOGLIENZA PER 50 RICHIEDENTI PROTEZIONE INTERNAZIONALE CAMPO MOBILE ALLEGRI,ACCOGLIENZA. 50 MIGRANTI C/O ALLEGRI,139450.0,139450.0,PADOVA,028060,2025-06-27,AFFIDAMENTO DIRETTO,80015960281,PREFETTURA DI PADOVA,PREFETTURA PADOVA - SERVIZIO CONTABILITA',85311000-2,SERVIZI DI ASSISTENZA SOCIALE CON ALLOGGIO,,AGGIUDICATA,certa
B7385E9B4B,B27F32675F,1,"GARA APERTA, AI SENSI DELL'ART. 71 DEL D.LGS. N. 36/2023, FINALIZZATA ALLA SELEZIONE DI PIÙ OPERATORI ECONOMICI, CON CUI CONCLUDERE UN ACCORDO QUADRO PER L'AFFIDAMENTO DEL SERVIZIO DI ACCOGLIENZA E ASSISTENZA DI CITTADINI STRANIERI RICHIEDENTI PROTEZIONE INTERNAZIONALE PRESSO I CENTRI DI CUI ALL'ART. 11 DEL D.LGS. 142/2015 NEL TERRITORIO DELLA CITTÀ METROPOLITANA DI NAPOLI ","GARA APERTA, AI SENSI DELL'ART. 71 DEL D.LGS. N. 36/2023, FINALIZZATA ALLA SELEZIONE DI PIÙ OPERATORI ECONOMICI, CON CUI CONCLUDERE UN ACCORDO QUADRO PER L'AFFIDAMENTO DEL SERVIZIO DI ACCOGLIENZA E ASSISTENZA DI CITTADINI STRANIERI RICHIEDENTI PROTEZIONE INTERNAZIONALE PRESSO I CENTRI DI CUI ALL'ART. 11 DEL D.LGS. 142/2015 NEL TERRITORIO DELLA CITTÀ METROPOLITANA DI NAPOLI ",2290497.7,2290497.7,NAPOLI,063049,2025-06-11,AFFIDAMENTO DIRETTO,80049360631,UFFICIO TERRITORIALE DEL GOVERNO,SERVIZIO ATTIVITA' CONTRATTUALI,85311000-2,SERVIZI DI ASSISTENZA SOCIALE CON ALLOGGIO,,AGGIUDICATA,certa
B7150911FB,,1,SERVIZIO DI ACCOGLIENZA RESIDENZIALE DI MINORI STRANIERI NON ACCOMPAGNATI. PERIODO 01.06.2025 - 02.09.2027 ,SERVIZIO DI ACCOGLIENZA RESIDENZIALE DI MINORI STRANIERI NON ACCOMPAGNATI. PERIODO 01.06.2025 - 02.09.2027 ,120163.0,120163.0,UDINE,030129,2025-06-05,AFFIDAMENTO DIRETTO,00168650307,COMUNE DI UDINE,SERVIZIO SERVIZI PER LA SALUTE ED IL BENESSERE SOCIALE,85311000-2,SERVIZI DI ASSISTENZA SOCIALE CON ALLOGGIO,,AGGIUDICATA,certa
B621F7C2BE,,1,SERVIZIO DI ACCOGLIENZA RESIDENZIALE DI UN MINORE STRANIERO NON ACCOMPAGNATO. PERIODO 21.03.202- 04.05.2028,SERVIZIO DI ACCOGLIENZA RESIDENZIALE DI UN MINORE STRANIERO NON ACCOMPAGNATO. PERIODO 21.03.202- 04.05.2028,102690.0,102690.0,UDINE,030129,2025-06-05,AFFIDAMENTO DIRETTO,00168650307,COMUNE DI UDINE,SERVIZIO SERVIZI PER LA SALUTE ED IL BENESSERE SOCIALE,85311000-2,SERVIZI DI ASSISTENZA SOCIALE CON ALLOGGIO,,AGGIUDICATA,certa
B705CD3D82,,1,SERVIZIO DI ACCOGLIENZA RESIDENZIALE DI UN MINORE STRANIERO NON ACCOMPAGNATO. PERIODO 26.05.2025 - 30.06.2025,SERVIZIO DI ACCOGLIENZA RESIDENZIALE DI UN MINORE STRANIERO NON ACCOMPAGNATO. PERIODO 26.05.2025 - 30.06.2025,5400.0,5400.0,UDINE,030129,2025-06-05,AFFIDAMENTO DIRETTO,00168650307,COMUNE DI UDINE,SERVIZIO SERVIZI PER LA SALUTE ED IL BENESSERE SOCIALE,85311000-2,SERVIZI DI ASSISTENZA SOCIALE CON ALLOGGIO,,AGGIUDICATA,certa
B7292262B8,,1,"AFFIDAMENTO SERVIZIO GESTIONE ACCOGLIENZA MIGRANTI PRESSO LE STRUTTURE DEL COORDINAMENTO MISERICORDIE AREA FIORENTINA - CENTRI DI ACCOGLIENZA SINGOLI CON CAPACITÀ FINO A N. 50 UNITÀ COMPLESSIVE STRUTTURE SITE NEI COMUNI DI: - IMPRUNETA, VIA CASSIA N.215 VILLA BIFONICA, POSTI 25 - FIRENZE, PONTE A GREVE N.31, POSTI 7 - GREVE IN CHIANTI, VIA GIULIOTTI N.19, POSTI 15 47 POSTI COMPLESSIVI PERIODO DAL 1.6.2025 AL 30.6.2025",ACCOGLIENZA MIGRANTI,37675.0,37675.0,FIRENZE,048017,2025-06-06,AFFIDAMENTO DIRETTO,80020830487,PREFETTURA DI FIRENZE,PREFETTURA FIRENZE,85311000-2,SERVIZI DI ASSISTENZA SOCIALE CON ALLOGGIO,,AGGIUDICATA,probabile
B7385C3BEF,B27F32675F,1,"GARA APERTA, AI SENSI DELL'ART. 71 DEL D.LGS. N. 36/2023, FINALIZZATA ALLA SELEZIONE DI PIÙ OPERATORI ECONOMICI, CON CUI CONCLUDERE UN ACCORDO QUADRO PER L'AFFIDAMENTO DEL SERVIZIO DI ACCOGLIENZA E ASSISTENZA DI CITTADINI STRANIERI RICHIEDENTI PROTEZIONE INTERNAZIONALE PRESSO I CENTRI DI CUI ALL'ART. 11 DEL D.LGS. 142/2015 NEL TERRITORIO DELLA CITTÀ METROPOLITANA DI NAPOLI ","GARA APERTA, AI SENSI DELL'ART. 71 DEL D.LGS. N. 36/2023, FINALIZZATA ALLA SELEZIONE DI PIÙ OPERATORI ECONOMICI, CON CUI CONCLUDERE UN ACCORDO QUADRO PER L'AFFIDAMENTO DEL SERVIZIO DI ACCOGLIENZA E ASSISTENZA DI CITTADINI STRANIERI RICHIEDENTI PROTEZIONE INTERNAZIONALE PRESSO I CENTRI DI CUI ALL'ART. 11 DEL D.LGS. 142/2015 NEL TERRITORIO DELLA CITTÀ METROPOLITANA DI NAPOLI ",1330562.46,1330562.46,NAPOLI,063049,2025-06-11,AFFIDAMENTO DIRETTO,80049360631,UFFICIO TERRITORIALE DEL GOVERNO,SERVIZIO ATTIVITA' CONTRATTUALI,85311000-2,SERVIZI DI ASSISTENZA SOCIALE CON ALLOGGIO,,AGGIUDICATA,certa
B762522461,,1,"GARA EUROPEA A PROCEDURA APERTA VOLTA ALLA CONCLUSIONE DI UN ACCORDO QUADRO CON PIÙ SOGGETTI ECONOMICI, PER LA DURATA DI TRE ANNI, PERIODO 2025/2028, PER L'AFFIDAMENTO DEI SERVIZI DI ACCOGLIENZA E DEI SERVIZI CONNESSI AI CITTADINI STRANIERI RICHIEDENTI ASILO PRESSO STRUTTURE TEMPORANEE, COSTITUITE DA CENTRI COLLETTIVI CON CAPIENZA DA 51 A 100 OSPITI UBICATE CITTÀ METROPOLITANA DI ROMA CAPITALE","GARA EUROPEA A PROCEDURA APERTA VOLTA ALLA CONCLUSIONE DI UN ACCORDO QUADRO CON PIÙ SOGGETTI ECONOMICI, PER LA DURATA DI TRE ANNI, PERIODO 2025/2028, PER L'AFFIDAMENTO DEI SERVIZI DI ACCOGLIENZA E DEI SERVIZI CONNESSI AI CITTADINI STRANIERI RICHIEDENTI ASILO PRESSO STRUTTURE TEMPORANEE, COSTITUITE DA CENTRI COLLETTIVI CON CAPIENZA DA 51 A 100 OSPITI UBICATE CITTÀ METROPOLITANA DI ROMA CAPITALE",192309375,192309375,ROMA,058091,2025-06-25,PROCEDURA APERTA,80197350582,PREFETTURA DI ROMA,PREFETTURA DI ROMA SERVIZI ISTITUZIONALI E GENERALI DELLE AMMINISTRAZIONI PUBBLICHE - AMMINISTRAZIONE GENERALE E SUPPORTO ALLA RAPPRESENTANZA GENERALE DI GOVERNO E DELLO STATO,85320000-8,SERVIZI SOCIALI,3.0,,certa
B76707F577,,1,AFFIDAMENTO DIRETTO PER SERVIZIO DI INSERIMENTO COMUNITÀ DI N. 1 MSNA A FAVORE DI IL BIVIO SOC. COOP. SOC.,AFFIDAMENTO DIRETTO PER SERVIZIO DI INSERIMENTO COMUNITÀ DI N. 1 MSNA A FAVORE DI IL BIVIO SOC. COOP. SOC.,23000.0,23000.0,LODI,098031,2025-06-25,AFFIDAMENTO DIRETTO,04985760968,CONSORZIO LODIGIANO PER I SERVIZI ALLA PERSONA,DIREZIONE GENERALE,85320000-8,SERVIZI SOCIALI,,AGGIUDICATA,certa
