cig,cig_accordo_quadro,n_lotti_componenti,oggetto_gara,oggetto_lotto,importo_lotto,importo_complessivo_gara,provincia,luogo_istat,data_pubblicazione,tipo_scelta_contraente,cf_amministrazione_appaltante,denominazione_amministrazione_appaltante,denominazione_centro_costo,cod_cpv,descrizione_cpv,DURATA_PREVISTA,ESITO,confidenza
6934592E56,6548779F60,1,INTEGRAZIONE AFFIDAMENTO SERVIZIO ACCOGLIENZA MIGRANTI 2016 - GESTIONI IMMOBILI,INTEGRAZIONE AFFIDAMENTO SERVIZIO ACCOGLIENZA MIGRANTI 2016 - GESTIONI IMMOBILI,128100.0,128100.0,,,2016-11-01,AFFIDAMENTO DIRETTO IN ADESIONE AD ACCORDO QUADRO/CONVENZIONE,93014220508,PREFETTURA DI PISA,PREFETTURA DI PISA,85311000-2,SERVIZI DI ASSISTENZA SOCIALE CON ALLOGGIO,,AGGIUDICATA,probabile
6876398723,,1,PROSECUZIONE PROGETTO SPRAR CATEGORIA ORDINARI ANNI 2017 - 2018 - 2019,PROSECUZIONE PROGETTO SPRAR CATEGORIA ORDINARI ANNI 2017 - 2018 - 2019,6285039.0,6285039.0,AGRIGENTO,084001,2016-11-21,PROCEDURA APERTA,00074260845,COMUNE DI AGRIGENTO,UFFICIO SERVIZIO SOCIALE,85311300-5,SERVIZI DI ASSISTENZA SOCIALE PER BAMBINI E GIOVANI,,AGGIUDICATA,certa
6876405CE8,,1,PROSECUZIONE PROGETTO SPRAR DM/DS ANNI 2017 - 2018 - 2019,PROSECUZIONE PROGETTO SPRAR DM/DS ANNI 2017 - 2018 - 2019,1240116.0,1240116.0,AGRIGENTO,084001,2016-11-21,PROCEDURA APERTA,00074260845,COMUNE DI AGRIGENTO,UFFICIO SERVIZIO SOCIALE,85311200-4,SERVIZI DI ASSISTENZA SOCIALE PER DISABILI,,AGGIUDICATA,certa
68825224D3,67645424A6,1,"SERVIZIO DI ACCOGLIENZA DI CITTADINI STRANIERI RICHIEDENTI PROTEZIONE INTERNAZIONALE, NELL'AMBITO DI VARESE E PROVINCIA, DELLA GESTIONE DEI SERVIZI CONNESSI E LA MESSA A DISPOSIZIONE DELLE STRUTTURE DI ACCOGLIENZA. PROCEDURA DI GARA AVENTE AD OGGETTO SERVIZI DI CUI ALL'ALLEGATO IX DEL D. LGS. N. 50/2016. PERIODO 1/10/2016 - 31/12/2016.","SERVIZIO DI ACCOGLIENZA DI CITTADINI STRANIERI RICHIEDENTI PROTEZIONE INTERNAZIONALE, NELL'AMBITO DI VARESE E PROVINCIA, DELLA GESTIONE DEI SERVIZI CONNESSI E LA MESSA A DISPOSIZIONE DELLE STRUTTURE DI ACCOGLIENZA. PROCEDURA DI GARA AVENTE AD OGGETTO SERVIZI DI CUI ALL'ALLEGATO IX DEL D. LGS. N. 50/2016. PERIODO 1/10/2016 - 31/12/2016.",41740.4,41740.4,VARESE,012133,2016-11-24,AFFIDAMENTO DIRETTO IN ADESIONE AD ACCORDO QUADRO/CONVENZIONE,80014740122,PREFETTURA,U.T.G. PREFETTURA DI VARESE,85311000-2,SERVIZI DI ASSISTENZA SOCIALE CON ALLOGGIO,,AGGIUDICATA,certa
7125398072,,1,ORIDNANZA SINDACALE N. 115 DEL 17/11/2016 - SERVIZIO DI CUSTODIA E SORVEGLIANZA MINORI STRANIERI NON ACCOMPAGNATI - IV TRIMESTRE 2016,Oggetto non pubblicabile a causa della potenziale presenza di dati personali,52965.0,52965.0,,078044,2016-11-17,AFFIDAMENTO DIRETTO,00391240785,COMUNE DI CORIGLIANO CALABRO,SETTORE CULTURA-SERVIZI SOCIALI-SPORT E TEMPO LIBERO,85311300-5,SERVIZI DI ASSISTENZA SOCIALE PER BAMBINI E GIOVANI,,,certa
6848940415,,1,SERVIZIO EROGAZIONE PASTI AI CITTADINI EXTRACOMUNITARI RICHIEDENTI PROTEZIONE INTERNAZIONALE,SERVIZIO EROGAZIONE PASTI AI CITTADINI EXTRACOMUNITARI RICHIEDENTI PROTEZIONE INTERNAZIONALE,500000.0,500000.0,,080063,2016-11-03,PROCEDURA NEGOZIATA SENZA PREVIA PUBBLICAZIONE,00136380805,COMUNE DI REGGIO CALABRIA,WELFARE,55510000-8,SERVIZI DI MENSA,,AGGIUDICATA,certa
6871409217,,1,AFFIDAMENTO DIRETTO SERVIZIO D1I ACCOGLIENZA STRAORDINARIA MIGRANTI ATI ATLANTIA ORSETTA DAL 27.05.2016 AL 30.06.2016,AFFIDAMENTO DIRETTO SERVIZIO D1I ACCOGLIENZA STRAORDINARIA MIGRANTI ATI ATLANTIA ORSETTA DAL 27.05.2016 AL 30.06.2016,314514.9,314514.9,,092101,2016-11-16,AFFIDAMENTO IN ECONOMIA - COTTIMO FIDUCIARIO,80014130928,PREFETTURA DI CAGLIARI UTG,SERVIZIO A.S.G.A.C.,85311000-2,SERVIZI DI ASSISTENZA SOCIALE CON ALLOGGIO,,,probabile
6853423791,,1,SERVIZIO TRASPORTO MIGRANTI (RICHIEDENTI PROTEZIONE INTERNAZIONALE) DAL 1.1.2017 AL 31.12.2017,SERVIZIO TRASPORTO MIGRANTI (RICHIEDENTI PROTEZIONE INTERNAZIONALE) DAL 1.1.2017 AL 31.12.2017,38000.0,38000.0,,,2016-11-02,AFFIDAMENTO IN ECONOMIA - COTTIMO FIDUCIARIO,80007700190,PREFETTURA DI CREMONA,SERVIZIO CONTABILITA' E GESTIONE FINANZIARIA,60300000-1,SERVIZI DI TRASPORTO MEDIANTE CONDUTTURE,,,certa
689083943B,,1,AFFIDAMENTO DEL SERVIZIO DI ACCOGLIENZA RICHIEDENTI PROTEZIONE INTERNAZIONALE - PERIODO 01/12/2016-28/02/2017 - ARCI COMITATO PROVINCIALE,AFFIDAMENTO DEL SERVIZIO DI ACCOGLIENZA RICHIEDENTI PROTEZIONE INTERNAZIONALE - PERIODO 01/12/2016-28/02/2017 - ARCI COMITATO PROVINCIALE,157410.0,157410.0,GROSSETO,053011,2016-11-17,PROCEDURA NEGOZIATA SENZA PREVIA PUBBLICAZIONE,80006840534,PREFETTURA,PREFETTURA DI GROSSETO,85311000-2,SERVIZI DI ASSISTENZA SOCIALE CON ALLOGGIO,,AGGIUDICATA,certa
6867096AE1,65640834A6,1,ACCOGLIENZA INTEGRATA PER RICHIEDENTI ASILO E TITOLARI DI PROTEZIONE INTER. E UMANITARIA,ACCOGLIENZA INTEGRATA PER RICHIEDENTI ASILO E TITOLARI DI PROTEZIONE INTER. E UMANITARIA,5118030.0,5118030.0,TORINO,001272,2016-11-14,CONFRONTO COMPETITIVO IN ADESIONE AD ACCORDO QUADRO/CONVENZIONE,00514490010,COMUNE DI TORINO,07 - DIVISIONE SERVIZI SOCIALI / SOCIO SANITARI / ABITATIVI E LAVORO,85311300-5,SERVIZI DI ASSISTENZA SOCIALE PER BAMBINI E GIOVANI,,AGGIUDICATA,certa
6890661158,,1,AFFIDAMENTO DEL SERVIZIO DI ACCOGLIENZA RICHIEDENTI PROTEZIONE INTERNAZIONALE PERIODO 01/12/2016-28/02/2017 - COOP. SOLIDARIETÀ È CRESCITA,AFFIDAMENTO DEL SERVIZIO DI ACCOGLIENZA RICHIEDENTI PROTEZIONE INTERNAZIONALE PERIODO 01/12/2016-28/02/2017 - COOP. SOLIDARIETÀ È CRESCITA,273240.0,273240.0,,053011,2016-11-17,PROCEDURA NEGOZIATA SENZA PREVIA PUBBLICAZIONE,80006840534,PREFETTURA,PREFETTURA DI GROSSETO,85311000-2,SERVIZI DI ASSISTENZA SOCIALE CON ALLOGGIO,,AGGIUDICATA,certa
68699741E4,,4,"SERVIZI DI ACCOGLIENZA A FAVORE DI CITTADINI STRANIERI PRESENTI SUL TERRITORIO, PRESSO STRUTTURE NELLA DISPONIBILITÀ DEGLI ENTI INVITATI, A FARE TEMPO DALLA DATA DI AGGIUDICAZIONE E FINO A DICEMBRE 2016",UNITÀ D'OFFERTA IN GRADO DI ACCOGLIERE ED OSPITARE FINO A 50 CITTADINI STRANIERI PRESENTI SUL TERRITORIO (NUCLEI FAMILIARI E DONNE).,58900.0,441750.0,MILANO,015146,2016-11-15,PROCEDURA NEGOZIATA SENZA PREVIA PUBBLICAZIONE,01199250158,COMUNE DI MILANO,DIREZIONE CENTRALE POLITICHE SOCIALI,85311000-2,SERVIZI DI ASSISTENZA SOCIALE CON ALLOGGIO,,AGGIUDICATA,probabile
68914761E7,,1,AFFIDAMENTO DEL SERVIZIO DI ACCOGLIENZA RICHIEDENTI PROTEZIONE INTERNAZIONALE PERIODO 1.12.2016 - 28.02.2017 - ASSOCIAZIONE PARTECIPAZIONE E SVILUPPO,AFFIDAMENTO DEL SERVIZIO DI ACCOGLIENZA RICHIEDENTI PROTEZIONE INTERNAZIONALE PERIODO 1.12.2016 - 28.02.2017 - ASSOCIAZIONE PARTECIPAZIONE E SVILUPPO,686070.0,686070.0,,053011,2016-11-17,PROCEDURA NEGOZIATA SENZA PREVIA PUBBLICAZIONE,80006840534,PREFETTURA,PREFETTURA DI GROSSETO,85311000-2,SERVIZI DI ASSISTENZA SOCIALE CON ALLOGGIO,,AGGIUDICATA,certa
687229091B,,1,MINORI STRANIERI NON ACCOMPAGNATI - CIRS - CASA FAMIGLIA LA GLICINE,Oggetto non pubblicabile a causa della potenziale presenza di dati personali,6075.0,6075.0,,083048,2016-11-16,AFFIDAMENTO DIRETTO,00080270838,COMUNE DI MESSINA,DIPARTIMENTO SOCIALE E RAPPORTI CON L'ISTITUZIONE,85311000-2,SERVIZI DI ASSISTENZA SOCIALE CON ALLOGGIO,,,certa
6856629D3C,,3,SERVIZIO DI ACCOGLIENZA DI CITTADINI STRANIERI RICHIEDENTI PROTEZIONE INTERNAZIONALE,SERVIZIO DI ACCOGLIENZA DI CITTADINI STRANIERI RICHIEDENTI PROTEZIONE INTERNAZIONALE,95480.0,286440.0,,039014,2016-11-04,PROCEDURA NEGOZIATA SENZA PREVIA PUBBLICAZIONE,80006840393,PREFETTURA - UFFICIO TERRITORIALE DEL GOVERNO DI RAVENNA,PREFETTURA - UFFICIO TERRITORIALE DEL GOVERNO DI RAVENNA,85311000-2,SERVIZI DI ASSISTENZA SOCIALE CON ALLOGGIO,,,certa
6880397B36,,1,AFFIDAMENTO E GESTIONE DEI SERVIZI DI ACCOGLIENZA IN FAVORE DI SOGGETTI TITOLARI E RICHIEDENTI PROTEZIONE INTERNAZIONALE NONCHÉ TITOLARI DI PERMESSO UMANITARIO.DISAGIO MENTALE,AFFIDAMENTO E GESTIONE DEI SERVIZI DI ACCOGLIENZA IN FAVORE DI SOGGETTI TITOLARI E RICHIEDENTI PROTEZIONE INTERNAZIONALE NONCHÉ TITOLARI DI PERMESSO UMANITARIO.DISAGIO MENTALE,365000.0,365000.0,,081006,2016-11-24,PROCEDURA APERTA,81001210814,COMUNE DI CASTELVETRANO,II SETTORE SERVIZI AL CITTADINO,85320000-8,SERVIZI SOCIALI,,,certa
6967555048,67645424A6,1,SERVIZIO DI PRIMA ACCOGLIENZA DI CITTADINI STRANIERI RICHIEDENTI PROTEZIONE INTERNAZIONALE E LA GESTIONE DEI SERVIZI CONNESSI'. PERIODO 01/01/2017 -30/04/2017.,SERVIZIO DI 'PRIMA ACCOGLIENZA DI CITTADINI STRANIERI RICHIEDENTI PROTEZIONE INTERNAZIONALE E LA GESTIONE DEI SERVIZI CONNESSI'. PERIODO 01/01/2017 -30/04/2017.,121765.2,121765.2,VARESE,012133,2016-11-07,AFFIDAMENTO DIRETTO IN ADESIONE AD ACCORDO QUADRO/CONVENZIONE,80202230589,MINISTERO INTERNO DIPARTIMENTO DELLA P.S.,UTG - PREFETTURA DI VARESE,85311000-2,SERVIZI DI ASSISTENZA SOCIALE CON ALLOGGIO,,AGGIUDICATA,certa
68902015BC,,1,AFFIDAMENTO MSNA PRESSO CENTRO LA ZAGARA III TRIMESTRE 2016,AFFIDAMENTO MSNA PRESSO CENTRO LA ZAGARA III TRIMESTRE 2016,593074.29,593074.29,SIRACUSA,089001,2016-11-30,AFFIDAMENTO DIRETTO,CFAVCP-0000FE3,CENTRALE DI COMMITTENZA MODICA-SCICLI,VII SETTORE - SERVIZI SOCIALI- C.U.C.,85311000-2,SERVIZI DI ASSISTENZA SOCIALE CON ALLOGGIO,,AGGIUDICATA,certa
6895368DAB,,1,SEMINARIO VESCOVILE DI PONTREMOLI ACCOGLIENZA MIGRANTI OTTOBRE DICEMBRE 2016 PROROGABILE GENNAIO FEBBRAIO 2017,SEMINARIO VESCOVILE DI PONTREMOLI ACCOGLIENZA MIGRANTI OTTOBRE DICEMBRE 2016 PROROGABILE GENNAIO FEBBRAIO 2017,119122.59,119122.59,MASSA-CARRARA,045014,2016-11-21,PROCEDURA NEGOZIATA SENZA PREVIA INDIZIONE DI GARA (SETTORI SPECIALI),80003940451,PREFETTURA DI MASSA CARRARA UFFICIO TERRITORIALE DEL GOVERNO,SERVIZI GENERALI E ATTIVITA' CONTRATTUALE,85320000-8,SERVIZI SOCIALI,,AGGIUDICATA,probabile
687036006E,,6,"GARA EUROPEA A PROCEDURA APERTA, AI SENSI DELL'ART. 59 E 60 DEL D. LGS. N. 50/2016, VOLTA ALLA CONCLUSIONE DI UN ACCORDO QUADRO CON PIU' SOGGETTI ECONOMICI PER L'AFFIDAMENTO DEI SERVIZI DI ACCOGLIENZA E DEI SERVIZI CONNESSI AI CITTADINI STRANIERI RICHIEDENTI ASILO. PERIODO 01/01/2017 - 31/12/2017 - PROCEDURA AVENTE AD OGGETTO SERVIZI DI CUI ALL'ALLEGATO IX DEL D. LGS. 50/2016. CPV 85311000-2. IMPORTO PRESUNTO ? 103.145.350,00 IVA ESCLUSA","GARA EUROPEA A PROCEDURA APERTA, AI SENSI DELL'ART. 59 E 60 DEL D. LGS. N. 50/2016, VOLTA ALLA CONCLUSIONE DI UN ACCORDO QUADRO CON PIU' SOGGETTI ECONOMICI PER L'AFFIDAMENTO DEI SERVIZI DI ACCOGLIENZA E DEI SERVIZI CONNESSI AI CITTADINI STRANIERI RICHIEDENTI ASILO. PERIODO 01/01/2017 - 31/12/2017 - LOTTO 1 ZONA ROMA 1",3308725.0,103145350,ROMA,058091,2016-11-16,PROCEDURA APERTA,80197350582,PREFETTURA DI ROMA,PREFETTURA DI ROMA SERVIZI ISTITUZIONALI E GENERALI DELLE AMMINISTRAZIONI PUBBLICHE - AMMINISTRAZIONE GENERALE E SUPPORTO ALLA RAPPRESENTANZA GENERALE DI GOVERNO E DELLO STATO,85311000-2,SERVIZI DI ASSISTENZA SOCIALE CON ALLOGGIO,,AGGIUDICATA,certa
686061676B,,1,PROCEDURA APERTA TELEMATICA GESTIONE SERVIZI SPRAR,PROCEDURA APERTA TELEMATICA GESTIONE SERVIZI SPRAR,2668241.28,2668241.28,PISA,050029,2016-11-14,PROCEDURA APERTA,01897660500,UNIONE VALDERA,SERVIZI GENERALI,85310000-5,SERVIZI DI ASSISTENZA SOCIALE,,AGGIUDICATA,certa
6876772BC4,67645424A6,1,"SERVIZIO DI ACCOGLIENZA DI CITTADINI STRANIERI RICHIEDENTI PROTEZIONE INTERNAZIONALE, NELL'AMBITO DI VARESE E PROVINCIA, DELLA GESTIONE DEI SERVIZI CONNESSI E LA MESSA A DISPOSIZIONE DELLE STRUTTURE DI ACCOGLIENZA. PROCEDURA DI GARA AVENTE AD OGGETTO SERVIZI DI CUI ALL'ALLEGATO IX DEL D. LGS. N. 50/2016. PERIODO 1/10/2016 - 31/12/2016.","SERVIZIO DI ACCOGLIENZA DI CITTADINI STRANIERI RICHIEDENTI PROTEZIONE INTERNAZIONALE, NELL'AMBITO DI VARESE E PROVINCIA, DELLA GESTIONE DEI SERVIZI CONNESSI E LA MESSA A DISPOSIZIONE DELLE STRUTTURE DI ACCOGLIENZA. PROCEDURA DI GARA AVENTE AD OGGETTO SERVIZI DI CUI ALL'ALLEGATO IX DEL D. LGS. N. 50/2016. PERIODO 1/10/2016 - 31/12/2016.",22475.6,22475.6,,012133,2016-11-21,AFFIDAMENTO DIRETTO IN ADESIONE AD ACCORDO QUADRO/CONVENZIONE,80202230589,MINISTERO INTERNO DIPARTIMENTO DELLA P.S.,UTG - PREFETTURA DI VARESE,85311000-2,SERVIZI DI ASSISTENZA SOCIALE CON ALLOGGIO,,,certa
6883098029,,1,PROGETTO SPRAR - SISTEMA DI PROTEZIONE RICHIEDENTI ASILO E RIFUGIATI TRIENNIO 2017-2019 - DM 10.8.2016,PROGETTO SPRAR - SISTEMA DI PROTEZIONE RICHIEDENTI ASILO E RIFUGIATI TRIENNIO 2017-2019 - DM 10.8.2016,2479386.0,2479386.0,,,2016-11-29,PROCEDURA APERTA,01608070643,COMUNE DI SANT'ANGELO DEI LOMBARDI,SERVIZIO AMMINISTRATIVO - SEGRETERIA,98390000-3,ALTRI SERVIZI,,,certa
6875241C58,,1,N. 100 POSTI AGGIUNTIVI PROGETTO SPRAR,N. 100 POSTI AGGIUNTIVI PROGETTO SPRAR,1270500.0,1270500.0,AGRIGENTO,084001,2016-11-18,AFFIDAMENTO DIRETTO,00074260845,COMUNE DI AGRIGENTO,UFFICIO SERVIZIO SOCIALE,85311300-5,SERVIZI DI ASSISTENZA SOCIALE PER BAMBINI E GIOVANI,,AGGIUDICATA,certa
6871264A6C,,1,ALLOGGIAMENTO PROFUGHI,ALLOGGIAMENTO PROFUGHI,65088.0,65088.0,FORLÌ-CESENA,040003,2016-11-16,AFFIDAMENTO DIRETTO,80004780401,MINISTERO INTERNO-PREFETTURA,PREFETTURA DI FORLI'-CESENA,85311000-2,SERVIZI DI ASSISTENZA SOCIALE CON ALLOGGIO,,AGGIUDICATA,certa
68546067CF,,1,SERVIZIO DI ACCOGLIENZA A FAVORE DI MINORI STRANIERI NON ACCOMPAGNATI (MSNA),Oggetto non pubblicabile a causa della potenziale presenza di dati personali,477000.0,477000.0,,013075,2016-11-04,PROCEDURA NEGOZIATA DERIVANTE DA AVVISI CON CUI SI INDICE UNA GARA,80020320133,PREFETTURA DI COMO,UFFICIO TERRITORIALE DEL GOVERNO DI COMO,85320000-8,SERVIZI SOCIALI,,,certa
7078522524,68070245E7,1,AFFIDAMENTO SERVIZIO GESTIONE ACCOGLIENZA N. 213 MIGRANTI ALLA SOC.COOP.VA SOCIALE SENIS HOSPES - PERIODO 1^ MAGGIO 2017/31 LUGLIO 2017,AFFIDAMENTO SERVIZIO GESTIONE ACCOGLIENZA N. 213 MIGRANTI ALLA SOC.COOP.VA SOCIALE SENIS HOSPES - PERIODO 1^ MAGGIO 2017/31 LUGLIO 2017,626876.04,626876.04,,076063,2016-11-30,AFFIDAMENTO DIRETTO IN ADESIONE AD ACCORDO QUADRO/CONVENZIONE,80005560760,PREFETTURA DI POTENZA,PREFETTURA POTENZA,85311000-2,SERVIZI DI ASSISTENZA SOCIALE CON ALLOGGIO,,AGGIUDICATA,probabile
6887936898,,1,BANDO DI GARA ACCOGLIENZA PROFUGHI RICHIEDENTI ASILO ANNO 2017,BANDO DI GARA ACCOGLIENZA PROFUGHI RICHIEDENTI ASILO ANNO 2017,11340000,11340000,,093033,2016-11-29,PROCEDURA APERTA,80009990930,PREFETTURA-UFFICIO TERRITORIALE DEL GOVERNO DI PORDENONE,UFFICIO APPALTI-CONTRATTI,55110000-4,SERVIZI DI SISTEMAZIONE ALBERGHIERA,,,certa
686456416B,,1,"AFFIDAMENTO DIRETTO, AI SENSI DELL'ARTICOLO 36, COMMA 2, LETTERA A) DEL D.LGS. 50/2016, AVENTE AD OGGETTO IL 'SERVIZIO DI ACCOGLIENZA DI CITTADINI STRANIERI EXTRACOMUNITARI RICHIEDENTI LA PROTEZIONE INTERNAZIONALE'. ","AFFIDAMENTO DIRETTO, AI SENSI DELL'ARTICOLO 36, COMMA 2, LETTERA A) DEL D.LGS. 50/2016, AVENTE AD OGGETTO IL 'SERVIZIO DI ACCOGLIENZA DI CITTADINI STRANIERI EXTRACOMUNITARI RICHIEDENTI LA PROTEZIONE INTERNAZIONALE'. ",39900.0,39900.0,,036023,2016-11-09,AFFIDAMENTO DIRETTO,80001270364,PREFETTURA U.T.G. DI MODENA,SERVIZIO CONTABILITA E GESTIONE FINANZIARIA,85310000-5,SERVIZI DI ASSISTENZA SOCIALE,,,certa
688798510A,62379295DA,1,SERVIZI DI PRIMA A CCOGLIENZA DI CITTADINI RICHIEDENTI PROTEZIONE INTERNAZIONALE,SERVIZI DI PRIMA ACCOGLIENZA DI CITTADINI RICHIEDENTI PROTEZIONE INTERNAZIONALE,218232.0,218232.0,,065009,2016-11-29,AFFIDAMENTO DIRETTO IN ADESIONE AD ACCORDO QUADRO/CONVENZIONE,80025150659,PREFETTURA,MINISTERO DELL'INTERNO,55130000-0,ALTRI SERVIZI ALBERGHIERI,,,certa
6840848E57,,1,PROCEDURA APERTA PER LA REALIZZAZIONE DI PROGETTI DI ACCOGLIENZA DEGLI ENTI LOCALI IN SENO ALLO SPRAR. INDIVIDUAZIONE SOGGETTO ATTUATORE.,PROCEDURA APERTA PER LA REALIZZAZIONE DI PROGETTI DI ACCOGLIENZA DEGLI ENTI LOCALI IN SENO ALLO SPRAR. INDIVIDUAZIONE SOGGETTO ATTUATORE.,3233471.43,3233471.43,TRAPANI,081001,2016-11-04,PROCEDURA APERTA,CFAVCP-000124C,DISTRETTO SOCIO SANITARIO D55,COMUNE DI ALCAMO - COMUNE CAPOFILA,85311000-2,SERVIZI DI ASSISTENZA SOCIALE CON ALLOGGIO,,AGGIUDICATA,certa
6875396C41,,3,AFFIDAMENTO DELLA GESTIONE DI UN SERVIZIO DI ACCOGLIENZA TEMPORANEA IN STRUTTURE NELLA DISPONIBILITÀ DELL'AGGIUDICATARIA A FAVORE DI 40 MINORI STRANIERI NON ACCOMPAGNATI,SERVIZIO DI ACCOGLIENZA PER MAX 10 MSNA - MASCHI DI ETA' COMPRESA TRA I 14 E I 16 ANNI,186615.0,745530.0,,,2016-11-21,PROCEDURA NEGOZIATA SENZA PREVIA PUBBLICAZIONE,01199250158,COMUNE DI MILANO,AREA RESIDENZIALITA',85320000-8,SERVIZI SOCIALI,,"SENZA ESITO A SEGUITO DI OFFERTE IRREGOLARI O INAMMISSIBILI, NON CONGRUE O NON APPROPRIATE",certa
6884001954,,1,"PROGETTO SPRAR IN PROSECUZIONE (2017/2019). CATEGORIA VULNERABILI (DM). PROCEDURA DI SELEZIONE AD EVIDENZA PUBBLICA PER INDIVIDUZIONE SOGGETTO GESTORE SERVIZI SERVIZI DI ACCOGLIENZA, INTEGRAZIONE E TUTELA RIVOLTI AI RICHIEDENTI ASILO E PROTEZIONE INTERNAZIONALE.","PROGETTO SPRAR IN PROSECUZIONE (2017/2019). CATEGORIA VULNERABILI (DM). PROCEDURA DI SELEZIONE AD EVIDENZA PUBBLICA PER INDIVIDUZIONE SOGGETTO GESTORE SERVIZI SERVIZI DI ACCOGLIENZA, INTEGRAZIONE E TUTELA RIVOLTI AI RICHIEDENTI ASILO E PROTEZIONE INTERNAZIONALE.",617250.0,617250.0,LECCE,075092,2016-11-30,PROCEDURA APERTA,03716900752,UNIONE TRA I COMUNI DI CARMIANO COPERTINO LEVERANO PORTO CESAREO VEGLIE,CENTRALE UNICA DI COMMITTENZA UNION 3,85311000-2,SERVIZI DI ASSISTENZA SOCIALE CON ALLOGGIO,,AGGIUDICATA,certa
6859207CAB,6756876E74,1,ACCOGLIENZA CITTADINI STRANIERI RICHIEDENTI PROTEZIONE INTERNAZIONALE - 01.11.2016 - 31.12.2016,ACCOGLIENZA CITTADINI STRANIERI RICHIEDENTI PROTEZIONE INTERNAZIONALE - 01.11.2016 - 31.12.2016,105310.4,105310.4,LECCO,097007,2016-11-28,CONFRONTO COMPETITIVO IN ADESIONE AD ACCORDO QUADRO/CONVENZIONE,01409210133,COMUNITA' MONTANA VALSASSINA VALVARRONE VAL D'ESINO RIVIERA,SERVIZI ALLA PERSONA,85311000-2,SERVIZI DI ASSISTENZA SOCIALE CON ALLOGGIO,,AGGIUDICATA,certa
6869990F14,,4,"SERVIZI DI ACCOGLIENZA A FAVORE DI CITTADINI STRANIERI PRESENTI SUL TERRITORIO, PRESSO STRUTTURE NELLA DISPONIBILITÀ DEGLI ENTI INVITATI, A FARE TEMPO DALLA DATA DI AGGIUDICAZIONE E FINO A DICEMBRE 2016",UNITÀ D'OFFERTA IN GRADO DI ACCOGLIERE ED OSPITARE FINO A 100 CITTADINI STRANIERI TEMPORANEAMENTE PRESENTI SUL TERRITORIO (UOMINI) ,117800.0,441750.0,MILANO,015146,2016-11-15,PROCEDURA NEGOZIATA SENZA PREVIA PUBBLICAZIONE,01199250158,COMUNE DI MILANO,DIREZIONE CENTRALE POLITICHE SOCIALI,85311000-2,SERVIZI DI ASSISTENZA SOCIALE CON ALLOGGIO,,AGGIUDICATA,probabile
6876746651,,1,AFFIDAMENTO ALLA SOCIETÀ COOP- SENIS HOSPES P.I. 01709130767 - SERVIZIO ACCOGLIENZA N. 25 MIGRANTI PROROGA PERIODO 1^ DICEMBRE /31 DICEMBRE 2016,AFFIDAMENTO ALLA SOCIETÀ COOP- SENIS HOSPES P.I. 01709130767 - SERVIZIO ACCOGLIENZA N. 25 MIGRANTI PROROGA PERIODO 1^ DICEMBRE /31 DICEMBRE 2016,24792.25,24792.25,,076063,2016-11-21,AFFIDAMENTO DIRETTO,80005560760,PREFETTURA DI POTENZA,PREFETTURA POTENZA,85311000-2,SERVIZI DI ASSISTENZA SOCIALE CON ALLOGGIO,,,probabile
686057880F,,1,SERVIZIO DI ACCOGLIENZA ED ASSISTENZA CITTADINI STRANIERI RICHIEDENTI PROTEZIONE INTERNAZIONALE 72 OSPITI,SERVIZIO DI ACCOGLIENZA ED ASSISTENZA CITTADINI STRANIERI RICHIEDENTI PROTEZIONE INTERNAZIONALE 72 OSPITI,198720.0,198720.0,,026086,2016-11-10,AFFIDAMENTO DIRETTO,80185690585,MINISTERO DELL INTERNO-DIPARTIMENTO PER GLI AFFARI INTERNI E TERRITORIALI,PREFETTURA UTG DI TREVISO,55110000-4,SERVIZI DI SISTEMAZIONE ALBERGHIERA,,AGGIUDICATA,certa
657061208E,,1,SERVIZIO DI ACCOGLIENZA DI MINORI STRANIERI NON ACCOMPAGNATI DI SESSO MASCHILE - PERIODO 01.02.2016-31.01.2017,Oggetto non pubblicabile a causa della potenziale presenza di dati personali,2022150.0,2022150.0,UDINE,030129,2016-11-26,AFFIDAMENTO DIRETTO IN ADESIONE AD ACCORDO QUADRO/CONVENZIONE,00168650307,COMUNE DI UDINE,SERVIZIO SERVIZI PER LA SALUTE ED IL BENESSERE SOCIALE,85311000-2,SERVIZI DI ASSISTENZA SOCIALE CON ALLOGGIO,,AGGIUDICATA,certa
7049641BC7,,1,GARA APERTA PER L'AFFIDAMENTO DEL SERVIZIO DI ACCOGLIENZA DI CITTADINI STRANIERI EXTRACOMUNITARI RICHIEDENTI PROTEZIONE INTERNAZIONALE NEL TERRITORIO DEL COMUNE DI RUSSI PRESSO STRUTTURE INDIVIDUATE DALL'AFFIDATARIO,GARA APERTA PER L'AFFIDAMENTO DEL SERVIZIO DI ACCOGLIENZA DI CITTADINI STRANIERI EXTRACOMUNITARI RICHIEDENTI PROTEZIONE INTERNAZIONALE NEL TERRITORIO DEL COMUNE DI RUSSI PRESSO STRUTTURE INDIVIDUATE DALL'AFFIDATARIO,447125.0,447125.0,RAVENNA,039016,2016-11-30,PROCEDURA APERTA,00246880397,COMUNE DI RUSSI,AREA SERVIZI ALLA CITTADINANZA,85310000-5,SERVIZI DI ASSISTENZA SOCIALE,,AGGIUDICATA,certa
685623581A,,3,SERVIZIO DI ACCOGLIENZA DI CITTADINI STRANIERI RICHIEDENTI PROTEZIONE INTERNAZIONALE,SERVIZIO DI ACCOGLIENZA DI CITTADINI STRANIERI RICHIEDENTI PROTEZIONE INTERNAZIONALE,95480.0,286440.0,,039014,2016-11-04,PROCEDURA NEGOZIATA SENZA PREVIA PUBBLICAZIONE,80006840393,PREFETTURA - UFFICIO TERRITORIALE DEL GOVERNO DI RAVENNA,PREFETTURA - UFFICIO TERRITORIALE DEL GOVERNO DI RAVENNA,85311000-2,SERVIZI DI ASSISTENZA SOCIALE CON ALLOGGIO,,,certa
706859551F,68070245E7,1,AFFIDAMENTO SERVIZIO ACCOGLIENZA N. 7 MIGRANTI ASSOCIAZIONE CULTURALE E PROMOZIONE SOCIALE HUMAN FLOWERS - PROROGA TECNICA 1^ MAGGIO 2017 / 31 LUGLIO 2017,AFFIDAMENTO SERVIZIO ACCOGLIENZA N. 7 MIGRANTI ASSOCIAZIONE CULTURALE E PROMOZIONE SOCIALE HUMAN FLOWERS - PROROGA TECNICA 1^ MAGGIO 2017 / 31 LUGLIO 2017,20286.0,20286.0,,076063,2016-11-30,AFFIDAMENTO DIRETTO IN ADESIONE AD ACCORDO QUADRO/CONVENZIONE,80005560760,PREFETTURA DI POTENZA,PREFETTURA POTENZA,85311000-2,SERVIZI DI ASSISTENZA SOCIALE CON ALLOGGIO,,,probabile
690817130D,,1,SERVIZIO DI ACCOGLIENZA A FAVORE DI RICHIEDENTI ASILO,SERVIZIO DI ACCOGLIENZA A FAVORE DI RICHIEDENTI ASILO,642400.0,642400.0,UDINE,030129,2016-11-07,AFFIDAMENTO DIRETTO IN ADESIONE AD ACCORDO QUADRO/CONVENZIONE,00168650307,COMUNE DI UDINE,SERVIZIO SERVIZI PER LA SALUTE ED IL BENESSERE SOCIALE,85311000-2,SERVIZI DI ASSISTENZA SOCIALE CON ALLOGGIO,,AGGIUDICATA,certa
6925246DC6,,1,SPRAR MSNA POSTI AGGIUNTIVI NEOMAGGIORENNI 2016 ,SPRAR MSNA POSTI AGGIUNTIVI NEOMAGGIORENNI 2016 ,41300.0,41300.0,,,2016-11-28,AFFIDAMENTO DIRETTO,00215640848,COMUNE DI RAFFADALI,SETTORE SERVIZI SOCIALI,85311000-2,SERVIZI DI ASSISTENZA SOCIALE CON ALLOGGIO,,AGGIUDICATA,certa
6878708968,6740884174,5,AFFIDAMENTO SERVIZIO ACCOGLIENZA CITTADINI STRANIERI E SERVIZI CONNESSI AI CITTADINI RICHIEDENTI PROTEZIONE INTERNAZIONALE NELLA PROVINCIAL DELL'AQUILA,SERVIZIO ACCOGLIENZA E SERVIZI CONNESSI AI CITTADINI RICHIEDENTI ORITEZINEN INTERNAZIONALE NELLA PROVINCIA DELL'AQUILA,60800.0,195638.0,,066049,2016-11-22,AFFIDAMENTO DIRETTO IN ADESIONE AD ACCORDO QUADRO/CONVENZIONE,80003810662,UFFICIO TERRITORIALE DEL GOVERNO,PREFETTURA U.T.G. L'AQUILA,85311000-2,SERVIZI DI ASSISTENZA SOCIALE CON ALLOGGIO,,,certa
69899701B9,,1,CONVENZIONE SPRAR 2017-2019 PER MSNA,CONVENZIONE SPRAR 2017-2019 PER MSNA,611229.0,611229.0,,082066,2016-11-16,PROCEDURA APERTA,80016180822,COMUNE DI S.CRISTINA GELA,AREA SOCIO CULTURALE,85320000-8,SERVIZI SOCIALI,,,certa
74323866F3,,1,"MANIFESTAZIONE D'INTERESSE PER IL SERVIZIO DI COPROGETTAZIONE,ORGANIZZAZIONE E GESTIONE DEL PROGETTO SPRAR","MANIFESTAZIONE D'INTERESSE PER IL SERVIZIO DI COPROGETTAZIONE,ORGANIZZAZIONE E GESTIONE DEL PROGETTO SPRAR",582085.33,582085.33,,083005,2016-11-10,PROCEDURA NEGOZIATA SENZA PREVIA PUBBLICAZIONE,00084640838,COMUNE DI BARCELLONA POZZO DI GOTTO,ATTIVITA' SOCIALI E ASSISTENZIALI,85311300-5,SERVIZI DI ASSISTENZA SOCIALE PER BAMBINI E GIOVANI,,,certa
7125445739,,1,ORIDNANZA SINDACALE N. 115 DEL 17/11/2016 - SERVIZIO DI CUSTODIA E SORVEGLIANZA MINORI STRANIERI NON ACCOMPAGNATI - IV TRIMESTRE 2016,Oggetto non pubblicabile a causa della potenziale presenza di dati personali,45225.0,45225.0,,078044,2016-11-17,AFFIDAMENTO DIRETTO,00391240785,COMUNE DI CORIGLIANO CALABRO,SETTORE CULTURA-SERVIZI SOCIALI-SPORT E TEMPO LIBERO,85311300-5,SERVIZI DI ASSISTENZA SOCIALE PER BAMBINI E GIOVANI,,,certa
6872505A87,,1,AFFIDAMENTO DIRETTO SERVIZIO D1I ACCOGLIENZA STRAORDINARIA MIGRANTI ATI ATLANTIA ORSETTA DAL 01.09.2016 AL 15.11.2016,AFFIDAMENTO DIRETTO SERVIZIO D1I ACCOGLIENZA STRAORDINARIA MIGRANTI ATI ATLANTIA ORSETTA DAL 01.09.2016 AL 15.11.2016,682946.64,682946.64,,092101,2016-11-16,AFFIDAMENTO IN ECONOMIA - COTTIMO FIDUCIARIO,80014130928,PREFETTURA DI CAGLIARI UTG,SERVIZIO A.S.G.A.C.,85311000-2,SERVIZI DI ASSISTENZA SOCIALE CON ALLOGGIO,,,probabile
68787403D2,6740884174,5,AFFIDAMENTO SERVIZIO ACCOGLIENZA CITTADINI STRANIERI E SERVIZI CONNESSI AI CITTADINI RICHIEDENTI PROTEZIONE INTERNAZIONALE NELLA PROVINCIAL DELL'AQUILA,SERVIZIO ACCOGLIENZA E SERVIZI CONNESSI AI CITTADINI RICHIEDENTI PROTEZIONE INTERNAZIONALE NELLA PROVINCIA DELL'AQUILA,29184.0,195638.0,,,2016-11-22,AFFIDAMENTO DIRETTO IN ADESIONE AD ACCORDO QUADRO/CONVENZIONE,80003810662,UFFICIO TERRITORIALE DEL GOVERNO,PREFETTURA U.T.G. L'AQUILA,85311000-2,SERVIZI DI ASSISTENZA SOCIALE CON ALLOGGIO,,,certa
6940774BE3,,1,SERVIZIO DI ACCOGLIENZA CITTADINI STRANIERI RICHIEDENTI PROTEZIONE INTERNAZIONALE,SERVIZIO DI ACCOGLIENZA CITTADINI STRANIERI RICHIEDENTI PROTEZIONE INTERNAZIONALE,224280.0,224280.0,,080096,2016-11-17,AFFIDAMENTO DIRETTO IN ADESIONE AD ACCORDO QUADRO/CONVENZIONE,80003650803,COMUNE DI VILLA SAN GIOVANNI,UFFICIO SEGRETERIA,85311000-2,SERVIZI DI ASSISTENZA SOCIALE CON ALLOGGIO,,,certa
712546688D,,1,ORIDNANZA SINDACALE N. 115 DEL 17/11/2016 - SERVIZIO DI CUSTODIA E SORVEGLIANZA MINORI STRANIERI NON ACCOMPAGNATI - IV TRIMESTRE 2016,Oggetto non pubblicabile a causa della potenziale presenza di dati personali,201335.0,201335.0,,078044,2016-11-17,AFFIDAMENTO DIRETTO,00391240785,COMUNE DI CORIGLIANO CALABRO,SETTORE CULTURA-SERVIZI SOCIALI-SPORT E TEMPO LIBERO,85311300-5,SERVIZI DI ASSISTENZA SOCIALE PER BAMBINI E GIOVANI,,,certa
695492058B,652716314E,1,SERVIZIO ACCOGLIENZA RICHIEDENTI PROTEZIONE INTERNAZIONALE,SERVIZIO ACCOGLIENZA RICHIEDENTI PROTEZIONE INTERNAZIONALE,302389.2,302389.2,,036023,2016-11-01,AFFIDAMENTO DIRETTO IN ADESIONE AD ACCORDO QUADRO/CONVENZIONE,80001270364,PREFETTURA U.T.G. DI MODENA,SERVIZIO CONTABILITA E GESTIONE FINANZIARIA,85310000-5,SERVIZI DI ASSISTENZA SOCIALE,,,certa
