cig,cig_accordo_quadro,n_lotti_componenti,oggetto_gara,oggetto_lotto,importo_lotto,importo_complessivo_gara,provincia,luogo_istat,data_pubblicazione,tipo_scelta_contraente,cf_amministrazione_appaltante,denominazione_amministrazione_appaltante,denominazione_centro_costo,cod_cpv,descrizione_cpv,DURATA_PREVISTA,ESITO,confidenza
B4D0385491,,1,"PROGETTO SAI – SISTEMA DI ACCOGLIENZA E INTEGRAZIONE DI STRANIERI CATEGORIA MSNA. PROCEDURA PER AFFIDAMENTO GESTIONE DELLE AZIONI E SERVIZI DI ACCOGLIENZA E INTEGRAZIONE RELATIVO AL FONDO NAZIONALE PER LE POLITICHE E I SERVIZI DELL'ASILO, PERIODO 01/02/2025-31/12/2026 (PROSECUZIONE PROG. N 1328)","PROGETTO SAI – SISTEMA DI ACCOGLIENZA E INTEGRAZIONE DI STRANIERI CATEGORIA MSNA. PROCEDURA PER AFFIDAMENTO GESTIONE DELLE AZIONI E SERVIZI DI ACCOGLIENZA E INTEGRAZIONE RELATIVO AL FONDO NAZIONALE PER LE POLITICHE E I SERVIZI DELL'ASILO, PERIODO 01/02/2025-31/12/2026 (PROSECUZIONE PROG. N 1328)",1146958.0,1146958.0,COSENZA,078105,2024-12-16,PROCEDURA APERTA,CFAVCP-00017C7,C.U.C. AGORÀ,COMUNE DI ROGLIANO - SETTORE SERVIZI SOCIALI,85311000-2,SERVIZI DI ASSISTENZA SOCIALE CON ALLOGGIO,,,certa
B4EFB7C71C,,1,SERVIZIO DI PULIZIA ED IGIENE AMBIENTALE PRESSO IL CENTRO DI PRIMA ACCOGLIENZA (C.P.A.) PER RICHIEDENTI ASILO SITO NEL COMUNE DI ISOLA DI CAPO RIZZUTO IN LOCALITÀ SANT'ANNA,SERVIZIO DI PULIZIA ED IGIENE AMBIENTALE PRESSO IL CENTRO DI PRIMA ACCOGLIENZA (C.P.A.) PER RICHIEDENTI ASILO SITO NEL COMUNE DI ISOLA DI CAPO RIZZUTO IN LOCALIT&#192; SANT&#8217;ANNA,4932560.16,4932560.16,CROTONE,101013,2024-12-24,ND P1_20,91011070793,PREFETTURA DI CROTONE,PREFETTURA UTG DI CROTONE,90911000-6,"SERVIZI DI PULIZIA DI ALLOGGI, EDIFICI E FINESTRE",,AGGIUDICATA,certa
B4A4D3F5D4,,1,CONFERIMENTO INCARICO DI REVISORE CONTABILE INDIPENDENTE PER L'ATTIVITÀ DI VERIFICA AMMINISTRATIVO-CONTABILE DELLE SPESE SOSTENUTE NELL'AMBITO DEL PROGETTO SAI DEL COMUNE DI FINALE LIGURE (PROG-73-PR-3) RELATIVAMENTE ALLE ANNUALITÀ 2024-2025-2026,CONFERIMENTO INCARICO DI REVISORE CONTABILE INDIPENDENTE PER L'ATTIVITÀ DI VERIFICA AMMINISTRATIVO-CONTABILE DELLE SPESE SOSTENUTE NELL'AMBITO DEL PROGETTO SAI DEL COMUNE DI FINALE LIGURE (PROG-73-PR-3) RELATIVAMENTE ALLE ANNUALITÀ 2024-2025-2026,12294.0,12294.0,SAVONA,009029,2024-12-06,AFFIDAMENTO DIRETTO,00318330099,COMUNE DI FINALE LIGURE,SETTORE SERVIZI ALLA PERSONA,79212500-8,SERVIZI DI REVISIONE DEI CONTI,,AGGIUDICATA,certa
B4B80D274E,9681072159,1,"RINNOVO CONVENZIONE PER L'AFFIDAMENTO ALLA COOPERATIVA SOCIALE OLINDA, CON SEDE LEGALE A MEDOLE, DEI SERVIZI DI GESTIONE DI CENTRI DI ACCOGLIENZA, COSTITUITI DA SINGOLE UNITÀ ABITATIVE, PER CITTADINI STRANIERI RICHIEDENTI PROTEZIONE INTERNAZIONALE, NELL'AMBITO DEL TERRITORIO DI MANTOVA, PER IL PERIODO DAL1° DICEMBRE 2024 AL 30 NOVEMBRE 2025",RINNOVO DELLA CONVENZIONE CON LA COOPERATIVA SOCIALE OLINDA PER L'AFFIDAMENTO DEL SERVIZIO DI GESTIONE DEI CENTRI DI ACCOGLIENZA PER I CITTADINI STRANIERI RICHIEDENTI PROTEZIONE INTERNAZIONALE,1300860.0,1300860.0,MANTOVA,020030,2024-12-10,PROCEDURA APERTA,80019530205,PREFETTURA DI MANTOVA,PREFETTO,85311000-2,SERVIZI DI ASSISTENZA SOCIALE CON ALLOGGIO,,,certa
B4B736422F,,1,AFFIDAMENTO DEI SERVIZI DI PRIMA ACCOGLIENZA IN OCCASIONE DEL CORRIDOIO UMANITARIO DEL 29 LUGLIO 2024 PRESSO L'AREOPORTO DI FIUMICINO TERMINAL T5 E FORNITURA DEI KIT DI PRIMA ACCOGLIENZA PER 130 MIGRANTI PROVENIENTI DALLA LIBIA RICHIEDENTI PROTEZIONE INTERNAZIONALE AI SENSI E PER GLI EFFETTI DELL ART 48 DLGS 2023 PER GLI AFFIDAMENTI DI FORNITURE E SERVIZI SOTTO LE SOGLIE DI RILEVANZA,SERVIZIO DI PULIZIA,14062.0,14062.0,ROMA,058120,2024-12-11,AFFIDAMENTO DIRETTO,80197350582,PREFETTURA DI ROMA,PREFETTURA DI ROMA SERVIZI ISTITUZIONALI E GENERALI DELLE AMMINISTRAZIONI PUBBLICHE - AMMINISTRAZIONE GENERALE E SUPPORTO ALLA RAPPRESENTANZA GENERALE DI GOVERNO E DELLO STATO,85320000-8,SERVIZI SOCIALI,,AGGIUDICATA,certa
B48D05A2DC,,1,"SERVIZIO DI ACCOGLIENZA IN STRUTTURE RESIDENZIALI E SEMIRESIDENZIALI DI MINORI, GESTANTI E MADRI CON MINORI, E MINORI STRANIERI NON ACCOMPAGNATI ASSISTITI DAL SETTORE SERVIZI SOCIALI DELL'UNIONE DEI COMUNI VALLE DEL SAVIO","SERVIZIO DI ACCOGLIENZA IN STRUTTURE RESIDENZIALI E SEMIRESIDENZIALI DI MINORI, GESTANTI E MADRI CON MINORI, E MINORI STRANIERI NON ACCOMPAGNATI ASSISTITI DAL SETTORE SERVIZI SOCIALI DELL'UNIONE DEI COMUNI VALLE DEL SAVIO",110710.25,110710.25,FORLÌ-CESENA,040007,2024-12-03,AFFIDAMENTO DIRETTO,90070700407,UNIONE DEI COMUNI VALLE DEL SAVIO,SETTORE SERVIZI SOCIALI,85320000-8,SERVIZI SOCIALI,,AGGIUDICATA,certa
B4B2E0A71D,,1,"SERVIZIO DI ACCOGLIENZA IN STRUTTURE RESIDENZIALI E SEMIRESIDENZIALI DI MINORI, GESTANTI E MADRI CON MINORI, E MINORI STRANIERI NON ACCOMPAGNATI ASSISTITI DAL SETTORE SERVIZI SOCIALI DELL'UNIONE DEI COMUNI VALLE DEL SAVIO","SERVIZIO DI ACCOGLIENZA IN STRUTTURE RESIDENZIALI E SEMIRESIDENZIALI DI MINORI, GESTANTI E MADRI CON MINORI, E MINORI STRANIERI NON ACCOMPAGNATI ASSISTITI DAL SETTORE SERVIZI SOCIALI DELL'UNIONE DEI COMUNI VALLE DEL SAVIO",101913.9,101913.9,FORLÌ-CESENA,040007,2024-12-10,AFFIDAMENTO DIRETTO,90070700407,UNIONE DEI COMUNI VALLE DEL SAVIO,SETTORE SERVIZI SOCIALI,85320000-8,SERVIZI SOCIALI,,AGGIUDICATA,certa
B50BAB88E5,,1,SERVIZIO REVISORE DEI CONTI PROGETTO SAI DEL COMUNE DI BASELICE 2024-2025-2026,SERVIZIO REVISORE DEI CONTI PROGETTO SAI DEL COMUNE DI BASELICE 2024-2025-2026,11231.08,11231.08,BENEVENTO,062007,2024-12-31,AFFIDAMENTO DIRETTO,82002220620,COMUNE DI BASELICE,SETTORE ECONOMICO FINANZIARIO,79212500-8,SERVIZI DI REVISIONE DEI CONTI,,AGGIUDICATA,certa
B284BBA035,,1,COLLOCAMENTO MSNA IN STRUTTURA,COLLOCAMENTO MSNA IN STRUTTURA COMUNITARIA 2 SEMESTRE 2024,18400.0,18400.0,MILANO,015002,2024-12-12,AFFIDAMENTO DIRETTO,01310880156,COMUNE DI ABBIATEGRASSO,SETTORE SERVIZI ALLA PERSONA,98000000-3,"ALTRI SERVIZI DI COMUNITÀ, SOCIALI E PERSONALI",,AGGIUDICATA,certa
B4948150DE,,1,ISTITUZIONALIZZAZIONE NUCLEO FAMILIARE PRESSO COMUNITÀ CHIARA LUCE. SERVIZIO SAI IL SALENTO ACCOGLIE ORDINARI,ISTITUZIONALIZZAZIONE NUCLEO FAMILIARE PRESSO COMUNITÀ CHIARA LUCE. SERVIZIO SAI IL SALENTO ACCOGLIE ORDINARI,25300.0,25300.0,LECCE,075043,2024-12-04,AFFIDAMENTO DIRETTO,93075930755,TERRE DI ACAYA E DI ROCA,AFFARI GENERALI,85300000-2,SERVIZI DI ASSISTENZA SOCIALE E SERVIZI AFFINI,,AGGIUDICATA,certa
B4E5980AA1,,1,"AFFIDAMENTI DIRETTI - PROSECUZIONE ANNO 2025 DEI SERVIZI DI ACCOGLIENZA PER MINORI, MINORI STRANIERI NON ACCOMPAGNATI (MSNA), MADRI CON FIGLI MINORI E VITTIME DELLA VIOLENZA DI GENERE, GI INSERITI IN STRUTTURE RESIDENZIALI SU DISPOSIZIONE DEL SERVIZIO SOCIALE PROFESSIONALE O DELL'AUTORIT GIUDIZIARIA COMPETENTE ","AFFIDAMENTI DIRETTI - PROSECUZIONE ANNO 2025 DEI SERVIZI DI ACCOGLIENZA PER MINORI, MINORI STRANIERI NON ACCOMPAGNATI (MSNA), MADRI CON FIGLI MINORI E VITTIME DELLA VIOLENZA DI GENERE, GI INSERITI IN STRUTTURE RESIDENZIALI SU DISPOSIZIONE DEL SERVIZIO SOCIALE PROFESSIONALE O DELL'AUTORIT GIUDIZIARIA COMPETENTE ",19910.0,19910.0,ANCONA,042018,2024-12-19,AFFIDAMENTO DIRETTO,00343140422,COMUNE DI FALCONARA MARITTIMA,SETTORE POLITICHE SOCIALI - UOC SERVIZI SOCIALI,85300000-2,SERVIZI DI ASSISTENZA SOCIALE E SERVIZI AFFINI,,AGGIUDICATA,certa
B4D0D3A740,,1,INCARICO DI REVISORE DEI CONTI INDIPENDENTE CON RIFERIMENTO ALLA RENDICONTAZIONE DEL PROGETTO SAI PROG 128 PR 3 PERIODO 01.01.2024-31.12.2026.,INCARICO DI REVISORE DEI CONTI INDIPENDENTE CON RIFERIMENTO ALLA RENDICONTAZIONE DEL PROGETTO SAI PROG 128 PR 3 PERIODO 01.01.2024-31.12.2026.,9000.0,9000.0,ANCONA,042002,2024-12-16,AFFIDAMENTO DIRETTO,02788480420,UNIONE DEI COMUNI LE TERRE DELLA MARCA SENONE,AREA SERVIZI SOCIALI E A.T.S. N.8,79000000-4,"SERVIZI PER LE IMPRESE: SERVIZI GIURIDICI, DI MARKETING, DI CONSULENZA, DI RECLUTAMENTO, DI STAMPA E DI SICUREZZA",,AGGIUDICATA,certa
B50D2B43CA,,1,PROCEDURA APERTA PER L&#8217;INDIVIDUAZIONE DI UN SOGGETTO ATTUATORE PER LA GESTIONE DEL PROGETTO SAI - SISTEMA DI ACCOGLIENZA E INTEGRAZIONE - PERIODO 01/01/2025 - 31/12/2026 DESTINATO ALL&#8217;ACCOGLIENZA DI 52 POSTI ORDINARI GIA&#8217; FINANZIATI DAL D.M. N. 29306 DEL 1&#176; LUGLIO 2024,"CON DETERMINA A CONTRARRE N. 345 DEL 20-12-2024, QUESTA AMMINISTRAZIONE HA DECISO DI AFFIDARE IN APPALTO IL SERVIZIO DI CUI IN EPIGRAFE MEGLIO DESCRITTO NEL CAPITOLATO SPECIALE D&#8217;APPALTO. L&#8217;AFFIDAMENTO AVVIENE MEDIANTE PROCEDURA APERTA TELEMATICA AI SENSI DELL&#8217;ART. 71 DEL D. LGS. 36/2023 CON APPLICAZIONE DEL CRITERIO DELL&#8217;OFFERTA ECONOMICAMENTE PI&#249; VANTAGGIOSA DI CUI ALL'ART. 108 DEL D.LGS. N. 36/2023, CON ATTRIBUZIONE, DA PARTE DI UNA COMMISSIONE TECNICA APPOSITAMENTE COSTITUITA AI SENSI DELL&#8217;ART. 51 D.LGS. N .36/2023, DI PUNTI 100/100 CALCOLATI, AI SENSI DELL'ART. 108, COMMA 5 DEL D.LGS. N. 36/2023, SOLO SULL'ELEMENTO QUALIT&#224;, CONSIDERATO IL COSTO FISSO DEL PROGETTO TOTALMENTE FINANZIATO E NON RIDUCIBILE.",3847396.0,3847396.0,TORINO,001171,2024-12-31,PROCEDURA APERTA,95551120017,CONSORZIO INTERCOMUNALE DI SERVIZI,AREA ADULTI E FAMIGLIE,85311000-2,SERVIZI DI ASSISTENZA SOCIALE CON ALLOGGIO,,AGGIUDICATA,certa
B4A53D010A,,1,AFFIDAMENTO DEL SERVIZIO DEL PROGETTO DI SECONDA ACCOGLIENZA NELLA RETE SIPROIMI – CATEGORIA MINORI STRANIERI NON ACCOMPAGNATI (MSNA) – COMUNE DI NISCEMI (CL).PROSECUZIONE DEL PROGETTO MSNA RETE SIPROIMI PER IL BIENNIO 2025/2026 - D.M. 01/07/2024 N. 29306.,AFFIDAMENTO DEL SERVIZIO DEL PROGETTO DI SECONDA ACCOGLIENZA NELLA RETE SIPROIMI – CATEGORIA MINORI STRANIERI NON ACCOMPAGNATI (MSNA) – COMUNE DI NISCEMI (CL).PROSECUZIONE DEL PROGETTO MSNA RETE SIPROIMI PER IL BIENNIO 2025/2026 - D.M. 01/07/2024 N. 29306.,854080.0,854080.0,CALTANISSETTA,085013,2024-12-24,PROCEDURA APERTA,82002100855,COMUNE DI NISCEMI,RIPARTIZIONE AFFARI SOCIALI E CULTURALI,85311000-2,SERVIZI DI ASSISTENZA SOCIALE CON ALLOGGIO,,,certa
B26531B305,,1,ACCOGLIMENTO MSNA PERIODO GIUGNO 2024 - CASO N. 16,ACCOGLIMENTO MSNA PERIODO GIUGNO 2024 - CASO N. 16,5700.0,5700.0,TRIESTE,032006,2024-12-16,AFFIDAMENTO DIRETTO,00111990321,COMUNE DI MUGGIA,SERVIZIO SOCIALE DEI COMUNI AMBITO 1.3,85311300-5,SERVIZI DI ASSISTENZA SOCIALE PER BAMBINI E GIOVANI,,AGGIUDICATA,certa
B4A8552BF1,95091617E5,1,SAI MSNA ATS CAPS ABUSUAN CONTRATTO ORDINATIVO ATTUATIVO PROG-598-PR-3 RELATIVO ALLA PROCEDURA APERTA PER L'AFFIDAMENTO DELLA GESTIONE TRIENNALE DEL SERVIZIO DENOMINATO SAI - SISTEMA DI ACCOGLIENZA E INTEGRAZIONE PER IL TRIENNIO 2023-2025 CIG PADRE 95091617E5 - CUP J91H22000190001 - CPV 85311000-5,SAI MSNA ATS CAPS ABUSUAN CONTRATTO ORDINATIVO ATTUATIVO PROG-598-PR-3 RELATIVO ALLA PROCEDURA APERTA PER L'AFFIDAMENTO DELLA GESTIONE TRIENNALE DEL SERVIZIO DENOMINATO SAI - SISTEMA DI ACCOGLIENZA E INTEGRAZIONE PER IL TRIENNIO 2023-2025 CIG PADRE 95091617E5 - CUP J91H22000190001 - CPV 85311000-5,1815720.37,1815720.37,BARI,072006,2024-12-05,AFFIDAMENTO DIRETTO,80015010723,COMUNE DI BARI,RIPARTIZIONE SERVIZI ALLA PERSONA,85311000-2,SERVIZI DI ASSISTENZA SOCIALE CON ALLOGGIO,,AGGIUDICATA,certa
B4F6CC31D9,,1,AFFIDAMENTO DIRETTO SERVIZIO DI ACCOGLIENZA N. 105 AD ARCI SOLIDARIETA' ORA D'ARIA,SERVIZIO DI ACCOGLIENZA DI CITTADINI STRANIERI EXTRACOMUNITARI RICHIEDENTI PROTEZIONE INTERNAZIONALE PRESSO SINGOLE UNITA' ABITATIVE,720345.0,720345.0,PERUGIA,054039,2024-12-24,ALTRA PROCEDURA A FASE UNICA,80013260544,PREFETTURA DI PERUGIA,PREFETTURA - UTG PERUGIA,85311000-2,SERVIZI DI ASSISTENZA SOCIALE CON ALLOGGIO,,AGGIUDICATA,certa
B4E58DE4F3,,1,"AFFIDAMENTI DIRETTI - PROSECUZIONE ANNO 2025 DEI SERVIZI DI ACCOGLIENZA PER MINORI, MINORI STRANIERI NON ACCOMPAGNATI (MSNA), MADRI CON FIGLI MINORI E VITTIME DELLA VIOLENZA DI GENERE, GI INSERITI IN STRUTTURE RESIDENZIALI SU DISPOSIZIONE DEL SERVIZIO SOCIALE PROFESSIONALE O DELL'AUTORIT GIUDIZIARIA COMPETENTE ","AFFIDAMENTI DIRETTI - PROSECUZIONE ANNO 2025 DEI SERVIZI DI ACCOGLIENZA PER MINORI, MINORI STRANIERI NON ACCOMPAGNATI (MSNA), MADRI CON FIGLI MINORI E VITTIME DELLA VIOLENZA DI GENERE, GI INSERITI IN STRUTTURE RESIDENZIALI SU DISPOSIZIONE DEL SERVIZIO SOCIALE PROFESSIONALE O DELL'AUTORIT GIUDIZIARIA COMPETENTE ",9955.0,9955.0,ANCONA,042018,2024-12-19,AFFIDAMENTO DIRETTO,00343140422,COMUNE DI FALCONARA MARITTIMA,SETTORE POLITICHE SOCIALI - UOC SERVIZI SOCIALI,85300000-2,SERVIZI DI ASSISTENZA SOCIALE E SERVIZI AFFINI,,AGGIUDICATA,certa
B2C4BD4DB8,,1,"ACCOGLIENZA MSNA PERIODO LUGLIO 2024 - CASI N. 5, 17 E 33","ACCOGLIENZA MSNA PERIODO LUGLIO 2024 - CASI N. 5, 17 E 33",15949.5,15949.5,TRIESTE,032006,2024-12-16,AFFIDAMENTO DIRETTO,00111990321,COMUNE DI MUGGIA,SERVIZIO SOCIALE DEI COMUNI AMBITO 1.3,85311300-5,SERVIZI DI ASSISTENZA SOCIALE PER BAMBINI E GIOVANI,,AGGIUDICATA,certa
B4CD35A4B4,,1,AFFIDAMENTO INCARICO PER REVISORE CONTABILE INDIPENDENTE PROGETTO SAI PERIODO DAL 01/11/2024 AL 31/12/2026,AFFIDAMENTO INCARICO PER REVISORE CONTABILE INDIPENDENTE PROGETTO SAI PERIODO DAL 01/11/2024 AL 31/12/2026,5692.17,5692.17,CHIETI,069061,2024-12-16,AFFIDAMENTO DIRETTO,00253650691,COMUNE DI PALMOLI,UFFICIO TECNICO,66170000-2,"SERVIZI DI CONSULENZA FINANZIARIA, DI GESTIONE DELLE TRANSAZIONI FINANZIARIE E DI COMPENSAZIONE",,AGGIUDICATA,certa
B4C5586E82,,1,AFFIDAMENTO DEL SERVIZIO DI ACCOGLIENZA IN REGIME RESIDENZIALE A FAVORE DI MSNA,AFFIDAMNETO MINORI STRANIERI NON ACCOMPAGNATI,39700.0,39700.0,NAPOLI,063002,2024-12-13,AFFIDAMENTO DIRETTO,80047540630,COMUNE DI AFRAGOLA,SETTORE CULTURALE E SOCIALE,85311000-2,SERVIZI DI ASSISTENZA SOCIALE CON ALLOGGIO,,AGGIUDICATA,certa
B4C2AE4002,,1,AFFIDAMENTO DEL SERVIZIO DI ACCOGLIENZA DI STRANIERI MINORI NON ACCOMPAGNATI PRESSO STRUTTURE TEMPORANEE DI ACCOCLIENZA MESSE A DISPOSIZIONE DAGLI ENTI GESTORI NEL TERRITORIO DELLA PROVINCIA DI LIVORNO,ACCOGLIENZA MINORI STRANIERI NON ACCOMPAGNATI,54.6,54.6,LIVORNO,049009,2024-12-12,ALTRA PROCEDURA A FASE UNICA,80008810493,PREFETTURA DI LIVORNO,SERVIZI CONTABILI E FINANZIARI,85311300-5,SERVIZI DI ASSISTENZA SOCIALE PER BAMBINI E GIOVANI,,AGGIUDICATA,certa
B2850341EA,,1,COLLOCAMENTO NSNA IN COMUNITA,COLLOCAMENTO MSNA IN STRUTTURA EDUCATIVA - 2 SEMESTRE,26312.0,26312.0,MILANO,015002,2024-12-12,AFFIDAMENTO DIRETTO,01310880156,COMUNE DI ABBIATEGRASSO,SETTORE SERVIZI ALLA PERSONA,98000000-3,"ALTRI SERVIZI DI COMUNITÀ, SOCIALI E PERSONALI",,AGGIUDICATA,certa
B4E1BFA553,,1,AFFIDAMENTO SERVIZIO ACCOGLIENZA MIGRANTI MONDODONNA - GENNAIO-APRILE 2025,SERVIZIO ACCOGLIENZA MIGRANTI,685450.7,685450.7,BOLOGNA,037006,2024-12-18,PROCEDURA DI GARA,80070330370,PREFETTURA DI BOLOGNA,UFFICIO CONTRATTI E APPALTI,85310000-5,SERVIZI DI ASSISTENZA SOCIALE,,AGGIUDICATA,probabile
B4EB502E5F,,1,"AFFIDAMENTI DIRETTI - PROSECUZIONE ANNO 2025 DEI SERVIZI DI ACCOGLIENZA PER MINORI, MINORI STRANIERI NON ACCOMPAGNATI (MSNA), MADRI CON FIGLI MINORI E VITTIME DELLA VIOLENZA DI GENERE, GI INSERITI IN STRUTTURE RESIDENZIALI SU DISPOSIZIONE DEL SERVIZIO SOCIALE PROFESSIONALE O DELL'AUTORIT GIUDIZIARIA COMPETENTE ","AFFIDAMENTI DIRETTI - PROSECUZIONE ANNO 2025 DEI SERVIZI DI ACCOGLIENZA PER MINORI, MINORI STRANIERI NON ACCOMPAGNATI (MSNA), MADRI CON FIGLI MINORI E VITTIME DELLA VIOLENZA DI GENERE, GI INSERITI IN STRUTTURE RESIDENZIALI SU DISPOSIZIONE DEL SERVIZIO SOCIALE PROFESSIONALE O DELL'AUTORIT GIUDIZIARIA COMPETENTE ",21720.0,21720.0,ANCONA,042018,2024-12-20,AFFIDAMENTO DIRETTO,00343140422,COMUNE DI FALCONARA MARITTIMA,SETTORE POLITICHE SOCIALI - UOC SERVIZI SOCIALI,85300000-2,SERVIZI DI ASSISTENZA SOCIALE E SERVIZI AFFINI,,AGGIUDICATA,certa
B4EFA1A2FC,,1,SERVIZIO DI INTERPRETARIATO IN CONSECUTIVA E DI TRADUZIONE A SUPPORTO DELLE ATTIVITÀ SVOLTE DALLA SEZIONE DI NAPOLI DELLA COMMISSIONE TERRITORIALE PER IL RICONOSCIMENTO DELLA PROTEZIONE INTERNAZIONALE DI SALERNO ANNO 2025,SERVIZIO DI INTERPRETARIATO IN CONSECUTIVA E TRADUZIONE A SUPPORTO DELLA COMMISSIONE TERRITORIALE PER IL RICONOSCIMENTO DELLA PROTEZIONE INTERNAZIONALE DI SALERNO SEZIONE DI NAPOLI,233750.0,233750.0,NAPOLI,063049,2024-12-21,PROCEDURA NEGOZIATA SENZA PREVIA PUBBLICAZIONE,80049360631,UFFICIO TERRITORIALE DEL GOVERNO,PREFETTURA DI NAPOLI,79540000-1,SERVIZI DI INTERPRETARIATO,,AGGIUDICATA,certa
B4EFA1A2FC,,1,SERVIZIO DI INTERPRETARIATO IN CONSECUTIVA E DI TRADUZIONE A SUPPORTO DELLE ATTIVITÀ SVOLTE DALLA SEZIONE DI NAPOLI DELLA COMMISSIONE TERRITORIALE PER IL RICONOSCIMENTO DELLA PROTEZIONE INTERNAZIONALE DI SALERNO ANNO 2025,SERVIZIO DI INTERPRETARIATO IN CONSECUTIVA E TRADUZIONE A SUPPORTO DELLA COMMISSIONE TERRITORIALE PER IL RICONOSCIMENTO DELLA PROTEZIONE INTERNAZIONALE DI SALERNO SEZIONE DI NAPOLI,233750.0,233750.0,NAPOLI,063049,2024-12-21,PROCEDURA NEGOZIATA SENZA PREVIA PUBBLICAZIONE,80049360631,UFFICIO TERRITORIALE DEL GOVERNO,PREFETTURA DI NAPOLI,79530000-8,SERVIZI DI TRADUZIONE,,AGGIUDICATA,certa
B4EFA1A2FC,,1,SERVIZIO DI INTERPRETARIATO IN CONSECUTIVA E DI TRADUZIONE A SUPPORTO DELLE ATTIVITÀ SVOLTE DALLA SEZIONE DI NAPOLI DELLA COMMISSIONE TERRITORIALE PER IL RICONOSCIMENTO DELLA PROTEZIONE INTERNAZIONALE DI SALERNO ANNO 2025,SERVIZIO DI INTERPRETARIATO IN CONSECUTIVA E TRADUZIONE A SUPPORTO DELLA COMMISSIONE TERRITORIALE PER IL RICONOSCIMENTO DELLA PROTEZIONE INTERNAZIONALE DI SALERNO SEZIONE DI NAPOLI,233750.0,233750.0,NAPOLI,063049,2024-12-21,PROCEDURA NEGOZIATA SENZA PREVIA PUBBLICAZIONE,80049360631,UFFICIO TERRITORIALE DEL GOVERNO,PREFETTURA DI NAPOLI,85320000-8,SERVIZI SOCIALI,,AGGIUDICATA,certa
B2125A2279,,1,"ACCOGLIMENTO MSNA PERIODO MAGGIO 2024 - CASI N. 5, 17 E 33","ACCOGLIMENTO MSNA PERIODO MAGGIO 2024 - CASI N. 5, 17 E 33",13268.5,13268.5,TRIESTE,032006,2024-12-16,AFFIDAMENTO DIRETTO,00111990321,COMUNE DI MUGGIA,SERVIZIO SOCIALE DEI COMUNI AMBITO 1.3,85311300-5,SERVIZI DI ASSISTENZA SOCIALE PER BAMBINI E GIOVANI,,AGGIUDICATA,certa
B5041789E0,,1,OSPITALITA' MSNA DI GENERE FEMMINILE PRESSO ASS. ARCOBALENO I CAVALIERI DI SAN VALENTINO - DAL 01.07.2024 AL 31.12.2024,OSPITALITÀ MSNA DI GENERE FEMMINILE PRESSO ASS. ARCOBALENO I CCAVALIERI DI SAN VALENTINO,55200.0,55200.0,SIRACUSA,089016,2024-12-30,PROCEDURA NEGOZIATA SENZA PREVIA PUBBLICAZIONE,00056590896,COMUNE DI ROSOLINI,IX SETTORE SERVIZI SOCIALI,85311000-2,SERVIZI DI ASSISTENZA SOCIALE CON ALLOGGIO,,AGGIUDICATA,certa
B4E102A5D7,,1,"SERVIZIO DI ACCOGLIENZA SIPROIMI, PROG-160-PR-3 CATEGORIA ORDINARI, E ALTRI SERVIZI DI INCLUSIONE PER CITTADINI STRANIERI CPV 85311000-5 DAL 01 01 2025 AL 30 04 2025","SERVIZIO DI ACCOGLIENZA SIPROIMI, PROG-160-PR-3 CATEGORIA ORDINARI, E ALTRI SERVIZI DI INCLUSIONE PER CITTADINI STRANIERI CPV 85311000-5 DAL 01 01 2025 AL 30 04 2025",139921.48,139921.48,PISTOIA,047024,2024-12-18,AFFIDAMENTO DIRETTO,90060110476,COMUNE DI SAN MARCELLO PITEGLIO,"AREA 4° - SERVIZI CULTURALI, TURISTICI E BIBLIOTECA",85310000-5,SERVIZI DI ASSISTENZA SOCIALE,,AGGIUDICATA,certa
B4E226C6F2,,1,SERVIZIO DI ACCOGLIENZA RESIDENZIALE DI DUE MINORI STRANIERI NON ACCOMPAGNATI. PERIODO 12.12.2024 -31.12.2024,SERVIZIO DI ACCOGLIENZA RESIDENZIALE DI DUE MINORI STRANIERI NON ACCOMPAGNATI. PERIODO 12.12.2024 -31.12.2024,3800.0,3800.0,UDINE,030129,2024-12-18,AFFIDAMENTO DIRETTO,00168650307,COMUNE DI UDINE,SERVIZIO SERVIZI PER LA SALUTE ED IL BENESSERE SOCIALE,85311000-2,SERVIZI DI ASSISTENZA SOCIALE CON ALLOGGIO,,AGGIUDICATA,certa
B3149B795E,,1,"ACCOGLIENZA MSNA PERIODO AGOSTO 2024 - CASI N. 5, 21 E 48","ACCOGLIENZA MSNA PERIODO AGOSTO 2024 - CASI N. 5, 21 E 48",15949.5,15949.5,TRIESTE,032006,2024-12-16,AFFIDAMENTO DIRETTO,00111990321,COMUNE DI MUGGIA,SERVIZIO SOCIALE DEI COMUNI AMBITO 1.3,85311300-5,SERVIZI DI ASSISTENZA SOCIALE PER BAMBINI E GIOVANI,,AGGIUDICATA,certa
B4F75F36C6,,1,AFFIDAMENTO DIRETTO CITTADINI STRANIERI EXTRA COMUNITARI 20 POSTI FONDAZIONE ARCA DEL MEDITERRANEO,SERVIZIO DI ACCOGLIENZA DI CITTADINI STRANIERI EXTRACOMUNITARI RICHIEDENTI PROTEZIONE INTERNAZIONALE PRESSO SINGOLE UNITA' ABITATIVE,137208.0,137208.0,PERUGIA,054039,2024-12-24,AFFIDAMENTO DIRETTO,80013260544,PREFETTURA DI PERUGIA,PREFETTURA - UTG PERUGIA,85311000-2,SERVIZI DI ASSISTENZA SOCIALE CON ALLOGGIO,,AGGIUDICATA,certa
B4D2D8F5A6,,1,AFFIDAMENTO SERVIZIO DI ACCOGLIENZA LOTO DORATO-GENNAIO-GIUGNO 2025,SERVIZIO ACCOGLIENZA MIGRANTI,424000.0,424000.0,BOLOGNA,037006,2024-12-16,PROCEDURA DI GARA,80070330370,PREFETTURA DI BOLOGNA,UFFICIO CONTRATTI E APPALTI,85310000-5,SERVIZI DI ASSISTENZA SOCIALE,,AGGIUDICATA,probabile
B4E14E2AB5,,1,AFFIDAMENTO ACCOGLIENZA UCRAINA ARCOLAIO GENNAIO-GIUGNO 2025,SERVIZIO ACCOGLIENZA MIGRANTI,661857.0,661857.0,BOLOGNA,037006,2024-12-18,PROCEDURA DI GARA,80070330370,PREFETTURA DI BOLOGNA,UFFICIO CONTRATTI E APPALTI,85310000-5,SERVIZI DI ASSISTENZA SOCIALE,,AGGIUDICATA,probabile
B4FFBC448C,,1,AFFIDAMENTO INCARICO DI REVISORE DEI CONTI INDIPENDENTE PROGETTO SIPROIMI- ORA SAI - DM 18-11-2019 - ANNO 2024,AFFIDAMENTO INCARICO DI REVISORE DEI CONTI INDIPENDENTE PROGETTO SIPROIMI- ORA SAI - DM 18-11-2019 - ANNO 2024,6000.0,6000.0,AVELLINO,064011,2024-12-27,AFFIDAMENTO DIRETTO,82001850641,COMUNE DI BISACCIA,SERVIZIO SETTORE TECNICO URBANISTICO,79212500-8,SERVIZI DI REVISIONE DEI CONTI,,AGGIUDICATA,certa
B5069C2942,,1,INCARICO REVISORE DEI CONTI SPRAR 2024/2026,INCARICO REVISORE DEI CONTI SPRAR 2024/2026,15000.0,15000.0,SASSARI,090058,2024-12-30,AFFIDAMENTO DIRETTO,00252040902,COMUNE DI PORTO TORRES,UFFICIO SERVIZI SOCIALI,79212500-8,SERVIZI DI REVISIONE DEI CONTI,,AGGIUDICATA,certa
B4CF72A261,,1,OSPITALITA PROFUGHI UCRAINI IN CONDIZIONE DI FRAGILITA,OSPITALITA PROFUGHI UCRAINI IN CONDIZIONE DI FRAGILITA,214900.0,214900.0,TORINO,001272,2024-12-16,ALTRA PROCEDURA A FASE UNICA,80087670016,REGIONE PIEMONTE,A1821A PROTEZIONE CIVILE,85320000-8,SERVIZI SOCIALI,,AGGIUDICATA,certa
B48D28E449,,1,"SERVIZIO DI ACCOGLIENZA IN STRUTTURE RESIDENZIALI E SEMIRESIDENZIALI DI MINORI, GESTANTI E MADRI CON MINORI, E MINORI STRANIERI NON ACCOMPAGNATI ASSISTITI DAL SETTORE SERVIZI SOCIALI DELL'UNIONE DEI COMUNI VALLE DEL SAVIO","SERVIZIO DI ACCOGLIENZA IN STRUTTURE RESIDENZIALI E SEMIRESIDENZIALI DI MINORI, GESTANTI E MADRI CON MINORI, E MINORI STRANIERI NON ACCOMPAGNATI ASSISTITI DAL SETTORE SERVIZI SOCIALI DELL'UNIONE DEI COMUNI VALLE DEL SAVIO",17250.0,17250.0,FORLÌ-CESENA,040007,2024-12-03,AFFIDAMENTO DIRETTO,90070700407,UNIONE DEI COMUNI VALLE DEL SAVIO,SETTORE SERVIZI SOCIALI,85320000-8,SERVIZI SOCIALI,,AGGIUDICATA,certa
B50C8D1B22,,1,SERVIZIO DI PRIMA ACCOGLIENZA IN FAVORE DI MINORI STRANIERI NON ACCOMPAGNATI PRESSO LA STRUTTURA RICETTIVA TEMPORANEA UBICATA NEL TERRITORIO DELLA PROVINCIA DI PESARO E URBINO - URBANIA LOC. BATTAGLIA. PERIODO DAL 1°GENNAIO 2025 AL 31 MARZO 2025,ACCOGLIENZA MSNA PRESSO STRUTTURA SITA IN URBANIA PERIODO DAL 1/01/2025 AL 31/03/2025,123660.0,123660.0,PESARO E URBINO,041066,2024-12-31,AFFIDAMENTO DIRETTO,80006690418,PREFETTURA UTG PESARO E URBINO,PREFETTURA UTG PESARO E URBINO,85320000-8,SERVIZI SOCIALI,,AGGIUDICATA,certa
B4A65C529A,,1,INSERIMENTO DI MINORE MSNA CODICE 7124 IN COMUNITA' ALLOGGIO,INSERIMENTO DI MINORE MSNA CODICE 7124 IN COMUNITÀ ALLOGGIO,31140.0,31140.0,SALERNO,065056,2024-12-06,AFFIDAMENTO DIRETTO,00606620409,COMUNE DI FORLI ,SERVIZIO POLITICHE DI WELFARE,85311300-5,SERVIZI DI ASSISTENZA SOCIALE PER BAMBINI E GIOVANI,,AGGIUDICATA,certa
B4E25D468B,,1,"TRATTIVA DIRETTA PER L'ACQUISTO DI ATTREZZATURE INFORMATICHE, FOTOGRAFICHE E DI MATERIALE DI CANCELLERIA NECESSARI PER LO SVOLGIMENTO DELL'ATTIVITÀ DI MONITORAGGIO SULLE MISURE D'ACCOGLIENZA CITTADINI STRANIERI RICHIEDENTI PROTEZIONE INTERNAZIONALE. STIPULA DELLA CONVENZIONE CON L'ALTO COMMISSARIATO DELLE NAZIONI UNITE PER I RIFUGIATI (ACNUR - UNHCR)",FORNITURA MATERIALE INFORMATICO E DI CANCELLERIA,10845.6,10845.6,PESARO E URBINO,041044,2024-12-18,AFFIDAMENTO DIRETTO,80006690418,PREFETTURA UTG PESARO E URBINO,PREFETTURA UTG PESARO E URBINO,30230000-0,APPARECCHIATURE INFORMATICHE,,AGGIUDICATA,certa
B4CE506A05,,1,BANDO DI GARA PER L'INDIVIDUAZIONE DELL'ENTE ATTUATORE DEL PROGETTO DI ACCOGLIENZA DEI MINORI STRANIERI NON ACCOMPAGNATI (M.S.N.A.) – FAMI SAI 1774 PR-2 PER IL PERIODO 01/01/2025 – 31/10/2025 - COMUNE DI GRIMALDI ,BANDO DI GARA PER L'INDIVIDUAZIONE DELL'ENTE ATTUATORE DEL PROGETTO DI ACCOGLIENZA DEI MINORI STRANIERI NON ACCOMPAGNATI (M.S.N.A.) – FAMI SAI 1774 PR-2 PER IL PERIODO 01/01/2025 – 31/10/2025 - COMUNE DI GRIMALDI ,410512.37,410512.37,COSENZA,078059,2024-12-16,PROCEDURA APERTA,80004590784,COMUNE DI GRIMALDI,UFFICIO AMMINISTRATIVO,98000000-3,"ALTRI SERVIZI DI COMUNITÀ, SOCIALI E PERSONALI",,,certa
B4F704CCAA,,1,AFFIDAMENTO SERVIZIO GESTIONE ACCOGLIENZA MIGRANTI VALORI SOLIDALI S.R.L. PRESSO LA STRUTTURA SITA IN FIRENZUOLA TOTALE POSTI 50 PERIODO DAL16.12.2024 AL 28.2.2025,ACCOGLIENZA MIGRANTI,123900.0,123900.0,FIRENZE,048017,2024-12-24,AFFIDAMENTO DIRETTO,80020830487,PREFETTURA DI FIRENZE,PREFETTURA FIRENZE,85311000-2,SERVIZI DI ASSISTENZA SOCIALE CON ALLOGGIO,,AGGIUDICATA,probabile
B509F0D3D3,,1,AFFIDAMENTO DIRETTO EX ART. 50 CO. 1 LETT. B) DEL D.LGS. 36 2023 PER SERVIZIO DI ACCOGLIENZA RESIDENZIALE DI MINORE STRANIERO NON ACCOMPAGNATO IN STRUTTURA - ASSOCIAZIONE MIGRANTES DI DON ANGELO CHIASSERINI ETS,AFFIDAMENTO DIRETTO EX ART. 50 CO. 1 LETT. B) DEL D.LGS. 36 2023 PER SERVIZIO DI ACCOGLIENZA RESIDENZIALE DI MINORE STRANIERO NON ACCOMPAGNATO IN STRUTTURA - ASSOCIAZIONE MIGRANTES DI DON ANGELO CHIASSERINI ETS,25080.0,25080.0,AREZZO,051002,2024-12-31,AFFIDAMENTO DIRETTO,01975410976,SOCIETA' DELLA SALUTE AREA PRATESE,U.O. MINORI SDS PRATO,85311000-2,SERVIZI DI ASSISTENZA SOCIALE CON ALLOGGIO,,AGGIUDICATA,certa
B509F0D3D3,,1,AFFIDAMENTO DIRETTO EX ART. 50 CO. 1 LETT. B) DEL D.LGS. 36 2023 PER SERVIZIO DI ACCOGLIENZA RESIDENZIALE DI MINORE STRANIERO NON ACCOMPAGNATO IN STRUTTURA - ASSOCIAZIONE MIGRANTES DI DON ANGELO CHIASSERINI ETS,AFFIDAMENTO DIRETTO EX ART. 50 CO. 1 LETT. B) DEL D.LGS. 36 2023 PER SERVIZIO DI ACCOGLIENZA RESIDENZIALE DI MINORE STRANIERO NON ACCOMPAGNATO IN STRUTTURA - ASSOCIAZIONE MIGRANTES DI DON ANGELO CHIASSERINI ETS,25080.0,25080.0,AREZZO,051002,2024-12-31,AFFIDAMENTO DIRETTO,01975410976,SOCIETA' DELLA SALUTE AREA PRATESE,U.O. MINORI SDS PRATO,85310000-5,SERVIZI DI ASSISTENZA SOCIALE,,AGGIUDICATA,certa
