cig,cig_accordo_quadro,n_lotti_componenti,oggetto_gara,oggetto_lotto,importo_lotto,importo_complessivo_gara,provincia,luogo_istat,data_pubblicazione,tipo_scelta_contraente,cf_amministrazione_appaltante,denominazione_amministrazione_appaltante,denominazione_centro_costo,cod_cpv,descrizione_cpv,DURATA_PREVISTA,ESITO,confidenza
672794188B,,1,"PROCEDURA DI GARA APERTA VOLTA ALLA CONCLUSIONE DI UN ACCORDO QUADRO CON PIÙ SOGGETTI NEL TERRITORIO DELL'UNIONE DI COMUNI DELLA ROMAGNA FORLIVESE I QUALI DOVRANNO ASSICURARE I SERVIZI DI ACCOGLIENZA AI CITTADINI STRANIERI ADULTI RICHIEDENTI PROTEZIONE INTERNAZIONALE CHE VERRANNO LORO AFFIDATI, E LA GESTIONE DEI SERVIZI CONNESSI FINO ALLA DATA PRESUNTA DEL 31.12.2016 EVENTUALMENTE RINNOVABILE FINO AL 30.06.2017. (ART 54.D.LGS 18/04/2016 N 50. ). ","PROCEDURA DI GARA APERTA VOLTA ALLA CONCLUSIONE DI UN ACCORDO QUADRO CON PIÙ SOGGETTI NEL TERRITORIO DELL'UNIONE DI COMUNI DELLA ROMAGNA FORLIVESE I QUALI DOVRANNO ASSICURARE I SERVIZI DI ACCOGLIENZA AI CITTADINI STRANIERI ADULTI RICHIEDENTI PROTEZIONE INTERNAZIONALE CHE VERRANNO LORO AFFIDATI, E LA GESTIONE DEI SERVIZI CONNESSI FINO ALLA DATA PRESUNTA DEL 31.12.2016 EVENTUALMENTE RINNOVABILE FINO AL 30.06.2017. (ART 54.D.LGS 18/04/2016 N 50. ).",1198800.0,1198800.0,,,2016-07-20,PROCEDURA APERTA,03774550408,AZIENDA SERVIZI ALLA PERSONA SAN VINCENZO DE PAOLI,UFFICIO SERVIZI SOCIALI,85320000-8,SERVIZI SOCIALI,,ANNULLATA O REVOCATA SUCCESSIVAMENTE ALLA PUBBLICAZIONE,certa
6758667472,,1,"PROSECUZINE TECNICA SERV. ACCOGLIENZA IMMIGRATI SPRAR AGGIUNTIVI AGOSTO DICEMBRE 2016, C. TIBURTINA ","PROSECUZINE TECNICA SERV. ACCOGLIENZA IMMIGRATI SPRAR AGGIUNTIVI AGOSTO DICEMBRE 2016, C. TIBURTINA ",86700.0,86700.0,,,2016-07-18,PROCEDURA NEGOZIATA SENZA PREVIA PUBBLICAZIONE,02438750586,ROMA CAPITALE,DIPARTIMENTO POLITICHE SOCIALI,98130000-3,SERVIZI VARI DI ORGANIZZAZIONI ASSOCIATIVE,,AGGIUDICATA,certa
67455625DB,,2,SERVIZI PER LA GESTIONE DI PROGETTI EDUCATIVI DI SGANCIO DI MINORI STRANIERI NON ACCOMPAGNATI,Oggetto non pubblicabile a causa della potenziale presenza di dati personali,220000.0,440000.0,VENEZIA,027042,2016-07-21,PROCEDURA NEGOZIATA SENZA PREVIA PUBBLICAZIONE,00339370272,COMUNE DI VENEZIA,DIREZIONE COESIONE SOCIALE,85310000-5,SERVIZI DI ASSISTENZA SOCIALE,,AGGIUDICATA,certa
676431487E,,1,SERVIZIO ACCOGLIENZA MIGRANTI PROCEDURA NEGOZIATA,SERVIZIO ACCOGLIENZA MIGRANTI PROCEDURA NEGOZIATA,748440.0,748440.0,,,2016-07-25,PROCEDURA NEGOZIATA SENZA PREVIA INDIZIONE DI GARA (SETTORI SPECIALI),80006890604,PREFETTURA DI FROSINONE,SERVIZIO CONTABILITA' E GESTIONE FINANZIARIA,85311000-2,SERVIZI DI ASSISTENZA SOCIALE CON ALLOGGIO,,AGGIUDICATA,probabile
6631406957,,1,"COTTIMO FIDUCIARIO PER L'AFFIDAMENTO DEL SERVIZIO 'PUNTO MIGRANTI - AZIONI DI INTEGRAZIONE SOCIALE A FAVORE DEI CITTADINI STRANIERI IMMIGRATI' NEI COMUNI DEL DISTRETTO PIANURA EST, PER IL PERIODO 6 GIUGNO - 20 DICEMBRE 2016","COTTIMO FIDUCIARIO PER L'AFFIDAMENTO DEL SERVIZIO 'PUNTO MIGRANTI - AZIONI DI INTEGRAZIONE SOCIALE A FAVORE DEI CITTADINI STRANIERI IMMIGRATI' NEI COMUNI DEL DISTRETTO PIANURA EST, PER IL PERIODO 6 GIUGNO - 20 DICEMBRE 2016",79100.0,79100.0,BOLOGNA,037055,2016-07-08,AFFIDAMENTO IN ECONOMIA - COTTIMO FIDUCIARIO,02855851206,UNIONE RENO GALLIERA,CENTRALE UNICA DI COMMITTENZA,85321000-5,SERVIZI SOCIALI AMMINISTRATIVI,,AGGIUDICATA,probabile
6753518B59,653323326D,1,SERVIZIO ACCOGLIENZA CITTADINI STRANIERI RICHIEDENTI PROTEZIONE INTERNAZIONALE NEL ROVINCIA DELL'AQUILA,SERVIZIO ACCOGLIENZA CITTADINI STRANIERI RICHIEDENTI PROTEZIONE INTERNAZIONALE NEL ROVINCIA DELL'AQUILA,68400.0,68400.0,,066028,2016-07-13,AFFIDAMENTO DIRETTO IN ADESIONE AD ACCORDO QUADRO/CONVENZIONE,80003810662,UFFICIO TERRITORIALE DEL GOVERNO,PREFETTURA U.T.G. L'AQUILA,85311000-2,SERVIZI DI ASSISTENZA SOCIALE CON ALLOGGIO,,,certa
6773190534,,1,ACCOGLIENZA E ASSISTENZA CITTADINI STRANIERI RICHIEDENTI PROTEZIONE INTERNAZIONALE,ACCOGLIENZA E ASSISTENZA CITTADINI STRANIERI RICHIEDENTI PROTEZIONE INTERNAZIONALE,465650.0,465650.0,,,2016-07-08,PROCEDURA NEGOZIATA DERIVANTE DA AVVISI CON CUI SI INDICE UNA GARA,80005710258,PREFETTURA DI BELLUNO UFFICIO TERRITORIALE DEL GOVERNO,PREFETTURA DI BELLUNO,85311000-2,SERVIZI DI ASSISTENZA SOCIALE CON ALLOGGIO,,AGGIUDICATA,certa
6750709D49,6544044BEF,1,III ATTO AGGIUNTIVO CONVENZIONE ACCOGLIENZA TEMPORANEA CITTADINI STRANIERI RICHIEDENTI PROTEZIONE INTERNAZIONALE (AUMENTO 17 POSTI),III ATTO AGGIUNTIVO CONVENZIONE ACCOGLIENZA TEMPORANEA CITTADINI STRANIERI RICHIEDENTI PROTEZIONE INTERNAZIONALE (AUMENTO 17 POSTI),103672.8,103672.8,,,2016-07-12,AFFIDAMENTO DIRETTO IN ADESIONE AD ACCORDO QUADRO/CONVENZIONE,97420690584,DIP.TO POLITICHE PERS. AMM.NE CIV. E RIS. STRUM.LI E FIN.,UFFICIO IV - INNOVAZIONE TECNOLOGICA PER L'AMMINISTRAZIONE GENERALE,85311000-2,SERVIZI DI ASSISTENZA SOCIALE CON ALLOGGIO,,,certa
681831290D,,2,"POSTI AGGIUNTIVI SPRAR 2016: PROGETTO RONDINE - ART. 6, COMMA 5 DEL DM 30/07/2013 DEL MINISTERO DELL'INTERNO","POSTI AGGIUNTIVI SPRAR 2016: PROGETTO RONDINE - ART. 6, COMMA 5 DEL DM 30/07/2013 DEL MINISTERO DELL'INTERNO - SERVIZI DI MEDIAZIONE, CORSI DI FORMAZIONE VARI.",9576.0,106400.0,,028060,2016-07-25,AFFIDAMENTO DIRETTO,00644060287,COMUNE DI PADOVA,SETTORE SERVIZI SOCIALI,98390000-3,ALTRI SERVIZI,,,certa
6775019A89,,1,"GESTIONE DI UN PRESIDIO UMANITARIO PER L'OSPITALITÀ E L'ASSISTENZA DI PERSONE IMMIGRATE TEMPORANEAMENTE PRESENTI NEL TERRITORIO DI ROMA, TRA IL COMUNE DI ROMA DIPARTIMENTO POLITICHE SOCIALE, SUSSIDIARIETÀ E DELLA SALUTE - UO GESTIONE DELL'EMERGENZA E INCLUSIONE SOCIALE E IL CONSORZIO ROMA SOLIDARIETÀ - SOCIETÀ COOPERATIVA SOCIALE ONLUS PROMOSSA DALLA CARITAS DIOCESANA DI ROMA.","GESTIONE DI UN PRESIDIO UMANITARIO PER L'OSPITALITÀ E L'ASSISTENZA DI PERSONE IMMIGRATE TEMPORANEAMENTE PRESENTI NEL TERRITORIO DI ROMA, TRA IL COMUNE DI ROMA DIPARTIMENTO POLITICHE SOCIALE, SUSSIDIARIETÀ E DELLA SALUTE - UO GESTIONE DELL'EMERGENZA E INCLUSIONE SOCIALE E IL CONSORZIO ROMA SOLIDARIETÀ - SOCIETÀ COOPERATIVA SOCIALE ONLUS PROMOSSA DALLA CARITAS DIOCESANA DI ROMA.",173670.0,173670.0,ROMA,058091,2016-07-29,PROCEDURA NEGOZIATA SENZA PREVIA PUBBLICAZIONE,02438750586,ROMA CAPITALE,DIPARTIMENTO POLITICHE SOCIALI,85310000-5,SERVIZI DI ASSISTENZA SOCIALE,,AGGIUDICATA,probabile
6741961A36,652716314E,1,"PROROGA DELL'ATTO AGGIUNTIVO DELLA CONVENZIONE STIPULATA IN DATA 12 MAGGIO 2016, AVENTE AD OGGETTO 'SERVIZIO DI ACCOGLIENZA DI CITTADINI STRANIERI EXTRACOMUNITARI RICHIEDENTI LA PROTEZIONE INTERNAZIONALE PER I PERIODO 1^ APRILE 2016- 31 DICEMBRE 2016 ', PER L'ACCOGLIENZA DI N. 70 CITTADINI STRANIERI RICHIEDENTI ASILO NEL PERIODO DAL 1 LUGLIO 2016 AL 31 LUGLIO 2016. ","PROROGA DELL'ATTO AGGIUNTIVO DELLA CONVENZIONE STIPULATA IN DATA 12 MAGGIO 2016, AVENTE AD OGGETTO 'SERVIZIO DI ACCOGLIENZA DI CITTADINI STRANIERI EXTRACOMUNITARI RICHIEDENTI LA PROTEZIONE INTERNAZIONALE PER I PERIODO 1^ APRILE 2016- 31 DICEMBRE 2016 ', PER L'ACCOGLIENZA DI N. 70 CITTADINI STRANIERI RICHIEDENTI ASILO NEL PERIODO DAL 1 LUGLIO 2016 AL 31 LUGLIO 2016. ",70308.0,70308.0,,036023,2016-07-01,AFFIDAMENTO DIRETTO IN ADESIONE AD ACCORDO QUADRO/CONVENZIONE,80001270364,PREFETTURA U.T.G. DI MODENA,SERVIZIO CONTABILITA E GESTIONE FINANZIARIA,85310000-5,SERVIZI DI ASSISTENZA SOCIALE,,,certa
6759675446,669999746E,1,SERVIZIO DI ACCOGLIENZA MIGRANTI. PERIODO 1/7/16-31/12/2016,SERVIZIO DI ACCOGLIENZA MIGRANTI. PERIODO 1/7/16-31/12/2016,49061.76,49061.76,,,2016-07-01,AFFIDAMENTO DIRETTO IN ADESIONE AD ACCORDO QUADRO/CONVENZIONE,80005950466,PREFETTURA DI LUCCA,PREFETTURA DI LUCCA- SERVIZIO I,85320000-8,SERVIZI SOCIALI,,AGGIUDICATA,probabile
67486466DA,,1,AFFIDAMENTO SERVIZIO DI ACCOGLIENZA N.100 CITTADINI STRANIERI RICHIEDENTI ASILO PROVINCIA DI CASERTA FINO AL 31 AGOSTO 2016,AFFIDAMENTO SERVIZIO DI ACCOGLIENZA N.100 CITTADINI STRANIERI RICHIEDENTI ASILO PROVINCIA DI CASERTA FINO AL 31 AGOSTO 2016,171500.0,171500.0,,061022,2016-07-07,PROCEDURA NEGOZIATA SENZA PREVIA PUBBLICAZIONE,80002190611,MINISTERO INTERNO PREFETTURA CASERTA,UFFICIO RAGIONERIA,85310000-5,SERVIZI DI ASSISTENZA SOCIALE,,,certa
6764670E44,,1,ACCOGLIENZA MSNA PRESSO IL CENTRO LA ZAGARA .-CITTÀ GIARDINO MELILLI GESTITO DA ERICHES29 - I^ TRIMESTRE 2016,ACCOGLIENZA MSNA PRESSO IL CENTRO LA ZAGARA .-CITTÀ GIARDINO MELILLI GESTITO DA ERICHES29 - I^ TRIMESTRE 2016,164985.58,164985.58,,,2016-07-25,AFFIDAMENTO DIRETTO,CFAVCP-0000FE3,CENTRALE DI COMMITTENZA MODICA-SCICLI,VII SETTORE - SERVIZI SOCIALI- C.U.C.,85311000-2,SERVIZI DI ASSISTENZA SOCIALE CON ALLOGGIO,,AGGIUDICATA,certa
70732262BF,,1,CONTRIBUTO MINISTERIALE RETTE MSNA III MINISTRE 2016,CONTRIBUTO MINISTERIALE RETTE MSNA III MINISTRE 2016,44742.86,44742.86,,081021,2016-07-01,AFFIDAMENTO DIRETTO,80003210814,COMUNE DI TRAPANI,IV SETTORE SERVIZI SOCIALI,85311000-2,SERVIZI DI ASSISTENZA SOCIALE CON ALLOGGIO,,AGGIUDICATA,certa
6752843E51,64505000FF,1,AFFIDAMENTO SERVIZIO PRIMA ACCOGLIENZA CITTADINI STRANIERI RICHIEDENTI PROTEZIONE INTERNAZIONALE E GESTIONE SERVIZI CONNESSI SUL TERRITORIO DELLA PROVINCIA DI VERCELLI,AFFIDAMENTO SERVIZIO PRIMA ACCOGLIENZA CITTADINI STRANIERI RICHIEDENTI PROTEZIONE INTERNAZIONALE E GESTIONE SERVIZI CONNESSI SUL TERRITORIO DELLA PROVINCIA DI VERCELLI,421791.3,421791.3,,002030,2016-07-12,AFFIDAMENTO DIRETTO IN ADESIONE AD ACCORDO QUADRO/CONVENZIONE,80009220023,PREFETTURA DI VERCELLI,AREA ECONOMICO FINANZIARIA - PREFETTURA - UTG,55110000-4,SERVIZI DI SISTEMAZIONE ALBERGHIERA,,,certa
6752821C2A,,6,"SERVIZIO DI ACCOGLIENZA PER UN MASSIMO DI 475 PRESENZE PRO DIE DI CITTADINI STRANIERI TEMPORANEAMENTE PRESENTI SUL TERRITORIO (UOMINI, DONNE E FAMIGLIE) - PRESSO STRUTTURE NELLA DISPONIBILITÀ DEGLI ENTI",Oggetto non pubblicabile a causa della potenziale presenza di dati personali,49600.0,471200.0,MILANO,015146,2016-07-15,PROCEDURA NEGOZIATA SENZA PREVIA PUBBLICAZIONE,01199250158,COMUNE DI MILANO,D.C. POLITICHE SOCIALI E CULTURA DELLA SALUTE - SERVIZIO POLITICHE PER L'IMMIGRAZIONE,85311000-2,SERVIZI DI ASSISTENZA SOCIALE CON ALLOGGIO,,AGGIUDICATA,probabile
675865173D,,1,"PROSECUZINE TECNICA SERV. ACCOGLIENZA IMMIGRATI SPRAR AGGIUNTIVI AGOSTO DICEMBRE 2016, C. ZURLA","PROSECUZINE TECNICA SERV. ACCOGLIENZA IMMIGRATI SPRAR AGGIUNTIVI AGOSTO DICEMBRE 2016, C. ZURLA",240975.0,240975.0,,,2016-07-18,PROCEDURA NEGOZIATA SENZA PREVIA PUBBLICAZIONE,02438750586,ROMA CAPITALE,DIPARTIMENTO POLITICHE SOCIALI,98130000-3,SERVIZI VARI DI ORGANIZZAZIONI ASSOCIATIVE,,AGGIUDICATA,certa
6739441AA4,,1,POSTI AGGIUNTIVI AL PROGETTO SPRAR DEL COMUNE DI FIRENZE ANNO 2016,POSTI AGGIUNTIVI AL PROGETTO SPRAR DEL COMUNE DI FIRENZE ANNO 2016,307440.0,307440.0,,,2016-07-25,PROCEDURA NEGOZIATA SENZA PREVIA PUBBLICAZIONE,01307110484,COMUNE DI FIRENZE,DIREZIONE SERVIZI SOCIALI,85311000-2,SERVIZI DI ASSISTENZA SOCIALE CON ALLOGGIO,,AGGIUDICATA,certa
6750764AAD,,1,SERVIZIO DI ACCOGLIENZA IN FAVORE DI MINORI STRANIERI NON ACCOMPAGNATI E MINORI STRANIERI NON ACCOMPAGNATI RICHIEDENTI ASILO PRESSO LA COMUNITÀ FAMILIARE 'CASA IVA',Oggetto non pubblicabile a causa della potenziale presenza di dati personali,201480.0,201480.0,GROSSETO,053011,2016-07-14,PROCEDURA NEGOZIATA SENZA PREVIA PUBBLICAZIONE,01258070539,COESO-SOC.DELLA SALUTE AREA SOCIO SANIT. GROSSETANA,U.F. SERVIZI SOCIO - ASSISTENZIALI,85311300-5,SERVIZI DI ASSISTENZA SOCIALE PER BAMBINI E GIOVANI,,AGGIUDICATA,certa
674831233B,,1,RICOLLOCAMENTO POSTI SPRAR ZERO IN CONDOTTA DA 1 LUGLIO A 31 DICEMBRE 2016,RICOLLOCAMENTO POSTI SPRAR ZERO IN CONDOTTA DA 1 LUGLIO A 31 DICEMBRE 2016,24080.0,24080.0,,,2016-07-07,PROCEDURA NEGOZIATA SENZA PREVIA PUBBLICAZIONE,02438750586,ROMA CAPITALE,DIPARTIMENTO V U.O. IMMIGRAZIONE E INCLUSIONE SOCIALE,98130000-3,SERVIZI VARI DI ORGANIZZAZIONI ASSOCIATIVE,,,certa
674201137B,,1,AFFIDAMENTO DEI SERVIZI DI ACCOGLIENZA IMMIGRATI E DEI SERVIZI CONNESSI,AFFIDAMENTO DEI SERVIZI DI ACCOGLIENZA IMMIGRATI E DEI SERVIZI CONNESSI,1260000.0,1260000.0,,,2016-07-01,PROCEDURA NEGOZIATA SENZA PREVIA PUBBLICAZIONE,95126450162,MINISTERO DELL INTERNO - PREFETTURA DI BERGAMO,UFFICIO CONTRATTI,85310000-5,SERVIZI DI ASSISTENZA SOCIALE,,AGGIUDICATA,probabile
676946426A,65962261E5,1,ACCOGLIENZA DI CITTADINI STRANIERI RICHIEDENTI PROTEZIONE INTERNAZIONALE E SERVIZI CONNESSI,ACCOGLIENZA DI CITTADINI STRANIERI RICHIEDENTI PROTEZIONE INTERNAZIONALE E SERVIZI CONNESSI,128520.0,128520.0,,039014,2016-07-29,AFFIDAMENTO DIRETTO IN ADESIONE AD ACCORDO QUADRO/CONVENZIONE,80006840393,PREFETTURA - UFFICIO TERRITORIALE DEL GOVERNO DI RAVENNA,PREFETTURA - UFFICIO TERRITORIALE DEL GOVERNO DI RAVENNA,85311000-2,SERVIZI DI ASSISTENZA SOCIALE CON ALLOGGIO,,,certa
69518987B5,6680938472,1,SERVIZIO DI ACCOGLIENZA RICHIEDENTI PROTEZIONE INTERNAZIONALE,SERVIZIO DI ACCOGLIENZA RICHIEDENTI PROTEZIONE INTERNAZIONALE,618222.0,618222.0,,036023,2016-07-20,AFFIDAMENTO DIRETTO IN ADESIONE AD ACCORDO QUADRO/CONVENZIONE,80001270364,PREFETTURA U.T.G. DI MODENA,SERVIZIO CONTABILITA E GESTIONE FINANZIARIA,85310000-5,SERVIZI DI ASSISTENZA SOCIALE,,,certa
67469596B2,,1,AFFIDAMENTO SERVIZIO ACCOGLIENZA CITTADINI STRANIERI RICHIEDENTI PROTEZIONE INTERNAZIONALE ,AFFIDAMENTO SERVIZIO ACCOGLIENZA CITTADINI STRANIERI RICHIEDENTI PROTEZIONE INTERNAZIONALE ,114931.0,114931.0,,066098,2016-07-06,PROCEDURA NEGOZIATA SENZA PREVIA PUBBLICAZIONE,80003810662,UFFICIO TERRITORIALE DEL GOVERNO,PREFETTURA U.T.G. L'AQUILA,85311000-2,SERVIZI DI ASSISTENZA SOCIALE CON ALLOGGIO,,,certa
676479014F,,1,ACCOGLIENZA MSNA PRESSO COMUNITA' OREB DI AUGUSTA- CASA DI ROMA IST.SUORE S. ANNA - GENNAIO-DICEMBRE 2016,ACCOGLIENZA MSNA PRESSO COMUNITA' OREB DI AUGUSTA- CASA DI ROMA IST.SUORE S. ANNA - GENNAIO-DICEMBRE 2016,86000.0,86000.0,SIRACUSA,089001,2016-07-25,AFFIDAMENTO DIRETTO,CFAVCP-0000FE3,CENTRALE DI COMMITTENZA MODICA-SCICLI,VII SETTORE - SERVIZI SOCIALI- C.U.C.,85311000-2,SERVIZI DI ASSISTENZA SOCIALE CON ALLOGGIO,,AGGIUDICATA,certa
6781261999,,1,SERVIZIO RICOVERO RIFUGIATI POSTI AGGIUNTIVI E ULTERIORI POSTI AGGIUNTIVI,SERVIZIO RICOVERO RIFUGIATI POSTI AGGIUNTIVI E ULTERIORI POSTI AGGIUNTIVI,511000.0,511000.0,SIRACUSA,089018,2016-07-25,PROCEDURA NEGOZIATA SENZA PREVIA PUBBLICAZIONE,80000970899,COMUNE DI SOLARINO,COMUNE DI SOLARINO,85311300-5,SERVIZI DI ASSISTENZA SOCIALE PER BAMBINI E GIOVANI,,AGGIUDICATA,probabile
67528070A0,64505000FF,1,AFFIDAMENTO SERVIZIO PRIMA ACCOGLIENZA CITTADINI STRANIERI RICHIEDENTI PROTEZIONE INTERNAZIONALE E GESTIONE SERVIZI CONNESSI SUL TERRITORIO DELLA PROVINCIA DI VERCELLI,AFFIDAMENTO SERVIZIO PRIMA ACCOGLIENZA CITTADINI STRANIERI RICHIEDENTI PROTEZIONE INTERNAZIONALE E GESTIONE SERVIZI CONNESSI SUL TERRITORIO DELLA PROVINCIA DI VERCELLI,219614.85,219614.85,,002158,2016-07-12,AFFIDAMENTO DIRETTO IN ADESIONE AD ACCORDO QUADRO/CONVENZIONE,80009220023,PREFETTURA DI VERCELLI,AREA ECONOMICO FINANZIARIA - PREFETTURA - UTG,55110000-4,SERVIZI DI SISTEMAZIONE ALBERGHIERA,,,certa
6762790ED7,669999746E,1,SERVIZIO DI ACCOGLIENZA MIGRANTI. PERIODO DAL 1/7/2016 AL 31/12/2016,SERVIZIO DI ACCOGLIENZA MIGRANTI. PERIODO DAL 1/7/2016 AL 31/12/2016,132895.84,132895.84,,,2016-07-01,AFFIDAMENTO DIRETTO IN ADESIONE AD ACCORDO QUADRO/CONVENZIONE,80005950466,PREFETTURA DI LUCCA,PREFETTURA DI LUCCA- SERVIZIO I,85320000-8,SERVIZI SOCIALI,,AGGIUDICATA,probabile
675282604E,,6,"SERVIZIO DI ACCOGLIENZA PER UN MASSIMO DI 475 PRESENZE PRO DIE DI CITTADINI STRANIERI TEMPORANEAMENTE PRESENTI SUL TERRITORIO (UOMINI, DONNE E FAMIGLIE) - PRESSO STRUTTURE NELLA DISPONIBILITÀ DEGLI ENTI",SERVIZIO DI ACCOGLIENZA PER UN MASSIMO DI 50 PRESENZE PRO DIE DI CITTADINI STRANIERI TEMPORANEAMENTE PRESENTI SUL TERRITORIO (UOMINI) - PRESSO STRUTTURE NELLA DISPONIBILITÀ DEGLI ENTI,49600.0,471200.0,,015146,2016-07-15,PROCEDURA NEGOZIATA SENZA PREVIA PUBBLICAZIONE,01199250158,COMUNE DI MILANO,D.C. POLITICHE SOCIALI E CULTURA DELLA SALUTE - SERVIZIO POLITICHE PER L'IMMIGRAZIONE,85311000-2,SERVIZI DI ASSISTENZA SOCIALE CON ALLOGGIO,,DESERTA,probabile
6757750FB3,,8,AFFIDAMENTO NEL TERRITORIO DELLA PROVINCIA DI CASERTA DEL SERVIZIO DI ACCOGLIENZA E ASSISTENZA CITTADINI STRANIERI RICHIEDENTI ASILO DALLA DATA PRESUNTA DELL'1/102016 AL 31/12/2016,SERVIZIO DI ACCOGLIENZA CITTADINI STRANIERI RICHIEDENTI ASILO AMBITO TERRITORIALE SANITARIO PROVINCIA CASERTA C09,579600.0,4636800.0,,061022,2016-07-20,PROCEDURA APERTA,80002190611,MINISTERO INTERNO PREFETTURA CASERTA,UFFICIO RAGIONERIA,85310000-5,SERVIZI DI ASSISTENZA SOCIALE,,,certa
67678194EA,,1,SERVIZIO ACCOGLIENZA PROFUGHI INTEGRA ONLUS,SERVIZIO ACCOGLIENZA PROFUGHI INTEGRA ONLUS,63360.0,63360.0,,074001,2016-07-07,AFFIDAMENTO IN ECONOMIA - COTTIMO FIDUCIARIO,80001510744,PREFETTURA,UFFICIO AMMINISTRATIVO,85311000-2,SERVIZI DI ASSISTENZA SOCIALE CON ALLOGGIO,,,certa
6806319020,,1,SERVIZIO ACCOGLIENZA PROFUGHI ATI AGHRESORTMELOGRANO OSTUNI,SERVIZIO ACCOGLIENZA PROFUGHI ATI AGHRESORTMELOGRANO OSTUNI,113200.0,113200.0,,074001,2016-07-19,AFFIDAMENTO IN ECONOMIA - COTTIMO FIDUCIARIO,80001510744,PREFETTURA,UFFICIO AMMINISTRATIVO,85311000-2,SERVIZI DI ASSISTENZA SOCIALE CON ALLOGGIO,,,certa
695193563E,6680938472,1,SERVIZIO DI ACCOGLIENZA RICHIEDENTI PROTEZIONE INTERNAZIONALE,SERVIZIO DI ACCOGLIENZA RICHIEDENTI PROTEZIONE INTERNAZIONALE,120349.8,120349.8,,036023,2016-07-23,AFFIDAMENTO DIRETTO IN ADESIONE AD ACCORDO QUADRO/CONVENZIONE,80001270364,PREFETTURA U.T.G. DI MODENA,SERVIZIO CONTABILITA E GESTIONE FINANZIARIA,85310000-5,SERVIZI DI ASSISTENZA SOCIALE,,,certa
6771878A80,,1,SERVIZIO DI ACCOGLIENZA MIGRANTI,SERVIZIO DI ACCOGLIENZA MIGRANTI,710576.0,710576.0,,048017,2016-07-25,PROCEDURA NEGOZIATA SENZA PREVIA INDIZIONE DI GARA (SETTORI SPECIALI),80020830487,PREFETTURA DI FIRENZE,SERVIZI DI ATTIVITA' CONTRATTUALE,85320000-8,SERVIZI SOCIALI,,,probabile
678626288E,669999746E,1,SERVIZIO DI PRIMA ACCOGLIENZA CITTADINI STRANIERI RICHIEDENTI PROTEZIONE INTERNAZIONALE. PERIODO 1/7/16-31/12/16,SERVIZIO DI PRIMA ACCOGLIENZA CITTADINI STRANIERI RICHIEDENTI PROTEZIONE INTERNAZIONALE. PERIODO 1/7/16-31/12/16,42735.84,42735.84,LUCCA,046033,2016-07-01,AFFIDAMENTO DIRETTO IN ADESIONE AD ACCORDO QUADRO/CONVENZIONE,80005950466,PREFETTURA DI LUCCA,PREFETTURA DI LUCCA- SERVIZIO I,85320000-8,SERVIZI SOCIALI,,AGGIUDICATA,certa
6769810FED,65962261E5,1,ACCOGLIENZA DI CITTADINI STRANIERI RICHIEDENTI PROTEZIONE INTERNAZIONALE E SERVIZI CONNESSI,ACCOGLIENZA DI CITTADINI STRANIERI RICHIEDENTI PROTEZIONE INTERNAZIONALE E SERVIZI CONNESSI,52785.0,52785.0,,039014,2016-07-29,AFFIDAMENTO DIRETTO IN ADESIONE AD ACCORDO QUADRO/CONVENZIONE,80006840393,PREFETTURA - UFFICIO TERRITORIALE DEL GOVERNO DI RAVENNA,PREFETTURA - UFFICIO TERRITORIALE DEL GOVERNO DI RAVENNA,85311000-2,SERVIZI DI ASSISTENZA SOCIALE CON ALLOGGIO,,,certa
6763582C6C,,1,GESTIONE CENTRO ACCOGLIENZA HUB - MATTEI PER RICHIEDENTI PROTEZIONE INTERNAZIONALE,GESTIONE CENTRO ACCOGLIENZA HUB - MATTEI PER RICHIEDENTI PROTEZIONE INTERNAZIONALE,885500.0,885500.0,BOLOGNA,037006,2016-07-27,PROCEDURA APERTA,80070330370,PREFETTURA DI BOLOGNA,SERVIZIO ATTIVITA' CONTRATTUALI,85311000-2,SERVIZI DI ASSISTENZA SOCIALE CON ALLOGGIO,,AGGIUDICATA,certa
6762975784,,1,ENGEL CONVENZIONE AFFIDAMENTO MIGRANTI 1/6-30/9/2016,ENGEL CONVENZIONE AFFIDAMENTO MIGRANTI 1/6-30/9/2016,378900.0,378900.0,,,2016-07-22,PROCEDURA NEGOZIATA SENZA PREVIA INDIZIONE DI GARA (SETTORI SPECIALI),80005410644,PREFETTURA DI AVELLINO,PREFETTURA DI AVELLINO UFFICIO TERRITORIALE DEL GOVERNO,85311000-2,SERVIZI DI ASSISTENZA SOCIALE CON ALLOGGIO,,,probabile
6859167BA9,6756876E74,1,ACCOGLIENZA CITTADINI STRANIERI RICHIEDENTI PROTEZIONE INTERNAZIONALE - 01.11.2016 - 31.12.2016,ACCOGLIENZA CITTADINI STRANIERI RICHIEDENTI PROTEZIONE INTERNAZIONALE - 01.11.2016 - 31.12.2016,57986.6,57986.6,LECCO,097007,2016-07-20,CONFRONTO COMPETITIVO IN ADESIONE AD ACCORDO QUADRO/CONVENZIONE,01409210133,COMUNITA' MONTANA VALSASSINA VALVARRONE VAL D'ESINO RIVIERA,SERVIZI ALLA PERSONA,85311000-2,SERVIZI DI ASSISTENZA SOCIALE CON ALLOGGIO,,AGGIUDICATA,certa
6774190E6B,,1,PROROGA POSTI ORDINARI SPRAR PER L'ANNO 2016 SU DISPOSIZIONE DEL MINISTERO PER L'INTERNO,PROROGA POSTI ORDINARI SPRAR PER L'ANNO 2016 SU DISPOSIZIONE DEL MINISTERO PER L'INTERNO,167459.6,167459.6,,083005,2016-07-12,AFFIDAMENTO DIRETTO,00084640838,COMUNE DI BARCELLONA POZZO DI GOTTO,ATTIVITA' SOCIALI E ASSISTENZIALI,85311300-5,SERVIZI DI ASSISTENZA SOCIALE PER BAMBINI E GIOVANI,,,certa
675886148A,,1,SPRAR AGGIUNTIVI 2 APRILE - DICEMBRE 2016,SPRAR AGGIUNTIVI 2 APRILE - DICEMBRE 2016,168042.71,168042.71,BOLOGNA,037006,2016-07-22,AFFIDAMENTO DIRETTO,03337111201,ASP CITTA' DI BOLOGNA,SERVIZIO INCLUSIONE SOCIALE,85320000-8,SERVIZI SOCIALI,,AGGIUDICATA,certa
68591616B7,6756876E74,1,ACCOGLIENZA CITTADINI STRANIERI RICHIEDENTI PROTEZIONE INTERNAZIONALE - 01.11.2016 - 31.12.2016,ACCOGLIENZA CITTADINI STRANIERI RICHIEDENTI PROTEZIONE INTERNAZIONALE - 01.11.2016 - 31.12.2016,169421.4,169421.4,LECCO,097007,2016-07-20,CONFRONTO COMPETITIVO IN ADESIONE AD ACCORDO QUADRO/CONVENZIONE,01409210133,COMUNITA' MONTANA VALSASSINA VALVARRONE VAL D'ESINO RIVIERA,SERVIZI ALLA PERSONA,85311000-2,SERVIZI DI ASSISTENZA SOCIALE CON ALLOGGIO,,AGGIUDICATA,certa
6745303021,6634072167,1,SERVIZIO DI ACCOGLIENZA IN FAVORE DI CITTADINI STRANIERI RICHIEDENTI PROTEZIONE INTERNAZIONALE CAS,SERVIZIO DI ACCOGLIENZA IN FAVORE DI CITTADINI STRANIERI RICHIEDENTI PROTEZIONE INTERNAZIONALE CAS,2478000.0,2478000.0,,,2016-07-22,AFFIDAMENTO DIRETTO IN ADESIONE AD ACCORDO QUADRO/CONVENZIONE,80017920721,PREFETTURA DI BARI,SERVIZIO IV ATTIVITA' CONTRATTUALE,85320000-8,SERVIZI SOCIALI,,,certa
67528471A2,,6,"SERVIZIO DI ACCOGLIENZA PER UN MASSIMO DI 475 PRESENZE PRO DIE DI CITTADINI STRANIERI TEMPORANEAMENTE PRESENTI SUL TERRITORIO (UOMINI, DONNE E FAMIGLIE) - PRESSO STRUTTURE NELLA DISPONIBILITÀ DEGLI ENTI",Oggetto non pubblicabile a causa della potenziale presenza di dati personali,74400.0,471200.0,MILANO,015146,2016-07-15,PROCEDURA NEGOZIATA SENZA PREVIA PUBBLICAZIONE,01199250158,COMUNE DI MILANO,D.C. POLITICHE SOCIALI E CULTURA DELLA SALUTE - SERVIZIO POLITICHE PER L'IMMIGRAZIONE,85311000-2,SERVIZI DI ASSISTENZA SOCIALE CON ALLOGGIO,,AGGIUDICATA,probabile
6755143858,65632136B3,1,SERVIZI ACCOGLIENZA CITTADINI STRANIERI,SERVIZI ACCOGLIENZA CITTADINI STRANIERI,78960.0,78960.0,,,2016-07-04,AFFIDAMENTO DIRETTO IN ADESIONE AD ACCORDO QUADRO/CONVENZIONE,80003790443,UFFICIO TERRITORIALE DEL GOVERNO,PREFETTURA DI ASCOLI PICENO,85311300-5,SERVIZI DI ASSISTENZA SOCIALE PER BAMBINI E GIOVANI,,,probabile
6758155DEB,,1,AFFIDAMENTO A FONDAZIONE PROGETTO ARCA ONLUS DEL SERVIZIO COMPLEMENTARE PER L' ACCOGLIENZA DI ULTERIORI 119 CITTADINI STRANIERI TEMPORANEAMENTE PRESENTI SUL TERRITORIO ALL'INTERNO DELLE STRUTTURE DI VIA SAMMARTINI 118 E VIA ALDINI 74 MESSE A DISPOSIZIONE DALL'AMMINISTRAZIONE COMUNALE E LA STRUTTURA DI VIA MAMBRETTI 33 MESSA A DISPOSIZIONE ENTE STESSO. ,AFFIDAMENTO A FONDAZIONE PROGETTO ARCA ONLUS DEL SERVIZIO COMPLEMENTARE PER L' ACCOGLIENZA DI ULTERIORI 119 CITTADINI STRANIERI TEMPORANEAMENTE PRESENTI SUL TERRITORIO ALL'INTERNO DELLE STRUTTURE DI VIA SAMMARTINI 118 E VIA ALDINI 74 MESSE A DISPOSIZIONE DALL'AMMINISTRAZIONE COMUNALE E LA STRUTTURA DI VIA MAMBRETTI 33 MESSA A DISPOSIZIONE ENTE STESSO. ,51646.0,51646.0,MILANO,015146,2016-07-18,PROCEDURA NEGOZIATA SENZA PREVIA INDIZIONE DI GARA (SETTORI SPECIALI),01199250158,COMUNE DI MILANO,D.C. POLITICHE SOCIALI E CULTURA DELLA SALUTE - SERVIZIO POLITICHE PER L'IMMIGRAZIONE,85311000-2,SERVIZI DI ASSISTENZA SOCIALE CON ALLOGGIO,,AGGIUDICATA,probabile
67500995E8,,2,SERVIZI DI ACCOGLIENZA E DI ASSISTENZA CITTADINI STRANIERI RICHIEDENTI PROTEZIONE INTERNAZIONALE,SERVIZI DI ACCOGLIENZA E DI ASSISTENZA CITTADINI STRANIERI RICHIEDENTI PROTEZIONE INTERNAZIONALE,1606500.0,2677500.0,GENOVA,010025,2016-07-08,PROCEDURA APERTA,80043490103,PREFETTURA DI GENOVA,UFFICIO CONTRATTI,85311000-2,SERVIZI DI ASSISTENZA SOCIALE CON ALLOGGIO,,AGGIUDICATA,certa
6758307B5B,,1,INTERVENTI DI ACCOGLIMENTO DI MINORI STRANIERI NON ACCOMPAGNATI. AUTORIZZAZIONE ALL'UTILIZZO DI UNA NUOVA STRUTTURA NON CONVENZINATA: COOPERATIVA SOCIALE SANTA ANGELA MERICI - TRIESTE,Oggetto non pubblicabile a causa della potenziale presenza di dati personali,103466.67,103466.67,TRIESTE,032006,2016-07-06,PROCEDURA NEGOZIATA SENZA PREVIA PUBBLICAZIONE,00210240321,COMUNE DI TRIESTE,SERVIZIO STRUTTURE E INTERVENTI PER DISABILIT' CASA INSERIMENTO LAVORATIVO E ACCOGLIENZA,85311300-5,SERVIZI DI ASSISTENZA SOCIALE PER BAMBINI E GIOVANI,,AGGIUDICATA,certa
6752854767,,6,"SERVIZIO DI ACCOGLIENZA PER UN MASSIMO DI 475 PRESENZE PRO DIE DI CITTADINI STRANIERI TEMPORANEAMENTE PRESENTI SUL TERRITORIO (UOMINI, DONNE E FAMIGLIE) - PRESSO STRUTTURE NELLA DISPONIBILITÀ DEGLI ENTI",SERVIZIO DI ACCOGLIENZA PER UN MASSIMO DI 100 PRESENZE PRO DIE DI CITTADINI STRANIERI TEMPORANEAMENTE PRESENTI SUL TERRITORIO (UOMINI) - PRESSO STRUTTURE NELLA DISPONIBILITÀ DEGLI ENTI,99200.0,471200.0,MILANO,015146,2016-07-15,PROCEDURA NEGOZIATA SENZA PREVIA PUBBLICAZIONE,01199250158,COMUNE DI MILANO,D.C. POLITICHE SOCIALI E CULTURA DELLA SALUTE - SERVIZIO POLITICHE PER L'IMMIGRAZIONE,85311000-2,SERVIZI DI ASSISTENZA SOCIALE CON ALLOGGIO,,AGGIUDICATA,probabile
680039142E,,1,PROROGA TECNICA ACCOGLIENZA MIGRANTI AGOSTO SETTEMBRE 2016,PROROGA TECNICA ACCOGLIENZA MIGRANTI AGOSTO SETTEMBRE 2016 CASA FACI,141493.8,141493.8,MASSA-CARRARA,045010,2016-07-28,PROCEDURA NEGOZIATA SENZA PREVIA PUBBLICAZIONE,80003940451,PREFETTURA DI MASSA CARRARA UFFICIO TERRITORIALE DEL GOVERNO,SERVIZI GENERALI E ATTIVITA' CONTRATTUALE,85310000-5,SERVIZI DI ASSISTENZA SOCIALE,,AGGIUDICATA,probabile
